A1: 玩法组 | B1: 玩法 | C1: 玩法说明 | D1: 中奖举例 | E1: 中奖概率 | F1: 投注注数 | G1: 理论赔率 | H1: 奖金组 | I1: 奖金组
H2: 1800 | I2: 1956
A3: 从5颗球中选出5个号码为开奖号码，数字为0到9号，数字可重复开出
A4: 五星直选 | B4: 直选（复式） | C4: 从万位、千位、百位、十位、个位中选择一个5位数号码组成一注，所选号码与开奖号码全部相同，且顺序一致，即为中奖。 | D4: 如：投注方案：23456；开奖号码：23456，即中五星直选。 | E4: =1/(10*10*10*10*10) -> 0.00001 | F4: 1 | G4: =(1/E4)*F4 -> 99999.999999999985 | H4: =2*G4*1800/2000 -> 179999.99999999997 | I4: =2*G4*1956/2000 -> 195599.99999999997
B5: 直选（单式） | C5: 手动输入一个5位数号码组成一注，所选号码的万位、千位、百位、十位、个位与开奖号码相同，且顺序一致，即为中奖。 | D5: 如：投注方案：23456；开奖号码：23456，即中五星直选。 | E5: =1/(10*10*10*10*10) -> 0.00001 | F5: 1 | G5: =(1/E5)*F5 -> 99999.999999999985 | H5: =2*G5*1800/2000 -> 179999.99999999997 | I5: =2*G5*1956/2000 -> 195599.99999999997
B6: 组合：一等奖 | C6: 从万位、千位、百位、十位、个位中至少各选一个号码组成1-5星的组合，共五注，所选号码的个位与开奖号码全部相同，则中1个5等奖；所选号码的个位、十位与开奖号码相同，则中1个5等奖以及1个4等奖，依此类推，最高可中5个奖。 | D6: 如：五星组合示例，如购买：4+5+6+7+8，该票共10元，由以下5注：45678(五星)、5678(四星)、678(三星)、78(二星) 、8(一星)构成。开奖号码：45678，即可中五星、四星、三星、二星、一星各1注。 | E6: =1/(10*10*10*10*10) -> 0.00001 | F6: 1 | G6: =(1/E6)*F6 -> 99999.999999999985 | H6: =2*G6*1800/2000 -> 179999.99999999997 | I6: =2*G6*1956/2000 -> 195599.99999999997
B7: 组合：二等奖 | E7: =1/(10*10*10*10) -> 0.0001 | F7: 1 | G7: =(1/E7)*F7 -> 10000 | H7: =2*G7*1800/2000 -> 18000 | I7: =2*G7*1956/2000 -> 19560
B8: 组合：三等奖 | E8: =1/(10*10*10) -> 0.001 | F8: 1 | G8: =(1/E8)*F8 -> 1000 | H8: =2*G8*1800/2000 -> 1800 | I8: =2*G8*1956/2000 -> 1956
B9: 组合：四等奖 | E9: =1/(10*10) -> 0.01 | F9: 1 | G9: =(1/E9)*F9 -> 100 | H9: =2*G9*1800/2000 -> 180 | I9: =2*G9*1956/2000 -> 195.60
B10: 组合：五等奖 | E10: =1/(10) -> 0.1 | F10: 1 | G10: =(1/E10)*F10 -> 10 | H10: =2*G10*1800/2000 -> 18 | I10: =2*G10*1956/2000 -> 19.56
A11: 五星组选 | B11: 五星组选120 | C11: 从0-9中任意选择5个号码组成一注，所选号码与开奖号码的万位、千位、百位、十位、个位相同，顺序不限，即为中奖。 | D11: 如：投注方案：02568，开奖号码的5个数字必须包含02568（例如：08526），顺序不限，即可中五星组选120。 | E11: =120/10000 -> 0.012 | F11: 1 | G11: =(1/E11)*F11 -> 83.333333333333329 | H11: =2*G11*1800/2000 -> 150 | I11: =2*G11*1956/2000 -> 163
B12: 五星组选60 | C12: 选择1个二重号码和3个单号号码组成一注，所选的单号号码与开奖号码相同，且所选二重号码在开奖号码中出现了2次，即为中奖。 | D12: 如：投注方案：二重号：8；单号：025，开奖号码的5个数字必须包含单号025，以及对子号8（例如02858），顺序不限，即可中五星组选60。 | E12: =60/10000 -> 0.006 | F12: 1 | G12: =(1/E12)*F12 -> 166.66666666666666 | H12: =2*G12*1800/2000 -> 300 | I12: =2*G12*1956/2000 -> 326
B13: 五星组选30 | C13: 选择2个二重号和1个单号号码组成一注，所选的单号号码与开奖号码相同，且所选的2个二重号码分别在开奖号码中出现了2次，即为中奖。 | D13: 如：投注方案：二重号：2、8；单号：0，开奖号码的5个数字必须包含单号0，以及对子号2和8（例如28082），顺序不限，即可中五星组选30。 | E13: =30/10000 -> 0.003 | F13: 1 | G13: =(1/E13)*F13 -> 333.33333333333331 | H13: =2*G13*1800/2000 -> 600 | I13: =2*G13*1956/2000 -> 652
B14: 五星组选20 | C14: 选择1个三重号码和2个单号号码组成一注，所选的单号号码与开奖号码相同，且所选三重号码在开奖号码中出现了3次，即为中奖。 | D14: 如：投注方案：三重号：8；单号：0、2，开奖号码的5个数字必须包含单号0和2，以及三重号8（例如80828），顺序不限，即可中五星组选20。 | E14: =20/10000 -> 0.002 | F14: 1 | G14: =(1/E14)*F14 -> 500 | H14: =2*G14*1800/2000 -> 900 | I14: =2*G14*1956/2000 -> 978
B15: 五星组选10 | C15: 选择1个三重号码和1个二重号码，所选三重号码在开奖号码中出现3次，并且所选二重号码在开奖号码中出现了2次，即为中奖。 | D15: 如：投注方案：三重号：8；二重号：2，开奖号码的5个数字必须包含三重号8，以及对子号2（例如28828），顺序不限，即可中五星组选10。 | E15: =10/10000 -> 0.001 | F15: 1 | G15: =(1/E15)*F15 -> 1000 | H15: =2*G15*1800/2000 -> 1800 | I15: =2*G15*1956/2000 -> 1956
B16: 五星组选5 | C16: 选择1个四重号码和1个单号号码组成一注，所选的单号号码与开奖号码相同，且所选四重号码在开奖号码中出现了4次，即为中奖。 | D16: 如：投注方案：四重号：8；单号：2，开奖号码的5个数字必须包含四重号8，以及单号2（例如88828），顺序不限，即可中五星组选5。 | E16: =5/10000 -> 0.0005 | F16: 1 | G16: =(1/E16)*F16 -> 2000 | H16: =2*G16*1800/2000 -> 3600 | I16: =2*G16*1956/2000 -> 3912
A17: 四直选/任选 | B17: 直选（复式） | C17: 从千位、百位、十位、个位中选择一个4位数号码组成一注，所选号码与开奖号码相同，且顺序一致，即为中奖。 | D17: 如：投注方案：3456；开奖号码：*3456，即中四星直选。 | E17: =1/10000 -> 0.0001 | F17: 1 | G17: =(1/E17)*F17 -> 10000 | H17: =2*G17*1800/2000 -> 18000 | I17: =2*G17*1956/2000 -> 19560
B18: 直选（单式） | C18: 手动输入一个4位数号码组成一注，所选号码的千位、百位、十位、个位与开奖号码相同，且顺序一致，即为中奖。 | D18: 如：投注方案：3456；开奖号码：*3456，即中四星直选。 | E18: =1/10000 -> 0.0001 | F18: 1 | G18: =(1/E18)*F18 -> 10000 | H18: =2*G18*1800/2000 -> 18000 | I18: =2*G18*1956/2000 -> 19560
B19: 组合：一等奖 | C19: 从千位、百位、十位、个位中至少各选一个号码组成1-4星的组合，共四注，所选号码的个位与开奖号码相同，则中1个4等奖；所选号码的个位、十位与开奖号码相同，则中1个4等奖以及1个3等奖，依此类推，最高可中4个奖。 | D19: 如：四星组合示例，如购买：5+6+7+8，该票共8元，由以下4注：5678(四星)、678(三星)、78(二星)、8(一星)构成。开奖号码：*5678，即可中四星、三星、二星、一星各1注。 | E19: =1/10000 -> 0.0001 | F19: 1 | G19: =(1/E19)*F19 -> 10000 | H19: =2*G19*1800/2000 -> 18000 | I19: =2*G19*1956/2000 -> 19560
B20: 组合：二等奖 | E20: =1/1000 -> 0.001 | F20: 1 | G20: =(1/E20)*F20 -> 1000 | H20: =2*G20*1800/2000 -> 1800 | I20: =2*G20*1956/2000 -> 1956
B21: 组合：三等奖 | E21: =1/100 -> 0.01 | F21: 1 | G21: =(1/E21)*F21 -> 100 | H21: =2*G21*1800/2000 -> 180 | I21: =2*G21*1956/2000 -> 195.60
B22: 组合：四等奖 | E22: =1/10 -> 0.1 | F22: 1 | G22: =(1/E22)*F22 -> 10 | H22: =2*G22*1800/2000 -> 18 | I22: =2*G22*1956/2000 -> 19.56
A23: 四星组选 | B23: 四星组选24 | C23: 从0-9中任意选择4个号码组成一注，所选号码与开奖号码的千位、百位、十位、个位相同，且顺序不限，即为中奖。 | D23: 如：投注方案：0568，开奖号码的后4个数字必须包含0568（例如0856），顺序不限，即可中四星组选24。 | E23: =24/10000 -> 0.0024 | F23: 1 | G23: =(1/E23)*F23 -> 416.66666666666669 | H23: =2*G23*1800/2000 -> 750 | I23: =2*G23*1956/2000 -> 815
B24: 四星组选12 | C24: 从千位、百位、十位、个位中，选择1个二重号码和2个单号号码组成一注，所选单号号码与开奖号码相同，且所选二重号码在开奖号码中出现了2次，即为中奖。 | D24: 如：投注方案：二重号：8；单号：0、6，开奖号码的后4个数字必须包含单号0、6和对子号8（例如0868），顺序不限，即可中四星组选12。 | E24: =12/10000 -> 0.0012 | F24: 1 | G24: =(1/E24)*F24 -> 833.33333333333337 | H24: =2*G24*1800/2000 -> 1500 | I24: =2*G24*1956/2000 -> 1630
B25: 四星组选6 | C25: 从千位、百位、十位、个位中，选择2个二重号码组成一注，所选的2个二重号码在开奖号码中分别出现了2次，即为中奖。 | D25: 如：投注方案：二重号：2、8，开奖号码的后4个数字必须包含两个对子号2和8（例如2882），顺序不限，即可中四星组选6。 | E25: =6/10000 -> 0.0006 | F25: 1 | G25: =(1/E25)*F25 -> 1666.6666666666667 | H25: =2*G25*1800/2000 -> 3000 | I25: =2*G25*1956/2000 -> 3260
B26: 四星组选4 | C26: 从千位、百位、十位、个位中，选择1个三重号码和1个单号号码组成一注，所选单号号码与开奖号码相同，且所选三重号码在开奖号码中出现了3次，即为中奖。 | D26: 如：投注方案：三重号：8；单号：2，开奖号码的后4个数字必须包含三重号8，以及单号2（比如8828）顺序不限，即可中四星组选4。 | E26: =4/10000 -> 0.0004 | F26: 1 | G26: =(1/E26)*F26 -> 2500 | H26: =2*G26*1800/2000 -> 4500 | I26: =2*G26*1956/2000 -> 4890
A27: 三直选/任选 | B27: 直选复式 | C27: 从万位、千位、百位中选择一个3位数号码组成一注，所选号码与开奖号码前3位相同，且顺序一致，即为中奖。 | D27: 如：万位选择1，千位选择2，百位选择3，开奖号码为是123**，即为中奖。 | E27: =1/1000 -> 0.001 | F27: 1 | G27: =(1/E27)*F27 -> 1000 | H27: =2*G27*1800/2000 -> 1800 | I27: =2*G27*1956/2000 -> 1956
B28: 直选单式 | C28: 手动输入一个3位数号码组成一注，所选号码与开奖号码的万位、千位、百位相同，且顺序一致，即为中奖。 | D28: 如：手动输入123，开奖号码为是123**，即为中奖。 | E28: =1/1000 -> 0.001 | F28: 1 | G28: =(1/E28)*F28 -> 1000 | H28: =2*G28*1800/2000 -> 1800 | I28: =2*G28*1956/2000 -> 1956
B29: 直选和值：0和27 | C29: 所选数值等于开奖号码万位、千位、百位三个数字相加之和，即为中奖。 | D29: 如：选择6，开奖号码为123**、141**、114**、006**、060**等任意一个和值为6的结果，即为中奖。 | E29: =1/1000 -> 0.001 | F29: 1 | G29: =(1/E29)*F29 -> 1000 | H29: =2*G29*1800/2000 -> 1800 | I29: =2*G29*1956/2000 -> 1956
B30: 直选和值：1和26 | E30: =3/1000 -> 0.003 | F30: 1 | G30: =(1/E30)*F30 -> 333.33333333333331 | H30: =2*G30*1800/2000 -> 600 | I30: =2*G30*1956/2000 -> 652
B31: 直选和值：2和25 | E31: =6/1000 -> 0.006 | F31: 1 | G31: =(1/E31)*F31 -> 166.66666666666666 | H31: =2*G31*1800/2000 -> 300 | I31: =2*G31*1956/2000 -> 326
B32: 直选和值：3和24 | E32: =10/1000 -> 0.01 | F32: 1 | G32: =(1/E32)*F32 -> 100 | H32: =2*G32*1800/2000 -> 180 | I32: =2*G32*1956/2000 -> 195.60
B33: 直选和值：4和23 | E33: =15/1000 -> 0.015 | F33: 1 | G33: =(1/E33)*F33 -> 66.666666666666671 | H33: =2*G33*1800/2000 -> 120.00000000000001 | I33: =2*G33*1956/2000 -> 130.40
B34: 直选和值：5和22 | E34: =21/1000 -> 0.021 | F34: 1 | G34: =(1/E34)*F34 -> 47.619047619047613 | H34: =2*G34*1800/2000 -> 85.714285714285708 | I34: =2*G34*1956/2000 -> 93.142857142857125
B35: 直选和值：6和21 | E35: =28/1000 -> 0.028 | F35: 1 | G35: =(1/E35)*F35 -> 35.714285714285715 | H35: =2*G35*1800/2000 -> 64.285714285714292 | I35: =2*G35*1956/2000 -> 69.857142857142861
B36: 直选和值：7和20 | E36: =36/1000 -> 0.036 | F36: 1 | G36: =(1/E36)*F36 -> 27.777777777777779 | H36: =2*G36*1800/2000 -> 50 | I36: =2*G36*1956/2000 -> 54.333333333333336
B37: 直选和值：8和19 | E37: =45/1000 -> 0.045 | F37: 1 | G37: =(1/E37)*F37 -> 22.222222222222221 | H37: =2*G37*1800/2000 -> 40 | I37: =2*G37*1956/2000 -> 43.466666666666661
B38: 直选和值：9和18 | E38: =55/1000 -> 0.055 | F38: 1 | G38: =(1/E38)*F38 -> 18.181818181818183 | H38: =2*G38*1800/2000 -> 32.727272727272734 | I38: =2*G38*1956/2000 -> 35.56363636363637
B39: 直选和值：10和17 | E39: =63/1000 -> 0.063 | F39: 1 | G39: =(1/E39)*F39 -> 15.873015873015873 | H39: =2*G39*1800/2000 -> 28.571428571428573 | I39: =2*G39*1956/2000 -> 31.047619047619051
B40: 直选和值：11和16 | E40: =69/1000 -> 0.069 | F40: 1 | G40: =(1/E40)*F40 -> 14.492753623188404 | H40: =2*G40*1800/2000 -> 26.086956521739129 | I40: =2*G40*1956/2000 -> 28.34782608695652
B41: 直选和值：12和15 | E41: =73/1000 -> 0.073 | F41: 1 | G41: =(1/E41)*F41 -> 13.698630136986303 | H41: =2*G41*1800/2000 -> 24.657534246575345 | I41: =2*G41*1956/2000 -> 26.794520547945208
B42: 直选和值：13和14 | E42: =75/1000 -> 0.075 | F42: 1 | G42: =(1/E42)*F42 -> 13.333333333333334 | H42: =2*G42*1800/2000 -> 24 | I42: =2*G42*1956/2000 -> 26.08
A43: 三组选 | B43: 组三 | C43: 从0-9中任意选择2个号码组成两注，所选号码与开奖号码的万位、千位、百位相同，且顺序不限，即为中奖。 | D43: 如：选择12（展开为122**，212**，221** 和112**、121**、211**），开奖号码为212** 或121**，即为中奖。 | E43: =6/1000 -> 0.006 | F43: 1 | G43: =(1/E43)*F43 -> 166.66666666666666 | H43: =2*G43*1800/2000 -> 300 | I43: =2*G43*1956/2000 -> 326
B44: 组六 | C44: 从0-9中任意选择3个号码组成一注，所选号码与开奖号码的万位、千位、百位相同，顺序不限，即为中奖。 | D44: 如：选择123（展开为123**，132**，231**，213**，312**，321**），开奖号码为321**，即为中奖。 | E44: =6/1000 -> 0.006 | F44: 1 | G44: =(1/E44)*F44 -> 166.66666666666666 | H44: =2*G44*1800/2000 -> 300 | I44: =2*G44*1956/2000 -> 326
B45: 组选和值：1和26（组三） | C45: 所选数值等于开奖号码万位、千位、百位三个数字相加之和，即为中奖。 | D45: 如：选择6，开奖号码为114**中组三奖，开奖号码为015**中组六奖。 | E45: =3/1000 -> 0.003 | F45: 1 | G45: =(1/E45)*F45 -> 333.33333333333331 | H45: =2*G45*1800/2000 -> 600 | I45: =2*G45*1956/2000 -> 652
B46: 组选和值：1和26（组六） | E46: 0 | F46: 1 | G46: =(1/E46)*F46 -> #DIV/0! | H46: =2*G46*1800/2000 -> #DIV/0! | I46: =2*G46*1956/2000 -> #DIV/0!
B47: 组选和值：2和25（组三） | E47: =6/1000 -> 0.006 | F47: 1 | G47: =(1/E47)*F47 -> 166.66666666666666 | H47: =2*G47*1800/2000 -> 300 | I47: =2*G47*1956/2000 -> 326
B48: 组选和值：2和25（组六） | E48: 0 | F48: 1 | G48: =(1/E48)*F48 -> #DIV/0! | H48: =2*G48*1800/2000 -> #DIV/0! | I48: =2*G48*1956/2000 -> #DIV/0!
B49: 组选和值：3和24（组三） | E49: =3/1000 -> 0.003 | F49: 1 | G49: =(1/E49)*F49 -> 333.33333333333331 | H49: =2*G49*1800/2000 -> 600 | I49: =2*G49*1956/2000 -> 652
B50: 组选和值：3和24（组六） | E50: =6/1000 -> 0.006 | F50: 1 | G50: =(1/E50)*F50 -> 166.66666666666666 | H50: =2*G50*1800/2000 -> 300 | I50: =2*G50*1956/2000 -> 326
B51: 组选和值：4和23（组三） | E51: =9/1000 -> 0.009 | F51: 1 | G51: =(1/E51)*F51 -> 111.11111111111111 | H51: =2*G51*1800/2000 -> 200 | I51: =2*G51*1956/2000 -> 217.33333333333334
B52: 组选和值：4和23（组六） | E52: =6/1000 -> 0.006 | F52: 1 | G52: =(1/E52)*F52 -> 166.66666666666666 | H52: =2*G52*1800/2000 -> 300 | I52: =2*G52*1956/2000 -> 326
B53: 组选和值：5和22（组三） | E53: =9/1000 -> 0.009 | F53: 1 | G53: =(1/E53)*F53 -> 111.11111111111111 | H53: =2*G53*1800/2000 -> 200 | I53: =2*G53*1956/2000 -> 217.33333333333334
B54: 组选和值：5和22（组六） | E54: =12/1000 -> 0.012 | F54: 1 | G54: =(1/E54)*F54 -> 83.333333333333329 | H54: =2*G54*1800/2000 -> 150 | I54: =2*G54*1956/2000 -> 163
B55: 组选和值：6和21（组三） | E55: =9/1000 -> 0.009 | F55: 1 | G55: =(1/E55)*F55 -> 111.11111111111111 | H55: =2*G55*1800/2000 -> 200 | I55: =2*G55*1956/2000 -> 217.33333333333334
B56: 组选和值：6和21（组六） | E56: =18/1000 -> 0.018 | F56: 1 | G56: =(1/E56)*F56 -> 55.555555555555557 | H56: =2*G56*1800/2000 -> 100 | I56: =2*G56*1956/2000 -> 108.66666666666667
B57: 组选和值：7和20（组三） | E57: =12/1000 -> 0.012 | F57: 1 | G57: =(1/E57)*F57 -> 83.333333333333329 | H57: =2*G57*1800/2000 -> 150 | I57: =2*G57*1956/2000 -> 163
B58: 组选和值：7和20（组六） | E58: =24/1000 -> 0.024 | F58: 1 | G58: =(1/E58)*F58 -> 41.666666666666664 | H58: =2*G58*1800/2000 -> 75 | I58: =2*G58*1956/2000 -> 81.50
B59: 组选和值：8和19（组三） | E59: =15/1000 -> 0.015 | F59: 1 | G59: =(1/E59)*F59 -> 66.666666666666671 | H59: =2*G59*1800/2000 -> 120.00000000000001 | I59: =2*G59*1956/2000 -> 130.40
B60: 组选和值：8和19（组六） | E60: =30/1000 -> 0.03 | F60: 1 | G60: =(1/E60)*F60 -> 33.333333333333336 | H60: =2*G60*1800/2000 -> 60.000000000000007 | I60: =2*G60*1956/2000 -> 65.20
B61: 组选和值：9和18（组三） | E61: =12/1000 -> 0.012 | F61: 1 | G61: =(1/E61)*F61 -> 83.333333333333329 | H61: =2*G61*1800/2000 -> 150 | I61: =2*G61*1956/2000 -> 163
B62: 组选和值：9和18（组六） | E62: =42/1000 -> 0.042 | F62: 1 | G62: =(1/E62)*F62 -> 23.809523809523807 | H62: =2*G62*1800/2000 -> 42.857142857142854 | I62: =2*G62*1956/2000 -> 46.571428571428562
B63: 组选和值：10和17（组三） | E63: =15/1000 -> 0.015 | F63: 1 | G63: =(1/E63)*F63 -> 66.666666666666671 | H63: =2*G63*1800/2000 -> 120.00000000000001 | I63: =2*G63*1956/2000 -> 130.40
B64: 组选和值：10和17（组六） | E64: =48/1000 -> 0.048 | F64: 1 | G64: =(1/E64)*F64 -> 20.833333333333332 | H64: =2*G64*1800/2000 -> 37.50 | I64: =2*G64*1956/2000 -> 40.75
B65: 组选和值：11和16（组三） | E65: =15/1000 -> 0.015 | F65: 1 | G65: =(1/E65)*F65 -> 66.666666666666671 | H65: =2*G65*1800/2000 -> 120.00000000000001 | I65: =2*G65*1956/2000 -> 130.40
B66: 组选和值：11和16（组六） | E66: =54/1000 -> 0.054 | F66: 1 | G66: =(1/E66)*F66 -> 18.518518518518519 | H66: =2*G66*1800/2000 -> 33.333333333333336 | I66: =2*G66*1956/2000 -> 36.222222222222229
B67: 组选和值：12和15（组三） | E67: =12/1000 -> 0.012 | F67: 1 | G67: =(1/E67)*F67 -> 83.333333333333329 | H67: =2*G67*1800/2000 -> 150 | I67: =2*G67*1956/2000 -> 163
B68: 组选和值：12和15（组六） | E68: =60/1000 -> 0.06 | F68: 1 | G68: =(1/E68)*F68 -> 16.666666666666668 | H68: =2*G68*1800/2000 -> 30.000000000000004 | I68: =2*G68*1956/2000 -> 32.60
B69: 组选和值：13和14（组三） | E69: =15/1000 -> 0.015 | F69: 1 | G69: =(1/E69)*F69 -> 66.666666666666671 | H69: =2*G69*1800/2000 -> 120.00000000000001 | I69: =2*G69*1956/2000 -> 130.40
B70: 组选和值：13和14（组六） | E70: =60/1000 -> 0.06 | F70: 1 | G70: =(1/E70)*F70 -> 16.666666666666668 | H70: =2*G70*1800/2000 -> 30.000000000000004 | I70: =2*G70*1956/2000 -> 32.60
B71: 混合组选：组三 | C71: 键盘手动输入购买号码，3个数字为一注，开奖号码的万位、千位、百位符合前三的组三或组六均为中奖。 | D71: 如：手动输入123、455，开奖号码为321**即中组六奖，开奖号码为545**即中组三奖。 | E71: =6/1000 -> 0.006 | F71: 1 | G71: =(1/E71)*F71 -> 166.66666666666666 | H71: =2*G71*1800/2000 -> 300 | I71: =2*G71*1956/2000 -> 326
B72: 混合组选：组六 | E72: =6/1000 -> 0.006 | F72: 1 | G72: =(1/E72)*F72 -> 166.66666666666666 | H72: =2*G72*1800/2000 -> 300 | I72: =2*G72*1956/2000 -> 326
A73: 二直选/任选 | B73: 直选复式 | C73: 从万位和千位上至少各选1个号码，所选号码与开奖号码的万位、千位相同，且顺序一致，即为中奖。 | D73: 如：万位选择3，千位选择4，开出34***即为中奖。 | E73: =1/100 -> 0.01 | F73: 1 | G73: =(1/E73)*F73 -> 100 | H73: =2*G73*1800/2000 -> 180 | I73: =2*G73*1956/2000 -> 195.60
B74: 直选单式 | C74: 手动输入一个2位数号码组成一注，所选号码与开奖号码的万位、千位相同，且顺序一致，即为中奖。 | D74: 如：手动输入12，开奖号码为是12***，即为中奖。 | E74: =1/100 -> 0.01 | F74: 1 | G74: =(1/E74)*F74 -> 100 | H74: =2*G74*1800/2000 -> 180 | I74: =2*G74*1956/2000 -> 195.60
B75: 直选和值：0和18 | C75: 所选数值等于开奖号码的万位、千位两个数字相加之和，即为中奖。 | D75: 如：和值8；开奖号码前二位08或者80（顺序不限，不含对子号），即为中奖。 | E75: =1/100 -> 0.01 | F75: 1 | G75: =(1/E75)*F75 -> 100 | H75: =2*G75*1800/2000 -> 180 | I75: =2*G75*1956/2000 -> 195.60
B76: 直选和值：1和17 | E76: =2/100 -> 0.02 | F76: 1 | G76: =(1/E76)*F76 -> 50 | H76: =2*G76*1800/2000 -> 90 | I76: =2*G76*1956/2000 -> 97.80
B77: 直选和值：2和16 | E77: =3/100 -> 0.03 | F77: 1 | G77: =(1/E77)*F77 -> 33.333333333333336 | H77: =2*G77*1800/2000 -> 60.000000000000007 | I77: =2*G77*1956/2000 -> 65.20
B78: 直选和值：3和15 | E78: =4/100 -> 0.04 | F78: 1 | G78: =(1/E78)*F78 -> 25 | H78: =2*G78*1800/2000 -> 45 | I78: =2*G78*1956/2000 -> 48.90
B79: 直选和值：4和14 | E79: =5/100 -> 0.05 | F79: 1 | G79: =(1/E79)*F79 -> 20 | H79: =2*G79*1800/2000 -> 36 | I79: =2*G79*1956/2000 -> 39.119999999999997
B80: 直选和值：5和13 | E80: =6/100 -> 0.06 | F80: 1 | G80: =(1/E80)*F80 -> 16.666666666666668 | H80: =2*G80*1800/2000 -> 30.000000000000004 | I80: =2*G80*1956/2000 -> 32.60
B81: 直选和值：6和12 | E81: =7/100 -> 0.07 | F81: 1 | G81: =(1/E81)*F81 -> 14.285714285714285 | H81: =2*G81*1800/2000 -> 25.714285714285715 | I81: =2*G81*1956/2000 -> 27.942857142857143
B82: 直选和值：7和11 | E82: =8/100 -> 0.08 | F82: 1 | G82: =(1/E82)*F82 -> 12.50 | H82: =2*G82*1800/2000 -> 22.50 | I82: =2*G82*1956/2000 -> 24.45
B83: 直选和值：8和10 | E83: =9/100 -> 0.09 | F83: 1 | G83: =(1/E83)*F83 -> 11.111111111111111 | H83: =2*G83*1800/2000 -> 20 | I83: =2*G83*1956/2000 -> 21.733333333333331
B84: 直选和值：9 | E84: =10/100 -> 0.1 | F84: 1 | G84: =(1/E84)*F84 -> 10 | H84: =2*G84*1800/2000 -> 18 | I84: =2*G84*1956/2000 -> 19.56
A85: 二星组选 | B85: 组选复式 | C85: 从0-9中选2个号码组成一注，所择号码与开奖号码的万位、千位相同，顺序不限，即为中奖。 | D85: 如：选择7、8，开奖号码78***或87***，即为中奖。 | E85: =2/100 -> 0.02 | F85: 1 | G85: =(1/E85)*F85 -> 50 | H85: =2*G85*1800/2000 -> 90 | I85: =2*G85*1956/2000 -> 97.80
B86: 组选单式 | C86: 手动输入购买号码，2个数字为一注，所选号码与开奖号码的万位、千位相同，顺序不限，即为中奖。 | D86: 如：手动输入12，开奖号码为是21***或12***，即为中奖。 | E86: =2/100 -> 0.02 | F86: 1 | G86: =(1/E86)*F86 -> 50 | H86: =2*G86*1800/2000 -> 90 | I86: =2*G86*1956/2000 -> 97.80
B87: 组选和值：1和17 | C87: 所选数值等于开奖号码的万位、千位两个数字相加之和（不含对子号）即为中奖。 | D87: 如：和值8；开奖号码前二位08或者80（顺序不限，不含对子号），即为中奖。 | E87: =2/100 -> 0.02 | F87: 1 | G87: =(1/E87)*F87 -> 50 | H87: =2*G87*1800/2000 -> 90 | I87: =2*G87*1956/2000 -> 97.80
B88: 组选和值：2和16 | E88: =2/100 -> 0.02 | F88: 1 | G88: =(1/E88)*F88 -> 50 | H88: =2*G88*1800/2000 -> 90 | I88: =2*G88*1956/2000 -> 97.80
B89: 组选和值：3和15 | E89: =4/100 -> 0.04 | F89: 1 | G89: =(1/E89)*F89 -> 25 | H89: =2*G89*1800/2000 -> 45 | I89: =2*G89*1956/2000 -> 48.90
B90: 组选和值：4和14 | E90: =4/100 -> 0.04 | F90: 1 | G90: =(1/E90)*F90 -> 25 | H90: =2*G90*1800/2000 -> 45 | I90: =2*G90*1956/2000 -> 48.90
B91: 组选和值：5和13 | E91: =6/100 -> 0.06 | F91: 1 | G91: =(1/E91)*F91 -> 16.666666666666668 | H91: =2*G91*1800/2000 -> 30.000000000000004 | I91: =2*G91*1956/2000 -> 32.60
B92: 组选和值：6和12 | E92: =6/100 -> 0.06 | F92: 1 | G92: =(1/E92)*F92 -> 16.666666666666668 | H92: =2*G92*1800/2000 -> 30.000000000000004 | I92: =2*G92*1956/2000 -> 32.60
B93: 组选和值：7和11 | E93: =8/100 -> 0.08 | F93: 1 | G93: =(1/E93)*F93 -> 12.50 | H93: =2*G93*1800/2000 -> 22.50 | I93: =2*G93*1956/2000 -> 24.45
B94: 组选和值：8和10 | E94: =8/100 -> 0.08 | F94: 1 | G94: =(1/E94)*F94 -> 12.50 | H94: =2*G94*1800/2000 -> 22.50 | I94: =2*G94*1956/2000 -> 24.45
B95: 组选和值：9 | E95: =10/100 -> 0.1 | F95: 1 | G95: =(1/E95)*F95 -> 10 | H95: =2*G95*1800/2000 -> 18 | I95: =2*G95*1956/2000 -> 19.56
A96: 定位胆 | B96: 万位 | C96: 从万位、千位、百位、十位、个位任意1个位置或多个位置上选择1个号码，所选号码与相同位置上的开奖号码一致，即为中奖。 | D96: 如：定万位为1，开奖号码为1****即为中奖。 | E96: =1/10 -> 0.1 | F96: 1 | G96: =(1/E96)*F96 -> 10 | H96: =2*G96*1800/2000 -> 18 | I96: =2*G96*1956/2000 -> 19.56
B97: 千位 | D97: 如：定千位为2，开奖号码为*2***即为中奖。 | E97: =1/10 -> 0.1 | F97: 1 | G97: =(1/E97)*F97 -> 10 | H97: =2*G97*1800/2000 -> 18 | I97: =2*G97*1956/2000 -> 19.56
B98: 百位 | D98: 如：定百位为3，开奖号码为**3**即为中奖。 | E98: =1/10 -> 0.1 | F98: 1 | G98: =(1/E98)*F98 -> 10 | H98: =2*G98*1800/2000 -> 18 | I98: =2*G98*1956/2000 -> 19.56
B99: 十位 | D99: 如：定十位为4，开奖号码为***4*即为中奖。 | E99: =1/10 -> 0.1 | F99: 1 | G99: =(1/E99)*F99 -> 10 | H99: =2*G99*1800/2000 -> 18 | I99: =2*G99*1956/2000 -> 19.56
B100: 个位 | D100: 如：定个位为5，开奖号码为****5即为中奖。 | E100: =1/10 -> 0.1 | F100: 1 | G100: =(1/E100)*F100 -> 10 | H100: =2*G100*1800/2000 -> 18 | I100: =2*G100*1956/2000 -> 19.56
A101: 不定胆 | B101: 三星一码不定位 | C101: 从0-9中任意选择1个号码组成一注，只要开奖号码的百位、十位、个位任意位置中同时包含所选的号码，即为中奖。开出多重号奖金无加倍。 | D101: 投注方案：1；开奖号码后三位：在任意位置上出现1，即中后三一码不定位。 | E101: =271/1000 -> 0.271 | F101: 1 | G101: =(1/E101)*F101 -> 3.6900369003690034 | H101: =2*G101*1800/2000 -> 6.6420664206642055 | I101: =2*G101*1956/2000 -> 7.2177121771217712
B102: 三星二码不定位 | C102: 从0-9中任意选择2个号码组成一注，只要开奖号码的百位、十位、个位任意位置中同时包含所选的号码，即为中奖。开出多重号奖金无加倍。 | D102: 投注方案：1,2；开奖号码后三位：在任意位置上出现1和2，即中后三二码不定位。 | E102: =(60-6)/1000 -> 0.054 | F102: 1 | G102: =(1/E102)*F102 -> 18.518518518518519 | H102: =2*G102*1800/2000 -> 33.333333333333336 | I102: =2*G102*1956/2000 -> 36.222222222222229
B103: 四星一码不定胆 | C103: 从0-9中至少选择三个号码，每三个号码作为一注。若开奖号码的千位、百位、十位、个位中包含所选的一个号码（顺序不限），即为中奖。 | D103: 投注方案：1；开奖号码前四位：在任意位置上出现1，即中前四星一码不定位。 | E103: =(1000+900+810+729)/10000 -> 0.3439 | F103: 1 | G103: =(1/E103)*F103 -> 2.9078220412910731 | H103: =2*G103*1800/2000 -> 5.2340796743239313 | I103: =2*G103*1956/2000 -> 5.6876999127653391
B104: 四星二码不定胆 | C104: 从0-9中至少选择三个号码，每三个号码作为一注。若开奖号码的千位、百位、十位、个位中包含所选的二个号码（顺序不限），即为中奖。 | D104: 投注方案：1,2；开奖号码前四位：在任意位置上出现1和2，即中前四星二码不定位。 | E104: =974/10000 -> 0.0974 | F104: 1 | G104: =(1/E104)*F104 -> 10.266940451745381 | H104: =2*G104*1800/2000 -> 18.480492813141687 | I104: =2*G104*1956/2000 -> 20.082135523613964
B105: 四星三码不定胆 | C105: 从0-9中至少选择三个号码，每三个号码作为一注。若开奖号码的千位、百位、十位、个位中包含所选的三个号码（顺序不限），即为中奖。 | D105: 投注方案：1,2,3；开奖号码：24371，在万位、千位、百位、十位的任意位置上出现1、2和3，即中四星三码不定位。 | E105: =204/10000 -> 0.0204 | F105: 1 | G105: =(1/E105)*F105 -> 49.019607843137251 | H105: =2*G105*1800/2000 -> 88.235294117647044 | I105: =2*G105*1956/2000 -> 95.882352941176464
B106: 五星一码不定胆 | C106: 从0-9中任意选择1个号码组成一注，只要开奖号码的万位、千位、百位、十位、个位任意位置中包含所选的号码，即为中奖。开出多重号奖金无加倍。 | D106: 投注方案：1；开奖号码：34137，在万位、千位、百位、十位、个位的任意位置上出现1，即中五星一码不定位。 | E106: =34390/100000 -> 0.3439 | F106: 1 | G106: =(1/E106)*F106 -> 2.9078220412910731 | H106: =2*G106*1800/2000 -> 5.2340796743239313 | I106: =2*G106*1956/2000 -> 5.6876999127653391
B107: 五星二码不定胆 | C107: 从0-9中任意选择2个号码组成一注，只要开奖号码的万位、千位、百位、十位、个位任意位置中同时包含所选的号码，即为中奖。开出多重号奖金无加倍。 | D107: 投注方案：1,2；开奖号码：24371，在万位、千位、百位、十位、个位的任意位置上出现1和2，即中五星二码不定位。 | E107: =14670/100000 -> 0.1467 | F107: 1 | G107: =(1/E107)*F107 -> 6.8166325835037496 | H107: =2*G107*1800/2000 -> 12.269938650306749 | I107: =2*G107*1956/2000 -> 13.333333333333334
B108: 五星三码不定胆 | C108: 从0-9中任意选择3个号码组成一注，只要开奖号码的万位、千位、百位、十位、个位任意位置中同时包含所选的号码，即为中奖。开出多重号奖金无加倍。 | D108: 投注方案：1,2,3；开奖号码：24371，在万位、千位、百位、十位、个位的任意位置上出现1、2和3，即中五星三码不定位。 | E108: =4350/100000 -> 0.0435 | F108: 1 | G108: =(1/E108)*F108 -> 22.988505747126439 | H108: =2*G108*1800/2000 -> 41.379310344827587 | I108: =2*G108*1956/2000 -> 44.96551724137931
A109: 大小单双 | B109: 五星总和大小单双 | C109: 对个位至万位的总和的"大(23以上，包括23)小(22以下，包括22)、单(奇数)双(偶数)"型态进行购买，所选号码的位型态与开奖号码的形态相同，即为中奖。 | D109: 投注方案：大，开奖号码67895(6+7+8+9+5=35)，即中比大小一等奖。投注方案：单，开奖号码12345(1+2+3+4+5=15)，即中比单双一等奖。 | E109: =1/2 -> 0.5 | F109: 1 | G109: =(1/E109)*F109 -> 2 | H109: =2*G109*1800/2000 -> 3.60 | I109: =2*G109*1956/2000 -> 3.9119999999999999
B110: 五星总和大小单双：大单 | E110: =12/23 -> 0.52173913 | F110: 1 | G110: =(1/E110)*F110 -> 1.9166666666666667 | H110: =2*G110*1800/2000 -> 3.45 | I110: =2*G110*1956/2000 -> 3.7490000000000001
B111: 五星总和大小单双：大双 | E111: =11/23 -> 0.47826087 | F111: 1 | G111: =(1/E111)*F111 -> 2.0909090909090908 | H111: =2*G111*1800/2000 -> 3.7636363636363637 | I111: =2*G111*1956/2000 -> 4.0898181818181811
B112: 五星总和大小单双：小单 | E112: =11/23 -> 0.47826087 | F112: 1 | G112: =(1/E112)*F112 -> 2.0909090909090908 | H112: =2*G112*1800/2000 -> 3.7636363636363637 | I112: =2*G112*1956/2000 -> 4.0898181818181811
B113: 五星总和大小单双：小双 | E113: =12/23 -> 0.52173913 | F113: 1 | G113: =(1/E113)*F113 -> 1.9166666666666667 | H113: =2*G113*1800/2000 -> 3.45 | I113: =2*G113*1956/2000 -> 3.7490000000000001
B114: 三星总和大小单双 | C114: 对百位至万位的总和的"大(14以上，包括14)小(13以下，包括13)、单(奇数)双(偶数)"型态进行购买，所选号码的位型态与开奖号码的形态相同，即为中奖。 | D114: 投注方案：大，开奖号码67895(6+7+8=21)，即中比大小一等奖。投注方案：双，开奖号码12345(1+2+3=6)，即中比单双一等奖。 | E114: =1/2 -> 0.5 | F114: 1 | G114: =(1/E114)*F114 -> 2 | H114: =2*G114*1800/2000 -> 3.60 | I114: =2*G114*1956/2000 -> 3.9119999999999999
B115: 三星总和大小单双：大单 | E115: =7/14 -> 0.5 | F115: 1 | G115: =(1/E115)*F115 -> 2 | H115: =2*G115*1800/2000 -> 3.60 | I115: =2*G115*1956/2000 -> 3.9119999999999999
B116: 三星总和大小单双：大双 | E116: =7/14 -> 0.5 | F116: 1 | G116: =(1/E116)*F116 -> 2 | H116: =2*G116*1800/2000 -> 3.60 | I116: =2*G116*1956/2000 -> 3.9119999999999999
B117: 三星总和大小单双：小单 | E117: =7/14 -> 0.5 | F117: 1 | G117: =(1/E117)*F117 -> 2 | H117: =2*G117*1800/2000 -> 3.60 | I117: =2*G117*1956/2000 -> 3.9119999999999999
B118: 三星总和大小单双：小双 | E118: =7/14 -> 0.5 | F118: 1 | G118: =(1/E118)*F118 -> 2 | H118: =2*G118*1800/2000 -> 3.60 | I118: =2*G118*1956/2000 -> 3.9119999999999999
B119: 三星大小单双 | C119: 从万位、千位和百位的“大（56789）小（01234）、单（13579）双（02468）”中各选1个形态组成一注，所选号码的位置、形态与开奖号码的位置、形态相同，即为中奖。 | D119: 投注方案：小双小；开奖号码万位上为：（01234)中的一个、千位：（02468）中的一个、百位：（01234）中的一个，即中前三大小单双一等奖。 | E119: =1/8 -> 0.125 | F119: 1 | G119: =(1/E119)*F119 -> 8 | H119: =2*G119*1800/2000 -> 14.40 | I119: =2*G119*1956/2000 -> 15.648
B120: 二星大小单双 | C120: 对万位和千位的“大（56789）小（01234）、单（13579）双（02468）”形态进行购买，所选号码的位置、形态与开奖号码的位置、形态相同，即为中奖。 | D120: 如：万位选择大，千位选择单，开出63***即为中奖。 | E120: =1/4 -> 0.25 | F120: 1 | G120: =(1/E120)*F120 -> 4 | H120: =2*G120*1800/2000 -> 7.20 | I120: =2*G120*1956/2000 -> 7.8239999999999998
B121: 五星大小个数：全大 | C121: 对5个号码中大号与小号的个数进行选择，所选号码与开奖号码的大小个数相同，即为中奖。 | D121: 投注方案：全大，开奖号码67895，即中五星大小个数一等奖。投注方案：4大1小，开奖号码79385，即中五星大小个数二等奖。 | E121: =1/32 -> 0.03125 | F121: 1 | G121: =(1/E121)*F121 -> 32 | H121: =2*G121*1800/2000 -> 57.60 | I121: =2*G121*1956/2000 -> 62.591999999999999
B122: 五星大小个数：4大1小 | E122: =5/32 -> 0.15625 | F122: 1 | G122: =(1/E122)*F122 -> 6.40 | H122: =2*G122*1800/2000 -> 11.52 | I122: =2*G122*1956/2000 -> 12.518400000000002
B123: 五星大小个数：3大2小 | E123: =10/32 -> 0.3125 | F123: 1 | G123: =(1/E123)*F123 -> 3.20 | H123: =2*G123*1800/2000 -> 5.76 | I123: =2*G123*1956/2000 -> 6.2592000000000008
B124: 五星大小个数：2大3小 | E124: =10/32 -> 0.3125 | F124: 1 | G124: =(1/E124)*F124 -> 3.20 | H124: =2*G124*1800/2000 -> 5.76 | I124: =2*G124*1956/2000 -> 6.2592000000000008
B125: 五星大小个数：1大4小 | E125: =5/32 -> 0.15625 | F125: 1 | G125: =(1/E125)*F125 -> 6.40 | H125: =2*G125*1800/2000 -> 11.52 | I125: =2*G125*1956/2000 -> 12.518400000000002
B126: 五星大小个数：全小 | E126: =1/32 -> 0.03125 | F126: 1 | G126: =(1/E126)*F126 -> 32 | H126: =2*G126*1800/2000 -> 57.60 | I126: =2*G126*1956/2000 -> 62.591999999999999
B127: 四星大小个数：全大 | C127: 对千、百、十、个4个号码中大号与小号的个数进行选择，所选号码与开奖号码的大小个数相同，即为中奖。 | D127: 投注方案：全大，开奖号码67895，即中四星大小个数一等奖。投注方案：3大1小，开奖号码79385，即中四星大小个数二等奖。 | E127: =1/16 -> 0.0625 | F127: 1 | G127: =(1/E127)*F127 -> 16 | H127: =2*G127*1800/2000 -> 28.80 | I127: =2*G127*1956/2000 -> 31.295999999999999
B128: 四星大小个数：3大1小 | E128: =6/24 -> 0.25 | F128: 1 | G128: =(1/E128)*F128 -> 4 | H128: =2*G128*1800/2000 -> 7.20 | I128: =2*G128*1956/2000 -> 7.8239999999999998
B129: 四星大小个数：2大2小 | E129: =4/24 -> 0.166666667 | F129: 1 | G129: =(1/E129)*F129 -> 6 | H129: =2*G129*1800/2000 -> 10.80 | I129: =2*G129*1956/2000 -> 11.736000000000001
B130: 四星大小个数：1大3小 | E130: =6/24 -> 0.25 | F130: 1 | G130: =(1/E130)*F130 -> 4 | H130: =2*G130*1800/2000 -> 7.20 | I130: =2*G130*1956/2000 -> 7.8239999999999998
B131: 四星大小个数：全小 | E131: =1/16 -> 0.0625 | F131: 1 | G131: =(1/E131)*F131 -> 16 | H131: =2*G131*1800/2000 -> 28.80 | I131: =2*G131*1956/2000 -> 31.295999999999999
B132: 三星大小个数：全大 | C132: 对千、百、十3个号码中大号与小号的个数进行选择，所选号码与开奖号码的大小个数相同，即为中奖。 | D132: 投注方案：全大，开奖号码67895，即中三星大小个数一等奖。投注方案：2大1小，开奖号码79385，即中三星大小个数二等奖。 | E132: =1/8 -> 0.125 | F132: 1 | G132: =(1/E132)*F132 -> 8 | H132: =2*G132*1800/2000 -> 14.40 | I132: =2*G132*1956/2000 -> 15.648
B133: 三星大小个数：2大1小 | E133: =3/8 -> 0.375 | F133: 1 | G133: =(1/E133)*F133 -> 2.6666666666666665 | H133: =2*G133*1800/2000 -> 4.80 | I133: =2*G133*1956/2000 -> 5.2160000000000002
B134: 三星大小个数：1大2小 | E134: =3/8 -> 0.375 | F134: 1 | G134: =(1/E134)*F134 -> 2.6666666666666665 | H134: =2*G134*1800/2000 -> 4.80 | I134: =2*G134*1956/2000 -> 5.2160000000000002
B135: 三星大小个数：全小 | E135: =1/8 -> 0.125 | F135: 1 | G135: =(1/E135)*F135 -> 8 | H135: =2*G135*1800/2000 -> 14.40 | I135: =2*G135*1956/2000 -> 15.648
B136: 五星单双个数：全单 | C136: 对5个号码中单号与双号的个数进行选择，所选号码与开奖号码的大小个数相同，即为中奖。 | D136: 投注方案：全大，开奖号码37195，即中五星大小个数一等奖。投注方案：4大1小，开奖号码79385，即中五星大小个数二等奖。 | E136: =1/32 -> 0.03125 | F136: 1 | G136: =(1/E136)*F136 -> 32 | H136: =2*G136*1800/2000 -> 57.60 | I136: =2*G136*1956/2000 -> 62.591999999999999
B137: 五星单双个数：4单1双 | E137: =5/32 -> 0.15625 | F137: 1 | G137: =(1/E137)*F137 -> 6.40 | H137: =2*G137*1800/2000 -> 11.52 | I137: =2*G137*1956/2000 -> 12.518400000000002
B138: 五星单双个数：3单2双 | E138: =10/32 -> 0.3125 | F138: 1 | G138: =(1/E138)*F138 -> 3.20 | H138: =2*G138*1800/2000 -> 5.76 | I138: =2*G138*1956/2000 -> 6.2592000000000008
B139: 五星单双个数：2单3双 | E139: =10/32 -> 0.3125 | F139: 1 | G139: =(1/E139)*F139 -> 3.20 | H139: =2*G139*1800/2000 -> 5.76 | I139: =2*G139*1956/2000 -> 6.2592000000000008
B140: 五星单双个数：1单4双 | E140: =5/32 -> 0.15625 | F140: 1 | G140: =(1/E140)*F140 -> 6.40 | H140: =2*G140*1800/2000 -> 11.52 | I140: =2*G140*1956/2000 -> 12.518400000000002
B141: 五星单双个数：全双 | E141: =1/32 -> 0.03125 | F141: 1 | G141: =(1/E141)*F141 -> 32 | H141: =2*G141*1800/2000 -> 57.60 | I141: =2*G141*1956/2000 -> 62.591999999999999
B142: 四星单双个数：全单 | C142: 对千、百、十、个4个号码中单号与双号的个数进行选择，所选号码与开奖号码的大小个数相同，即为中奖。 | D142: 投注方案：全大，开奖号码67195，即中四星大小个数一等奖。投注方案：3大1小，开奖号码79385，即中四星大小个数二等奖。 | E142: =1/16 -> 0.0625 | F142: 1 | G142: =(1/E142)*F142 -> 16 | H142: =2*G142*1800/2000 -> 28.80 | I142: =2*G142*1956/2000 -> 31.295999999999999
B143: 四星单双个数：3单1双 | E143: =6/24 -> 0.25 | F143: 1 | G143: =(1/E143)*F143 -> 4 | H143: =2*G143*1800/2000 -> 7.20 | I143: =2*G143*1956/2000 -> 7.8239999999999998
B144: 四星单双个数：2单2双 | E144: =4/24 -> 0.166666667 | F144: 1 | G144: =(1/E144)*F144 -> 6 | H144: =2*G144*1800/2000 -> 10.80 | I144: =2*G144*1956/2000 -> 11.736000000000001
B145: 四星单双个数：1单3双 | E145: =6/24 -> 0.25 | F145: 1 | G145: =(1/E145)*F145 -> 4 | H145: =2*G145*1800/2000 -> 7.20 | I145: =2*G145*1956/2000 -> 7.8239999999999998
B146: 四星单双个数：全双 | E146: =1/16 -> 0.0625 | F146: 1 | G146: =(1/E146)*F146 -> 16 | H146: =2*G146*1800/2000 -> 28.80 | I146: =2*G146*1956/2000 -> 31.295999999999999
B147: 三星单双个数：全单 | C147: 对千、百、十3个号码中单号与双号的个数进行选择，所选号码与开奖号码的大小个数相同，即为中奖。 | D147: 投注方案：全大，开奖号码67595，即中三星大小个数一等奖。投注方案：2大1小，开奖号码79485，即中三星大小个数二等奖。 | E147: =1/8 -> 0.125 | F147: 1 | G147: =(1/E147)*F147 -> 8 | H147: =2*G147*1800/2000 -> 14.40 | I147: =2*G147*1956/2000 -> 15.648
B148: 三星单双个数：2单1双 | E148: =3/8 -> 0.375 | F148: 1 | G148: =(1/E148)*F148 -> 2.6666666666666665 | H148: =2*G148*1800/2000 -> 4.80 | I148: =2*G148*1956/2000 -> 5.2160000000000002
B149: 三星单双个数：1单2双 | E149: =3/8 -> 0.375 | F149: 1 | G149: =(1/E149)*F149 -> 2.6666666666666665 | H149: =2*G149*1800/2000 -> 4.80 | I149: =2*G149*1956/2000 -> 5.2160000000000002
B150: 三星单双个数：全双 | E150: =1/8 -> 0.125 | F150: 1 | G150: =(1/E150)*F150 -> 8 | H150: =2*G150*1800/2000 -> 14.40 | I150: =2*G150*1956/2000 -> 15.648
A151: 牛牛 | B151: 无牛 | C151: 牛牛～牛9为开奖号码中任意三个数相加个位数为0，另外两个数字相加的个位数为牛的所选号码，即为中奖。 | D151: 牛1～牛9：开奖号码中任意三位数相加个位数可以为0，另外两个数字相加的个位数为所选号码，即为中奖；无牛：开奖号码中任意三位数相加个位数都不是0，即为中奖；牛牛：开奖号码中任意三位数相加个位数可以为0，另外两个数字相加的个位数为0，即为中奖。牛大：选号：大，开奖：04689牛大：牛7＝(0+4+6)、(8+9)，牛6～牛牛为大；牛小：选号：小，开奖：04685牛小：牛3＝(0+4+6)、(8+5)，牛1～牛5为小；牛单：选号：单，开奖04685单号：牛3＝(0+4+6)、(8+5)，牛1/3/5/7/9；牛双：选号：双，开奖04684双号：牛2＝(0+4+6)、(8+4)，牛2/4/6/8/0牛质：牛1、牛2、牛3、牛5、牛7牛合：牛4、牛6、牛8、牛9、牛牛 | E151: =35649/100000 -> 0.35649 | F151: 1 | G151: =(1/E151)*F151 -> 2.8051277735700864 | H151: =2*G151*1800/2000 -> 5.049229992426155 | I151: =2*G151*1956/2000 -> 5.4868299251030885
B152: 牛1 | E152: =6375/100000 -> 0.06375 | F152: 1 | G152: =(1/E152)*F152 -> 15.686274509803921 | H152: =2*G152*1800/2000 -> 28.235294117647054 | I152: =2*G152*1956/2000 -> 30.682352941176468
B153: 牛2 | E153: =6505/100000 -> 0.06505 | F153: 1 | G153: =(1/E153)*F153 -> 15.372790161414297 | H153: =2*G153*1800/2000 -> 27.671022290545736 | I153: =2*G153*1956/2000 -> 30.069177555726366
B154: 牛3 | E154: =6375/100000 -> 0.06375 | F154: 1 | G154: =(1/E154)*F154 -> 15.686274509803921 | H154: =2*G154*1800/2000 -> 28.235294117647054 | I154: =2*G154*1956/2000 -> 30.682352941176468
B155: 牛4 | E155: =6505/100000 -> 0.06505 | F155: 1 | G155: =(1/E155)*F155 -> 15.372790161414297 | H155: =2*G155*1800/2000 -> 27.671022290545736 | I155: =2*G155*1956/2000 -> 30.069177555726366
B156: 牛5 | E156: =6375/100000 -> 0.06375 | F156: 1 | G156: =(1/E156)*F156 -> 15.686274509803921 | H156: =2*G156*1800/2000 -> 28.235294117647054 | I156: =2*G156*1956/2000 -> 30.682352941176468
B157: 牛6 | E157: =6505/100000 -> 0.06505 | F157: 1 | G157: =(1/E157)*F157 -> 15.372790161414297 | H157: =2*G157*1800/2000 -> 27.671022290545736 | I157: =2*G157*1956/2000 -> 30.069177555726366
B158: 牛7 | E158: =6375/100000 -> 0.06375 | F158: 1 | G158: =(1/E158)*F158 -> 15.686274509803921 | H158: =2*G158*1800/2000 -> 28.235294117647054 | I158: =2*G158*1956/2000 -> 30.682352941176468
B159: 牛8 | E159: =6505/100000 -> 0.06505 | F159: 1 | G159: =(1/E159)*F159 -> 15.372790161414297 | H159: =2*G159*1800/2000 -> 27.671022290545736 | I159: =2*G159*1956/2000 -> 30.069177555726366
B160: 牛9 | E160: =6375/100000 -> 0.06375 | F160: 1 | G160: =(1/E160)*F160 -> 15.686274509803921 | H160: =2*G160*1800/2000 -> 28.235294117647054 | I160: =2*G160*1956/2000 -> 30.682352941176468
B161: 牛牛 | E161: =6456/100000 -> 0.06456 | F161: 1 | G161: =(1/E161)*F161 -> 15.489467162329614 | H161: =2*G161*1800/2000 -> 27.881040892193305 | I161: =2*G161*1956/2000 -> 30.297397769516728
B162: 牛大 | E162: =E157+E158+E159+E160+E161 -> 0.32216 | F162: 1 | G162: =(1/E162)*F162 -> 3.1040476781723365 | H162: =2*G162*1800/2000 -> 5.5872858207102052 | I162: =2*G162*1956/2000 -> 6.0715172585050903
B163: 牛小 | E163: =E152+E153+E154+E155+E156 -> 0.32135 | F163: 1 | G163: =(1/E163)*F163 -> 3.1118717908822155 | H163: =2*G163*1800/2000 -> 5.6013692235879882 | I163: =2*G163*1956/2000 -> 6.0868212229656136
B164: 牛单 | E164: =E152+E154+E156+E158+E160 -> 0.31875 | F164: 1 | G164: =(1/E164)*F164 -> 3.1372549019607847 | H164: =2*G164*1800/2000 -> 5.647058823529413 | I164: =2*G164*1956/2000 -> 6.1364705882352943
B165: 牛双 | E165: =E153+E155+E157+E159+E161 -> 0.32476 | F165: 1 | G165: =(1/E165)*F165 -> 3.0791969454366304 | H165: =2*G165*1800/2000 -> 5.5425545017859346 | I165: =2*G165*1956/2000 -> 6.0229092252740495
B166: 牛质 | E166: =E152+E153+E154+E156+E158 -> 0.32005 | F166: 1 | G166: =(1/E166)*F166 -> 3.1245117950320269 | H166: =2*G166*1800/2000 -> 5.6241212310576483 | I166: =2*G166*1956/2000 -> 6.1115450710826442
B167: 牛合 | E167: =E155+E157+E159+E160+E161 -> 0.32346 | F167: 1 | G167: =(1/E167)*F167 -> 3.0915723737092682 | H167: =2*G167*1800/2000 -> 5.5648302726766827 | I167: =2*G167*1956/2000 -> 6.0471155629753284
A168: 梭哈 | B168: 五条 | C168: 以下玩法皆不限顺序。1、五条：开出五个号码中五个相同，如：00000、99999 2、炸弹：开出五个号码中四个相同，如：10000、22221 3、葫芦：开出五个号码中三个相同(三条)及两个号码相同(一对)，如：11222、33444 4、顺子：开出五个号码从小到大排列为01234、12345、23456、34567、45678、56789、06789、01789、 01289、01239 5.5、三条：开出五个号码中三个相同(三条)及两个号码不相同，如：12333、66678 6、两对：开出五个号码中有两组相同，如：00112 、36677 7、单对：开出五个号码中只有一组相同，如：00123、13556 8、散号：开出五个号码没有任何相同或相关联（不含顺子），如：12356、 01345、34678、12579。 | D168: 投注方案：炸弹开奖号码：00001，即中牛牛梭哈 | E168: =10/100000 -> 0.0001 | F168: 1 | G168: =(1/E168)*F168 -> 10000 | H168: =2*G168*1800/2000 -> 18000 | I168: =2*G168*1956/2000 -> 19560
B169: 炸弹 | E169: =450/100000 -> 0.0045 | F169: 1 | G169: =(1/E169)*F169 -> 222.22222222222223 | H169: =2*G169*1800/2000 -> 400 | I169: =2*G169*1956/2000 -> 434.66666666666669
B170: 葫芦 | E170: =1080/100000 -> 0.0108 | F170: 1 | G170: =(1/E170)*F170 -> 92.592592592592581 | H170: =2*G170*1800/2000 -> 166.66666666666666 | I170: =2*G170*1956/2000 -> 181.11111111111109
B171: 顺子 | E171: =(10*9*8*7*6)/100000 -> 0.3024 | F171: 1 | G171: =(1/E171)*F171 -> 3.306878306878307 | H171: =2*G171*1800/2000 -> 5.9523809523809526 | I171: =2*G171*1956/2000 -> 6.4682539682539684
B172: 三条 | E172: =10*9*8/6/100000 -> 0.0012 | F172: 1 | G172: =(1/E172)*F172 -> 833.33333333333337 | H172: =2*G172*1800/2000 -> 1500 | I172: =2*G172*1956/2000 -> 1630
B173: 两对 | E173: =10*10*9*9*8/4/100000 -> 0.162 | F173: 1 | G173: =(1/E173)*F173 -> 6.1728395061728394 | H173: =2*G173*1800/2000 -> 11.111111111111111 | I173: =2*G173*1956/2000 -> 12.074074074074073
B174: 单对 | E174: =10*10*9*8*7/2/100000 -> 0.252 | F174: 1 | G174: =(1/E174)*F174 -> 3.9682539682539684 | H174: =2*G174*1800/2000 -> 7.1428571428571432 | I174: =2*G174*1956/2000 -> 7.7619047619047628
B175: 散号 | E175: =29040/100000 -> 0.2904 | F175: 1 | G175: =(1/E175)*F175 -> 3.443526170798898 | H175: =2*G175*1800/2000 -> 6.1983471074380168 | I175: =2*G175*1956/2000 -> 6.7355371900826446
A176: 趣味 | B176: 一帆风顺 | C176: 从0-9中任意选择1个号码组成一注，只要开奖号码的万位,千位,百位,十位,个位中包含所选号码, 即为中奖。 | D176: 如：投注方案：8，至少出现1个8，即中一帆风顺。 | E176: =9*9*9*9*10/100000 -> 0.6561 | F176: 1 | G176: =(1/E176)*F176 -> 1.5241579027587258 | H176: =2*G176*1800/2000 -> 2.7434842249657061 | I176: =2*G176*1956/2000 -> 2.9812528577960675
B177: 好事成双 | C177: 从0-9中任意选择1个号码组成一注，只要所选号码在开奖号码的万位,千位,百位,十位,个位中出现2次相同，即为中奖。 | D177: 如：投注方案：8；至少出现2个8，即中好事成双。 | E177: =10*9*8*8*8/100000 -> 0.4608 | F177: 1 | G177: =(1/E177)*F177 -> 2.1701388888888888 | H177: =2*G177*1800/2000 -> 3.90625 | I177: =2*G177*1956/2000 -> 4.244791666666667
B178: 三星报喜 | C178: 从0-9中任意选择1个号码组成一注，只要所选号码在开奖号码的万位,千位,百位,十位,个位中出现3次,即为中奖。 | D178: 如：投注方案：8：开奖号码，三重号，即中三星报喜。 | E178: =10*9*8*7*7/100000 -> 0.3528 | F178: 1 | G178: =(1/E178)*F178 -> 2.8344671201814058 | H178: =2*G178*1800/2000 -> 5.1020408163265305 | I178: =2*G178*1956/2000 -> 5.5442176870748296
B179: 四季发财 | C179: 从从0-9中任意选择1个号码组成一注，只要所选号码在开奖号码的万位,千位,百位,十位,个位中出现4次,即为中奖。 | D179: 如：投注方案：8；至少出现4个8，即为四季发财。 | E179: =450/100000 -> 0.0045 | F179: 1 | G179: =(1/E179)*F179 -> 222.22222222222223 | H179: =2*G179*1800/2000 -> 400 | I179: =2*G179*1956/2000 -> 434.66666666666669
A180: 直选跨度 | B180: 二星跨度：0 | C180: 所选数值等于开奖号码的前两位最大与最小数字相减之差，即为中奖。 | D180: 投注跨度号码2，开奖1.3.x.x.x(不限顺序)，『3-1＝2』即为中奖。 | E180: =10/100 -> 0.1 | F180: 10 | G180: =(1/E180)*F180 -> 100 | H180: =2*G180*1800/2000 -> 180 | I180: =2*G180*1956/2000 -> 195.60
B181: 二星跨度：1 | E181: =18/100 -> 0.18 | F181: 18 | G181: =(1/E181)*F181 -> 100 | H181: =2*G181*1800/2000 -> 180 | I181: =2*G181*1956/2000 -> 195.60
B182: 二星跨度：2 | E182: =16/100 -> 0.16 | F182: 16 | G182: =(1/E182)*F182 -> 100 | H182: =2*G182*1800/2000 -> 180 | I182: =2*G182*1956/2000 -> 195.60
B183: 二星跨度：3 | E183: =14/100 -> 0.14 | F183: 14 | G183: =(1/E183)*F183 -> 100 | H183: =2*G183*1800/2000 -> 180 | I183: =2*G183*1956/2000 -> 195.60
B184: 二星跨度：4 | E184: =12/100 -> 0.12 | F184: 12 | G184: =(1/E184)*F184 -> 100 | H184: =2*G184*1800/2000 -> 180 | I184: =2*G184*1956/2000 -> 195.60
B185: 二星跨度：5 | E185: =10/100 -> 0.1 | F185: 10 | G185: =(1/E185)*F185 -> 100 | H185: =2*G185*1800/2000 -> 180 | I185: =2*G185*1956/2000 -> 195.60
B186: 二星跨度：6 | E186: =8/100 -> 0.08 | F186: 8 | G186: =(1/E186)*F186 -> 100 | H186: =2*G186*1800/2000 -> 180 | I186: =2*G186*1956/2000 -> 195.60
B187: 二星跨度：7 | E187: =6/100 -> 0.06 | F187: 6 | G187: =(1/E187)*F187 -> 100 | H187: =2*G187*1800/2000 -> 180 | I187: =2*G187*1956/2000 -> 195.60
B188: 二星跨度：8 | E188: =4/100 -> 0.04 | F188: 4 | G188: =(1/E188)*F188 -> 100 | H188: =2*G188*1800/2000 -> 180 | I188: =2*G188*1956/2000 -> 195.60
B189: 二星跨度：9 | E189: =2/100 -> 0.02 | F189: 2 | G189: =(1/E189)*F189 -> 100 | H189: =2*G189*1800/2000 -> 180 | I189: =2*G189*1956/2000 -> 195.60
B190: 三星跨度：0 | C190: 所选数值等于开奖号码的三星最大与最小数字相减之差，即为中奖。 | D190: 投注跨度号码2，开奖1.2.3.xx(不限顺序)，『3-1=2』即为中奖。 | E190: =10/1000 -> 0.01 | F190: 10 | G190: =(1/E190)*F190 -> 1000 | H190: =2*G190*1800/2000 -> 1800 | I190: =2*G190*1956/2000 -> 1956
B191: 三星跨度：1和9 | E191: =54/1000 -> 0.054 | F191: 54 | G191: =(1/E191)*F191 -> 1000 | H191: =2*G191*1800/2000 -> 1800 | I191: =2*G191*1956/2000 -> 1956
B192: 三星跨度：2和8 | E192: =96/1000 -> 0.096 | F192: 96 | G192: =(1/E192)*F192 -> 1000 | H192: =2*G192*1800/2000 -> 1800 | I192: =2*G192*1956/2000 -> 1956
B193: 三星跨度：3和7 | E193: =126/1000 -> 0.126 | F193: 126 | G193: =(1/E193)*F193 -> 1000 | H193: =2*G193*1800/2000 -> 1800 | I193: =2*G193*1956/2000 -> 1956
B194: 三星跨度：4和6 | E194: =144/1000 -> 0.144 | F194: 144 | G194: =(1/E194)*F194 -> 1000 | H194: =2*G194*1800/2000 -> 1800 | I194: =2*G194*1956/2000 -> 1956
B195: 三星跨度：5 | E195: =150/1000 -> 0.15 | F195: 150 | G195: =(1/E195)*F195 -> 1000 | H195: =2*G195*1800/2000 -> 1800 | I195: =2*G195*1956/2000 -> 1956
A196: 组选包胆 | B196: 二星包胆 | C196: 从0-9中任意选择1个包胆号码，开奖号码的万位、千位中任意1位包含所选的包胆号码相同（不含对子号），即为中奖。 | D196: 投注方案：包胆号码8；开奖号码前二位：出现1个8（不包括2个8），即中前二组选。 | E196: =18/100 -> 0.18 | F196: 9 | G196: =(1/E196)*F196 -> 50 | H196: =2*G196*1800/2000 -> 90 | I196: =2*G196*1956/2000 -> 97.80
B197: 三星包胆：组三 | C197: 从0～9中任意选择1个包胆号码，开奖号码的前三位中任意1位与所选包胆号码相同(不含豹子)，即为中奖。 | D197: 投注包胆号码3：开奖号码前三位：(1)出现3xx或者33x，即中前三组三，(2)出现3xy即中前三组六。 | E197: =54/1000 -> 0.054 | F197: 18 | G197: =(1/E197)*F197 -> 333.33333333333337 | H197: =2*G197*1800/2000 -> 600.00000000000011 | I197: =2*G197*1956/2000 -> 652.00000000000011
B198: 三星包胆：组六 | E198: =72*6/1000 -> 0.432 | F198: 36 | G198: =(1/E198)*F198 -> 83.333333333333343 | H198: =2*G198*1800/2000 -> 150.00000000000003 | I198: =2*G198*1956/2000 -> 163.00000000000003
A199: 和值尾数 | B199: 三星和值尾数 | C199: 从0～9中任意选择1个和值尾数号码，开奖号码的前三位和值尾数与投注号码相同，即为中奖。 | D199: 投注和值尾数8，开奖9.3.6.xx，『9+3+6=18』和值尾数为8，即为中奖。 | E199: =100/1000 -> 0.1 | F199: 1 | G199: =(1/E199)*F199 -> 10 | H199: =2*G199*1800/2000 -> 18 | I199: =2*G199*1956/2000 -> 19.56
A200: 龙虎斗 | B200: 龙虎：龙/虎 | C200: 从龙虎中任意选择1个龙、虎，开奖号码的万位比个位号码大，中龙，反之中虎，相等中和，中和则返回本金。 | E200: =50/100 -> 0.5 | F200: 1 | G200: =(1/E200)*F200 -> 2 | H200: =2*G200*1800/2000 -> 3.60 | I200: =2*G200*1956/2000 -> 3.9119999999999999
B201: 龙虎斗：龙/虎 | C201: 从龙虎中任意选择1个龙、虎、和，开奖号码的万位比个位号码大，中龙，反之中虎，相等中和。 | D201: 投注『青龙』，开奖号码的万位比个位号码大，即为中奖，反之则为不中奖。 | E201: =45/100 -> 0.45 | F201: 1 | G201: =(1/E201)*F201 -> 2.2222222222222223 | H201: =2*G201*1800/2000 -> 4 | I201: =2*G201*1956/2000 -> 4.3466666666666667
B202: 龙虎斗：和 | E202: =10/100 -> 0.1 | F202: 1 | G202: =(1/E202)*F202 -> 10 | H202: =2*G202*1800/2000 -> 18 | I202: =2*G202*1956/2000 -> 19.56
B203: 玄麟斗：玄/麟 | C203: 从玄麟中任意选择1个玄、麟、和，开奖号码的千位比十位号码大，中玄武，反之中麒麟，相等中和。 | D203: 投注『玄武』，开奖号码的千位比十位号码大，即为中奖，反之则为不中奖。 | E203: =45/100 -> 0.45 | F203: 1 | G203: =(1/E203)*F203 -> 2.2222222222222223 | H203: =2*G203*1800/2000 -> 4 | I203: =2*G203*1956/2000 -> 4.3466666666666667
B204: 玄麟斗：和 | E204: =10/100 -> 0.1 | F204: 1 | G204: =(1/E204)*F204 -> 10 | H204: =2*G204*1800/2000 -> 18 | I204: =2*G204*1956/2000 -> 19.56
A205: 全五中一 | B205: 组选120 | C205: 开奖号码为不重复的五个单号，开奖号码里包含所选号码即为中奖。 | D205: 投注号码9，开奖号码：xyzn9，9xyzn，即为中奖。 | E205: =9*8*7*6*5/100000 -> 0.1512 | F205: 1 | G205: =(1/E205)*F205 -> 6.6137566137566139 | H205: =2*G205*1800/2000 -> 11.904761904761905 | I205: =2*G205*1956/2000 -> 12.936507936507937
B206: 组选60 | C206: 开奖号码为二重号加三个单号，顺序不限，开奖号码里包含所选号码即为中奖。 | D206: 投注号码9，开奖号码：99xyz，xyz99，即为中奖。 | E206: =24*9*8*7/100000 -> 0.12096 | F206: 1 | G206: =(1/E206)*F206 -> 8.2671957671957674 | H206: =2*G206*1800/2000 -> 14.880952380952381 | I206: =2*G206*1956/2000 -> 16.170634920634921
B207: 组选30 | C207: 开奖号码为二重号加二重号加单号，顺序不限，开奖号码里包含所选号码即为中奖。 | D207: 投注号码9，开奖号码：xxyy9，9xxyy，即为中奖。 | E207: =3240/100000 -> 0.0324 | F207: 1 | G207: =(1/E207)*F207 -> 30.8641975308642 | H207: =2*G207*1800/2000 -> 55.555555555555564 | I207: =2*G207*1956/2000 -> 60.370370370370374
B208: 组选20 | C208: 开奖号码为三重号加二个单号，顺序不限，开奖号码里包含所选号码即为中奖。 | D208: 投注号码9，开奖号码：999xy，yx999，9xyyy，即为中奖。 | E208: =2160/100000 -> 0.0216 | F208: 1 | G208: =(1/E208)*F208 -> 46.296296296296291 | H208: =2*G208*1800/2000 -> 83.333333333333329 | I208: =2*G208*1956/2000 -> 90.555555555555543
B209: 组选10 | C209: 开奖号码为三重号加二重号，顺序不限，开奖号码里包含所选号码即为中奖。 | D209: 投注号码9，开奖号码：999xx，99xxx，即为中奖。 | E209: =180/100000 -> 0.0018 | F209: 1 | G209: =(1/E209)*F209 -> 555.55555555555554 | H209: =2*G209*1800/2000 -> 1000 | I209: =2*G209*1956/2000 -> 1086.6666666666667
B210: 组选5 | C210: 开奖号码为四重号加单号，顺序不限，开奖号码里包含所选号码即为中奖。 | D210: 投注号码9，开奖号嘛：9999x，9xxxx，即为中奖。 | E210: =90/100000 -> 0.0009 | F210: 1 | G210: =(1/E210)*F210 -> 1111.1111111111111 | H210: =2*G210*1800/2000 -> 2000 | I210: =2*G210*1956/2000 -> 2173.3333333333335
B211: 组选1 | C211: 开奖号码为五重号，开奖号码里包含所选号码即为中奖。 | D211: 投注号码9，开奖号码：99999，即为中奖。 | E211: =1/100000 -> 0.00001 | F211: 1 | G211: =(1/E211)*F211 -> 99999.999999999985 | H211: =2*G211*1800/2000 -> 179999.99999999997 | I211: =2*G211*1956/2000 -> 195599.99999999997
A212: 百家乐 | B212: 庄闲 | C212: 从庄闲中任意选择1个庄、闲，开奖号码万位+千位之和比十位+个位之和大，中庄，反之中闲，如果开出和则不会退还庄闲下注金额。 | D212: 投注『闲』，开奖号码为32698『3+2=5』vs『9+8=7』闲赢。 | E212: =45/100 -> 0.45 | F212: 1 | G212: =(1/E212)*F212 -> 2.2222222222222223 | H212: =2*G212*1800/2000 -> 4 | I212: =2*G212*1956/2000 -> 4.3466666666666667
B213: 和 | C213: 从平中任意选择1个和，开奖号码万位+千位之和＝十位+个位至和，中和。 | D213: 投注『和』，开奖号码为32614『3+2=5』vs『1+4=5』和赢。 | E213: =10/100 -> 0.1 | F213: 1 | G213: =(1/E213)*F213 -> 10 | H213: =2*G213*1800/2000 -> 18 | I213: =2*G213*1956/2000 -> 19.56
B214: 对子 | C214: 从对子中任意选择1个庄或闲，开奖号码『庄』万位=千位相同，中庄对子，『闲』十位=个位相同，中闲对子。 | D214: 投注『庄』，开奖号码为33614，庄对子赢。 | E214: =10/100 -> 0.1 | F214: 1 | G214: =(1/E214)*F214 -> 10 | H214: =2*G214*1800/2000 -> 18 | I214: =2*G214*1956/2000 -> 19.56
B215: 豹子 | C215: 从豹子中任意选择1个庄或闲，开奖号码『庄』万位=千位=百位相同，中庄豹子，『闲』百位=十位=个位相同，中闲豹子。 | D215: 投注『庄』，开奖号码为33314，庄豹子赢。 | E215: =1/100 -> 0.01 | F215: 1 | G215: =(1/E215)*F215 -> 100 | H215: =2*G215*1800/2000 -> 180 | I215: =2*G215*1956/2000 -> 195.60
B216: 天王 | C216: 从天王中任意选择1个庄或闲，开奖号码『庄』万位+千位=8点或者9点，中庄天王，『闲』十位+个位=8点或者9点，中闲天王。 | D216: 投注『庄』，开奖号码为35314，3+5=中庄天王。 | E216: =19/100 -> 0.19 | F216: 1 | G216: =(1/E216)*F216 -> 5.2631578947368425 | H216: =2*G216*1800/2000 -> 9.4736842105263168 | I216: =2*G216*1956/2000 -> 10.294736842105264
B217: S6 | C217: 万位+千位的和=6，十位+个位的和<6，即为中奖。 | D217: 投注『S6』，开奖号码为33912，S6赢。 | E217: =84/10000 -> 0.0084 | F217: 1 | G217: =(1/E217)*F217 -> 119.04761904761905 | H217: =2*G217*1800/2000 -> 214.28571428571428 | I217: =2*G217*1956/2000 -> 232.85714285714286
A218: 特殊 | B218: 豹子 | C218: 所选的号码特殊属性和开奖号码前3位的属性一致，即为中奖1、豹子号指的是三位数字全部相同2、顺子号指的是三位数字呈现连号状态（09也属于连号）（顺序不限）3、对子号指的是三位数字中有任两码为相同号（出现三个相同号为豹子号，不算对子号）4、半顺号指的是三位数字中，有两个号码呈现连号状态（09也属于连号）（顺序不限）（出现两个相同号即为对子，不算半顺）（出现三个号码呈现连号状态为顺子号，不算半顺号）5、杂六号指的是三位数字中，状态非豹子号、顺子号、对子号、半顺号，即为杂六。 | D218: 投注方案：豹子开奖号码：000xx，即中豹子投注方案：顺子开奖号码：901xx，即中顺子投注方案：对子开奖号码：001xx，即中对子投注方案：半顺开奖号码：904xx，即中半顺投注方案：杂六开奖号码：158xx，即中杂六。 | E218: =1000/100000 -> 0.01 | F218: 1 | G218: =(1/E218)*F218 -> 100 | H218: =2*G218*1800/2000 -> 180 | I218: =2*G218*1956/2000 -> 195.60
B219: 顺子 | E219: =6000/100000 -> 0.06 | F219: 1 | G219: =(1/E219)*F219 -> 16.666666666666668 | H219: =2*G219*1800/2000 -> 30.000000000000004 | I219: =2*G219*1956/2000 -> 32.60
B220: 对子 | E220: =27000/100000 -> 0.27 | F220: 1 | G220: =(1/E220)*F220 -> 3.7037037037037033 | H220: =2*G220*1800/2000 -> 6.6666666666666661 | I220: =2*G220*1956/2000 -> 7.2444444444444436
B221: 半顺 | E221: =36000/100000 -> 0.36 | F221: 1 | G221: =(1/E221)*F221 -> 2.7777777777777777 | H221: =2*G221*1800/2000 -> 5 | I221: =2*G221*1956/2000 -> 5.4333333333333327
B222: 杂六 | E222: =34000/100000 -> 0.34 | F222: 1 | G222: =(1/E222)*F222 -> 2.9411764705882351 | H222: =2*G222*1800/2000 -> 5.2941176470588234 | I222: =2*G222*1956/2000 -> 5.7529411764705873
A223: 射龙门 | B223: 射中龙门 | C223: 分别为投注前三码【万千百】、中三码【千百十】、后三码【百十个】位置里的号码，比较三码内中位号码与前位、后位号码关系为范围内、范围外或任一号相等。 | D223: 中位球号介于前位、后位的球门范围内。举例：投注前三码射中龙门 共1注。开奖结果前三码为：123** 中位号码2介于1到3范围内，视为中奖。 | E223: =240/1000 -> 0.24 | F223: 1 | G223: =(1/E223)*F223 -> 4.166666666666667 | H223: =2*G223*1800/2000 -> 7.5000000000000009 | I223: =2*G223*1956/2000 -> 8.15
B224: 撞柱 | D224: 撞柱：中位球号与前位、后位的球门任一号相同。举例：投注中三码撞柱 共1注。开奖结果中三码为：*233* 中位号码3与后位号码3相同，视为中奖。 | E224: =190/1000 -> 0.19 | F224: 1 | G224: =(1/E224)*F224 -> 5.2631578947368425 | H224: =2*G224*1800/2000 -> 9.4736842105263168 | I224: =2*G224*1956/2000 -> 10.294736842105264
B225: 不中 | D225: 不中：中位球号介于前位、后位的球门范围外。举例：投注后三码不中 共1注。开奖结果后三码为：**151 中位号码5介于1之外，视为中奖。 | E225: =285/1000 -> 0.28499999999999998 | F225: 1 | G225: =(1/E225)*F225 -> 3.5087719298245617 | H225: =2*G225*1800/2000 -> 6.3157894736842106 | I225: =2*G225*1956/2000 -> 6.8631578947368421