A1: 玩法组 | B1: 玩法 | C1: 玩法说明 | D1: 中奖举例 | E1: 中奖概率 | F1: 投注注数 | G1: 理论赔率 | H1: 奖金组1800 | I1: 奖金组1956
A3: 选出3个号码为开奖号码，数字为0到9号，数字可重复开出
A4: 直选 | B4: 直选复式 | C4: 从百位、十位、个位中选择一个3位数号码组成一注，所选号码与开奖号码相同，且顺序一致，即为中奖。 | D4: 如：百位选择1，十位选择2，个位选择3，开奖号码为是123，即为中奖。 | E4: =1/1000 -> 0.001 | F4: 1 | G4: =(1/E4)*F4 -> 1000 | H4: =2*G4*1800/2000 -> 1800 | I4: =2*G4*1956/2000 -> 1956
B5: 直选单式 | C5: 手动输入一个3位数号码组成一注，所选号码与开奖号码相同，且顺序一致，即为中奖。 | D5: 如：手动输入123，开奖号码为是123，即为中奖。 | E5: =1/1000 -> 0.001 | F5: 1 | G5: =(1/E5)*F5 -> 1000 | H5: =2*G5*1800/2000 -> 1800 | I5: =2*G5*1956/2000 -> 1956
B6: 直选和值：0和27 | C6: 所选数值等于开奖号码的三个数字相加之和，即为中奖。 | D6: 如：选择6，开奖号码为123、141、114、006、060等任意一个和值为6的结果，即为中奖。 | E6: =1/1000 -> 0.001 | F6: 1 | G6: =(1/E6)*F6 -> 1000 | H6: =2*G6*1800/2000 -> 1800 | I6: =2*G6*1956/2000 -> 1956
B7: 直选和值：1和26 | E7: =3/1000 -> 0.0030000000000000001 | F7: 1 | G7: =(1/E7)*F7 -> 333.33333333333331 | H7: =2*G7*1800/2000 -> 600 | I7: =2*G7*1956/2000 -> 652
B8: 直选和值：2和25 | E8: =6/1000 -> 0.0060000000000000001 | F8: 1 | G8: =(1/E8)*F8 -> 166.66666666666666 | H8: =2*G8*1800/2000 -> 300 | I8: =2*G8*1956/2000 -> 326
B9: 直选和值：3和24 | E9: =10/1000 -> 0.01 | F9: 1 | G9: =(1/E9)*F9 -> 100 | H9: =2*G9*1800/2000 -> 180 | I9: =2*G9*1956/2000 -> 195.60
B10: 直选和值：4和23 | E10: =15/1000 -> 0.015 | F10: 1 | G10: =(1/E10)*F10 -> 66.666666666666671 | H10: =2*G10*1800/2000 -> 120.00000000000001 | I10: =2*G10*1956/2000 -> 130.40
B11: 直选和值：5和22 | E11: =21/1000 -> 0.021000000000000001 | F11: 1 | G11: =(1/E11)*F11 -> 47.619047619047613 | H11: =2*G11*1800/2000 -> 85.714285714285708 | I11: =2*G11*1956/2000 -> 93.142857142857125
B12: 直选和值：6和21 | E12: =28/1000 -> 0.028000000000000001 | F12: 1 | G12: =(1/E12)*F12 -> 35.714285714285715 | H12: =2*G12*1800/2000 -> 64.285714285714292 | I12: =2*G12*1956/2000 -> 69.857142857142861
B13: 直选和值：7和20 | E13: =36/1000 -> 0.035999999999999997 | F13: 1 | G13: =(1/E13)*F13 -> 27.777777777777779 | H13: =2*G13*1800/2000 -> 50 | I13: =2*G13*1956/2000 -> 54.333333333333336
B14: 直选和值：8和19 | E14: =45/1000 -> 0.045 | F14: 1 | G14: =(1/E14)*F14 -> 22.222222222222221 | H14: =2*G14*1800/2000 -> 40 | I14: =2*G14*1956/2000 -> 43.466666666666661
B15: 直选和值：9和18 | E15: =55/1000 -> 0.055 | F15: 1 | G15: =(1/E15)*F15 -> 18.181818181818183 | H15: =2*G15*1800/2000 -> 32.727272727272734 | I15: =2*G15*1956/2000 -> 35.56363636363637
B16: 直选和值：10和17 | E16: =63/1000 -> 0.063 | F16: 1 | G16: =(1/E16)*F16 -> 15.873015873015873 | H16: =2*G16*1800/2000 -> 28.571428571428573 | I16: =2*G16*1956/2000 -> 31.047619047619051
B17: 直选和值：11和16 | E17: =69/1000 -> 0.069000000000000006 | F17: 1 | G17: =(1/E17)*F17 -> 14.492753623188404 | H17: =2*G17*1800/2000 -> 26.086956521739129 | I17: =2*G17*1956/2000 -> 28.34782608695652
B18: 直选和值：12和15 | E18: =73/1000 -> 0.072999999999999995 | F18: 1 | G18: =(1/E18)*F18 -> 13.698630136986303 | H18: =2*G18*1800/2000 -> 24.657534246575345 | I18: =2*G18*1956/2000 -> 26.794520547945208
B19: 直选和值：13和14 | E19: =75/1000 -> 0.075 | F19: 1 | G19: =(1/E19)*F19 -> 13.333333333333334 | H19: =2*G19*1800/2000 -> 24 | I19: =2*G19*1956/2000 -> 26.08
A20: 组选 | B20: 组三 | C20: 从0-9中至少任选三个号码，三个号码作为一注，所选号码与开奖号码的百位、十位、个位号码相同，顺序不限，即为中奖。 | D20: 如：选择12（展开为122，212，221 和112、121、211），开奖号码为212 或121，即为中奖。 | E20: =6/1000 -> 0.0060000000000000001 | F20: 2 | G20: =(1/E20)*F20 -> 333.33333333333331 | H20: =2*G20*1800/2000 -> 600 | I20: =2*G20*1956/2000 -> 652
B21: 组六 | C21: 从0-9中至少任选三个号码，三个号码作为一注，所选号码与开奖号码的百位、十位、个位号码相同，顺序不限，即为中奖。 | D21: 如：选择123（展开为123，132，231，213，312，321），开奖号码为321，即为中奖。 | E21: =6/1000 -> 0.0060000000000000001 | F21: 1 | G21: =(1/E21)*F21 -> 166.66666666666666 | H21: =2*G21*1800/2000 -> 300 | I21: =2*G21*1956/2000 -> 326
B22: 组选和值：1和26（组三） | C22: 所选数值等于开奖号码的三个数字相加之和，即为中奖。 | D22: 如：选择6，开奖号码为114中组三奖，开奖号码为015中组六奖。 | E22: =3/1000 -> 0.0030000000000000001 | F22: 1 | G22: =(1/E22)*F22 -> 333.33333333333331 | H22: =2*G22*1800/2000 -> 600 | I22: =2*G22*1956/2000 -> 652
B23: 组选和值：1和26（组六） | F23: 1 | G23: =(1/E23)*F23 -> #DIV/0! | H23: =2*G23*1800/2000 -> #DIV/0! | I23: =2*G23*1956/2000 -> #DIV/0!
B24: 组选和值：2和25（组三） | E24: =6/1000 -> 0.0060000000000000001 | F24: 1 | G24: =(1/E24)*F24 -> 166.66666666666666 | H24: =2*G24*1800/2000 -> 300 | I24: =2*G24*1956/2000 -> 326
B25: 组选和值：2和25（组六） | F25: 1 | G25: =(1/E25)*F25 -> #DIV/0! | H25: =2*G25*1800/2000 -> #DIV/0! | I25: =2*G25*1956/2000 -> #DIV/0!
B26: 组选和值：3和24（组三） | E26: =3/1000 -> 0.0030000000000000001 | F26: 1 | G26: =(1/E26)*F26 -> 333.33333333333331 | H26: =2*G26*1800/2000 -> 600 | I26: =2*G26*1956/2000 -> 652
B27: 组选和值：3和24（组六） | E27: =6/1000 -> 0.0060000000000000001 | F27: 1 | G27: =(1/E27)*F27 -> 166.66666666666666 | H27: =2*G27*1800/2000 -> 300 | I27: =2*G27*1956/2000 -> 326
B28: 组选和值：4和23（组三） | E28: =9/1000 -> 0.0089999999999999993 | F28: 1 | G28: =(1/E28)*F28 -> 111.11111111111111 | H28: =2*G28*1800/2000 -> 200 | I28: =2*G28*1956/2000 -> 217.33333333333334
B29: 组选和值：4和23（组六） | E29: =6/1000 -> 0.0060000000000000001 | F29: 1 | G29: =(1/E29)*F29 -> 166.66666666666666 | H29: =2*G29*1800/2000 -> 300 | I29: =2*G29*1956/2000 -> 326
B30: 组选和值：5和22（组三） | E30: =9/1000 -> 0.0089999999999999993 | F30: 1 | G30: =(1/E30)*F30 -> 111.11111111111111 | H30: =2*G30*1800/2000 -> 200 | I30: =2*G30*1956/2000 -> 217.33333333333334
B31: 组选和值：5和22（组六） | E31: =12/1000 -> 0.012 | F31: 1 | G31: =(1/E31)*F31 -> 83.333333333333329 | H31: =2*G31*1800/2000 -> 150 | I31: =2*G31*1956/2000 -> 163
B32: 组选和值：6和21（组三） | E32: =9/1000 -> 0.0089999999999999993 | F32: 1 | G32: =(1/E32)*F32 -> 111.11111111111111 | H32: =2*G32*1800/2000 -> 200 | I32: =2*G32*1956/2000 -> 217.33333333333334
B33: 组选和值：6和21（组六） | E33: =18/1000 -> 0.017999999999999999 | F33: 1 | G33: =(1/E33)*F33 -> 55.555555555555557 | H33: =2*G33*1800/2000 -> 100 | I33: =2*G33*1956/2000 -> 108.66666666666667
B34: 组选和值：7和20（组三） | E34: =12/1000 -> 0.012 | F34: 1 | G34: =(1/E34)*F34 -> 83.333333333333329 | H34: =2*G34*1800/2000 -> 150 | I34: =2*G34*1956/2000 -> 163
B35: 组选和值：7和20（组六） | E35: =24/1000 -> 0.024 | F35: 1 | G35: =(1/E35)*F35 -> 41.666666666666664 | H35: =2*G35*1800/2000 -> 75 | I35: =2*G35*1956/2000 -> 81.50
B36: 组选和值：8和19（组三） | E36: =15/1000 -> 0.015 | F36: 1 | G36: =(1/E36)*F36 -> 66.666666666666671 | H36: =2*G36*1800/2000 -> 120.00000000000001 | I36: =2*G36*1956/2000 -> 130.40
B37: 组选和值：8和19（组六） | E37: =30/1000 -> 0.03 | F37: 1 | G37: =(1/E37)*F37 -> 33.333333333333336 | H37: =2*G37*1800/2000 -> 60.000000000000007 | I37: =2*G37*1956/2000 -> 65.20
B38: 组选和值：9和18（组三） | E38: =12/1000 -> 0.012 | F38: 1 | G38: =(1/E38)*F38 -> 83.333333333333329 | H38: =2*G38*1800/2000 -> 150 | I38: =2*G38*1956/2000 -> 163
B39: 组选和值：9和18（组六） | E39: =42/1000 -> 0.042000000000000003 | F39: 1 | G39: =(1/E39)*F39 -> 23.809523809523807 | H39: =2*G39*1800/2000 -> 42.857142857142854 | I39: =2*G39*1956/2000 -> 46.571428571428562
B40: 组选和值：10和17（组三） | E40: =15/1000 -> 0.015 | F40: 1 | G40: =(1/E40)*F40 -> 66.666666666666671 | H40: =2*G40*1800/2000 -> 120.00000000000001 | I40: =2*G40*1956/2000 -> 130.40
B41: 组选和值：10和17（组六） | E41: =48/1000 -> 0.048000000000000001 | F41: 1 | G41: =(1/E41)*F41 -> 20.833333333333332 | H41: =2*G41*1800/2000 -> 37.50 | I41: =2*G41*1956/2000 -> 40.75
B42: 组选和值：11和16（组三） | E42: =15/1000 -> 0.015 | F42: 1 | G42: =(1/E42)*F42 -> 66.666666666666671 | H42: =2*G42*1800/2000 -> 120.00000000000001 | I42: =2*G42*1956/2000 -> 130.40
B43: 组选和值：11和16（组六） | E43: =54/1000 -> 0.053999999999999999 | F43: 1 | G43: =(1/E43)*F43 -> 18.518518518518519 | H43: =2*G43*1800/2000 -> 33.333333333333336 | I43: =2*G43*1956/2000 -> 36.222222222222229
B44: 组选和值：12和15（组三） | E44: =12/1000 -> 0.012 | F44: 1 | G44: =(1/E44)*F44 -> 83.333333333333329 | H44: =2*G44*1800/2000 -> 150 | I44: =2*G44*1956/2000 -> 163
B45: 组选和值：12和15（组六） | E45: =60/1000 -> 0.06 | F45: 1 | G45: =(1/E45)*F45 -> 16.666666666666668 | H45: =2*G45*1800/2000 -> 30.000000000000004 | I45: =2*G45*1956/2000 -> 32.60
B46: 组选和值：13和14（组三） | E46: =15/1000 -> 0.015 | F46: 1 | G46: =(1/E46)*F46 -> 66.666666666666671 | H46: =2*G46*1800/2000 -> 120.00000000000001 | I46: =2*G46*1956/2000 -> 130.40
B47: 组选和值：13和14（组六） | E47: =60/1000 -> 0.06 | F47: 1 | G47: =(1/E47)*F47 -> 16.666666666666668 | H47: =2*G47*1800/2000 -> 30.000000000000004 | I47: =2*G47*1956/2000 -> 32.60
B48: 混合组选：组三 | C48: 键盘手动输入购买号码，3个数字为一注，开奖号码的百位、十位、个位符合前三的组三或组六均为中奖。 | D48: 如：手动输入123、455，开奖号码为321即中组六奖，开奖号码为545即中组三奖。 | E48: =3/1000 -> 0.0030000000000000001 | F48: 1 | G48: =(1/E48)*F48 -> 333.33333333333331 | H48: =2*G48*1800/2000 -> 600 | I48: =2*G48*1956/2000 -> 652
B49: 混合组选：组六 | E49: =6/1000 -> 0.0060000000000000001 | F49: 1 | G49: =(1/E49)*F49 -> 166.66666666666666 | H49: =2*G49*1800/2000 -> 300 | I49: =2*G49*1956/2000 -> 326
A50: 不定位 | B50: 一码不定位 | C50: 从0-9中选择1个号码，每注由1个号码组成，只要开奖结果中包含所选号码，即为中奖。 | D50: 如：选择一码不定位4，开出4**、*4*、**4即为中奖。 | E50: =271/1000 -> 0.27100000000000002 | F50: 1 | G50: =(1/E50)*F50 -> 3.6900369003690034 | H50: =2*G50*1800/2000 -> 6.6420664206642055 | I50: =2*G50*1956/2000 -> 7.2177121771217712
B51: 二码不定位 | C51: 从0-9中选择2个号码，每注由2个不同的号码组成，开奖号码的百位、十位、个位中同时包含所选的2个号码，即为中奖。 | D51: 如：选择二码不定位4、5，开奖号码为*45、5*4、*54即为中奖。 | E51: =54/1000 -> 0.053999999999999999 | F51: 1 | G51: =(1/E51)*F51 -> 18.518518518518519 | H51: =2*G51*1800/2000 -> 33.333333333333336 | I51: =2*G51*1956/2000 -> 36.222222222222229
A52: 二星 | B52: 前二直选复式 | C52: 从百位和十位上至少各选1个号码，所选号码与开奖号码百位、十位相同，且顺序一致，即为中奖。 | D52: 如：百位选择3，十位选择4，开奖号码为34*，即为中奖。 | E52: =1/100 -> 0.01 | F52: 1 | G52: =(1/E52)*F52 -> 100 | H52: =2*G52*1800/2000 -> 180 | I52: =2*G52*1956/2000 -> 195.60
B53: 前二直选单式 | C53: 手动输入一个2位数号码组成一注，所选号码与开奖号码的百位、十位相同，且顺序一致，即为中奖。 | D53: 如：手动输入12，开奖号码为是12*，即为中奖。 | E53: =1/100 -> 0.01 | F53: 1 | G53: =(1/E53)*F53 -> 100 | H53: =2*G53*1800/2000 -> 180 | I53: =2*G53*1956/2000 -> 195.60
B54: 前二组选复式 | C54: 从0-9中选2个号码组成一注，所选号码与开奖号码的百位、十位相同，顺序不限，即为中奖。 | D54: 如：百位选择7，十位选择8，开奖号码78*或87*，即为中奖。 | E54: =2/100 -> 0.02 | F54: 1 | G54: =(1/E54)*F54 -> 50 | H54: =2*G54*1800/2000 -> 90 | I54: =2*G54*1956/2000 -> 97.80
B55: 前二组选单式 | C55: 手动输入购买号码，2个数字为一注，所选号码与开奖号码的百位、十位相同，顺序不限，即为中奖。 | D55: 如：手动输入12，开奖号码为是21*或12*，即为中奖。 | E55: =2/100 -> 0.02 | F55: 1 | G55: =(1/E55)*F55 -> 50 | H55: =2*G55*1800/2000 -> 90 | I55: =2*G55*1956/2000 -> 97.80
B56: 后二直选复式 | C56: 从十位和个位上至少各选1个号码，所选号码与开奖号码的十位、个位相同，且顺序一致，即为中奖。 | D56: 如：十位选择3，个位选择4，开奖号码为*34，即为中奖。 | E56: =1/100 -> 0.01 | F56: 1 | G56: =(1/E56)*F56 -> 100 | H56: =2*G56*1800/2000 -> 180 | I56: =2*G56*1956/2000 -> 195.60
B57: 后二直选单式 | C57: 手动输入一个2位数号码组成一注，所选号码与开奖号码的十位、个位相同，且顺序一致，即为中奖。 | D57: 如：手动输入12，开奖号码为是*12，即为中奖。 | E57: =1/100 -> 0.01 | F57: 1 | G57: =(1/E57)*F57 -> 100 | H57: =2*G57*1800/2000 -> 180 | I57: =2*G57*1956/2000 -> 195.60
B58: 后二组选复式 | C58: 从0-9中选2个号码组成一注，所选号码与开奖号码的十位、个位相同，顺序不限，即为中奖。 | D58: 如：选择7、8，开奖号码*78或*87，即为中奖。 | E58: =2/100 -> 0.02 | F58: 1 | G58: =(1/E58)*F58 -> 50 | H58: =2*G58*1800/2000 -> 90 | I58: =2*G58*1956/2000 -> 97.80
B59: 后二组选单式 | C59: 手动输入购买号码，2个数字为一注，所选号码与开奖号码的十位、个位相同，顺序不限，即为中奖。 | D59: 如：手动输入12，开奖号码为是*21或者*12，即为中奖。 | E59: =2/100 -> 0.02 | F59: 1 | G59: =(1/E59)*F59 -> 50 | H59: =2*G59*1800/2000 -> 90 | I59: =2*G59*1956/2000 -> 97.80
A60: 定位胆 | B60: 百位 | C60: 从百位、十位、个位任意1个位置或多个位置上选择1个号码，所选号码与相同位置上的开奖号码一致，即为中奖。 | D60: 如：定百位为3，开奖号码为3**，即为中奖。 | E60: =100/1000 -> 0.1 | F60: 1 | G60: =(1/E60)*F60 -> 10 | H60: =2*G60*1800/2000 -> 18 | I60: =2*G60*1956/2000 -> 19.56
B61: 十位 | D61: 如：定十位为4，开奖号码为*4*，即为中奖。 | E61: =100/1000 -> 0.1 | F61: 1 | G61: =(1/E61)*F61 -> 10 | H61: =2*G61*1800/2000 -> 18 | I61: =2*G61*1956/2000 -> 19.56
B62: 个位 | D62: 如：定个位为5，开奖号码为**5，即为中奖。 | E62: =100/1000 -> 0.1 | F62: 1 | G62: =(1/E62)*F62 -> 10 | H62: =2*G62*1800/2000 -> 18 | I62: =2*G62*1956/2000 -> 19.56
A63: 大小单双 | B63: 前二 | C63: 对百位和十位的“大（56789）小（01234）、单（13579）双（02468）”形态进行购买，所选号码的位置、形态与开奖号码的位置、形态相同，即为中奖。 | D63: 如：百位选择大，十位选择单，开出63*即为中奖。 | E63: =1/4 -> 0.25 | F63: 1 | G63: =(1/E63)*F63 -> 4 | H63: =2*G63*1800/2000 -> 7.20 | I63: =2*G63*1956/2000 -> 7.8239999999999998
B64: 后二 | C64: 对十位和个位的“大（56789）小（01234）、单（13579）双（02468）”形态进行购买，所选号码的位置、形态与开奖号码的位置、形态相同，即为中奖。 | D64: 如：十位选择小，个位选择双，开出*12即为中奖 | E64: =1/4 -> 0.25 | F64: 1 | G64: =(1/E64)*F64 -> 4 | H64: =2*G64*1800/2000 -> 7.20 | I64: =2*G64*1956/2000 -> 7.8239999999999998
A65: 趣味 | B65: 龙虎斗：龙/虎 | C65: 从龙虎中任意选择1个龙、虎、和，开奖号码的百位比个位号码大，中龙，反之中虎，相等中和则退还本金。 | D65: 投注『青龙』，开奖号码的百位比个位号码大，即为中奖，反之则为不中奖。 | E65: =45/90 -> 0.5 | F65: 1 | G65: =(1/E65)*F65 -> 2 | H65: =2*G65*1800/2000 -> 3.60 | I65: =2*G65*1956/2000 -> 3.9119999999999999
B66: 豹子 | C66: 所选的号码特殊属性和开奖号码前3位的属性一致，即为中奖1、豹子号指的是三位数字全部相同2、顺子号指的是三位数字呈现连号状态（09也属于连号）（顺序不限）3、对子号指的是三位数字中有任两码为相同号（出现三个相同号为豹子号，不算对子号）4、半顺号指的是三位数字中，有两个号码呈现连号状态（09也属于连号）（顺序不限）（出现两个相同号即为对子，不算半顺）（出现三个号码呈现连号状态为顺子号，不算半顺号）5、杂六号指的是三位数字中，状态非豹子号、顺子号、对子号、半顺号，即为杂六。 | D66: 投注方案：豹子开奖号码：000，即中豹子投注方案：顺子开奖号码：901，即中顺子投注方案：对子开奖号码：001，即中对子投注方案：半顺开奖号码：904，即中半顺投注方案：杂六开奖号码：158，即中杂六。 | E66: =10/1000 -> 0.01 | F66: 1 | G66: =(1/E66)*F66 -> 100 | H66: =2*G66*1800/2000 -> 180 | I66: =2*G66*1956/2000 -> 195.60
B67: 顺子 | E67: =60/1000 -> 0.06 | F67: 1 | G67: =(1/E67)*F67 -> 16.666666666666668 | H67: =2*G67*1800/2000 -> 30.000000000000004 | I67: =2*G67*1956/2000 -> 32.60
B68: 对子 | E68: =270/1000 -> 0.27 | F68: 1 | G68: =(1/E68)*F68 -> 3.7037037037037033 | H68: =2*G68*1800/2000 -> 6.6666666666666661 | I68: =2*G68*1956/2000 -> 7.2444444444444436
B69: 半顺 | E69: =360/1000 -> 0.36 | F69: 1 | G69: =(1/E69)*F69 -> 2.7777777777777777 | H69: =2*G69*1800/2000 -> 5 | I69: =2*G69*1956/2000 -> 5.4333333333333327
B70: 杂六 | E70: =300/1000 -> 0.3 | F70: 1 | G70: =(1/E70)*F70 -> 3.3333333333333335 | H70: =2*G70*1800/2000 -> 6 | I70: =2*G70*1956/2000 -> 6.52