A1: 玩法组 | B1: 玩法 | C1: 玩法说明 | D1: 中奖举例 | E1: 中奖概率 | F1: 投注注数 | G1: 理论赔率 | H1: 奖金组1800 | I1: 奖金组1956
A3: 选出5个号码为开奖号码，数字为1到11号，数字不可重复开出
A4: 三码 | B4: 前三直选复式 | C4: 从01-11共11个号码中选择3个不重复的号码组成一注，所选号码与当期顺序摇出的5个号码中的前3个号码相同，且顺序一致，即为中奖。 | D4: 如：第一位选择01，第二位选择02，第三位选择03，开奖号码顺序为01，02，03 * *，即为中奖。 | E4: =1/(11*10*9) -> 0.0010101010101010101 | F4: 1 | G4: =(1/E4)*F4 -> 990 | H4: =2*G4*1800/2000 -> 1782 | I4: =2*G4*1956/2000 -> 1936.44
B5: 前三直选单式 | C5: 手动输入3个号码组成一注，所输入的号码与当期顺序摇出的5个号码中的前3个号码相同，且顺序一致，即为中奖。 | D5: 如：手动输入01 02 03，开奖号码为是01 02 03 * *，即为中奖。 | E5: =1/(11*10*9) -> 0.0010101010101010101 | F5: 1 | G5: =(1/E5)*F5 -> 990 | H5: =2*G5*1800/2000 -> 1782 | I5: =2*G5*1956/2000 -> 1936.44
B6: 前三组选复式 | C6: 从01-11中共11个号码中选择3个号码，所选号码与当期顺序摇出的5个号码中的前3个号码相同，顺序不限，即为中奖。 | D6: 如：选择01 02 03（展开为01 02 03 * *，01 03 02 * *，02 01 03 * *，02 03 01 * *，03 01 02 * *，03 02 01 * *），开奖号码为03 01 02，即为中奖。 | E6: =6/(11*10*9) -> 0.0060606060606060606 | F6: 1 | G6: =(1/E6)*F6 -> 165 | H6: =2*G6*1800/2000 -> 297 | I6: =2*G6*1956/2000 -> 322.74
B7: 前三组选单式 | C7: 手动输入3个号码组成一注，所输入的号码与当期顺序摇出的5个号码中的前3个号码相同，顺序不限，即为中奖。 | D7: 如：手动输入01 02 03（展开为01 02 03 * *，01 03 02 * * , 02 01 03 * *，02 03 01 * *，03 01 02 * *，03 02 01 * *），开奖号码为01 03 02 * *，即为中奖。 | E7: =6/(11*10*9) -> 0.0060606060606060606 | F7: 1 | G7: =(1/E7)*F7 -> 165 | H7: =2*G7*1800/2000 -> 297 | I7: =2*G7*1956/2000 -> 322.74
A8: 二码 | B8: 前二直选复式 | C8: 从01-11共11个号码中选择2个不重复的号码组成一注，所选号码与当期顺序摇出的5个号码中的前2个号码相同，且顺序一致，即中奖。 | D8: 如：第一位选择01，第二位选择02，开奖号码01 02 * * *，即为中奖。 | E8: =1/(11*10) -> 0.0090909090909090905 | F8: 1 | G8: =(1/E8)*F8 -> 110 | H8: =2*G8*1800/2000 -> 198 | I8: =2*G8*1956/2000 -> 215.16
B9: 前二直选单式 | C9: 手动输入2个号码组成一注，所输入的号码与当期顺序摇出的5个号码中的前2个号码相同，且顺序一致，即为中奖。 | D9: 如：手动输入01 02，开奖号码为01 02 * * *，即为中奖。 | E9: =1/(11*10) -> 0.0090909090909090905 | F9: 1 | G9: =(1/E9)*F9 -> 110 | H9: =2*G9*1800/2000 -> 198 | I9: =2*G9*1956/2000 -> 215.16
B10: 前二组选复式 | C10: 从01-11中共11个号码中选择2个号码，所选号码与当期顺序摇出的5个号码中的前2个号码相同，顺序不限，即为中奖。 | D10: 如：选择01 02（展开为01 02 * * *，02 01 * * *），开奖号码为02 01 * * * 或01 02 * * *，即为中奖。 | E10: =2/(11*10) -> 0.018181818181818181 | F10: 1 | G10: =(1/E10)*F10 -> 55 | H10: =2*G10*1800/2000 -> 99 | I10: =2*G10*1956/2000 -> 107.58
B11: 前二组选单式 | C11: 手动输入2个号码组成一注，所输入的号码与当期顺序摇出的5个号码中的前2个号码相同，顺序不限，即为中奖。 | D11: 如：手动输入01 02（展开为01 02 * * *，02 01 * * *），开奖号码为02 01 *** 或01 02 ***，即为中奖。 | E11: =2/(11*10) -> 0.018181818181818181 | F11: 1 | G11: =(1/E11)*F11 -> 55 | H11: =2*G11*1800/2000 -> 99 | I11: =2*G11*1956/2000 -> 107.58
A12: 不定位 | B12: 前三不定位 | C12: 从01-11中共11个号码中选择1个号码，每注由1个号码组成，只要当期顺序摇出的第一位、第二位、第三位开奖号码中包含所选号码，即为中奖。 | D12: 如：选择01，开奖号码为01 * * * *，* 01 * * *，* * 01 * *，即为中奖。 | E12: =15120/(11*10*9*8*7) -> 0.27272727272727271 | F12: 1 | G12: =(1/E12)*F12 -> 3.666666666666667 | H12: =2*G12*1800/2000 -> 6.60 | I12: =2*G12*1956/2000 -> 7.1720000000000006
A13: 定位胆 | B13: 第一位 | C13: 从第一位，第二位，第三位任意1个位置或多个位置上选择1个号码，所选号码与相同位置上的开奖号码一致，即为中奖。 | D13: 如：第一位选择01，开奖号码为01 * * * *，即为中奖。 | E13: =1/11 -> 0.090909090909090912 | F13: 1 | G13: =(1/E13)*F13 -> 11 | H13: =2*G13*1800/2000 -> 19.80 | I13: =2*G13*1956/2000 -> 21.515999999999998
B14: 第二位 | D14: 如：第二位选择05，开奖号码为* 05* * *，即为中奖。 | E14: =1/11 -> 0.090909090909090912 | F14: 1 | G14: =(1/E14)*F14 -> 11 | H14: =2*G14*1800/2000 -> 19.80 | I14: =2*G14*1956/2000 -> 21.515999999999998
B15: 第三位 | D15: 如：第三位选择07，开奖号码为* * 07 * *，即为中奖。 | E15: =1/11 -> 0.090909090909090912 | F15: 1 | G15: =(1/E15)*F15 -> 11 | H15: =2*G15*1800/2000 -> 19.80 | I15: =2*G15*1956/2000 -> 21.515999999999998
A16: 趣味型 | B16: 定单双：5单0双 | C16: 从5种单双个数组合中选择1种组合，当期开奖号码的单双个数与所选单双组合一致，即为中奖。 | D16: 如：选择5单0双，开奖号码01，03，05，07，09五个单数，即为中奖。 | E16: =6*5*4*3*2/(11*10*9*8*7) -> 0.012987012987012988 | F16: 1 | G16: =(1/E16)*F16 -> 77 | H16: =2*G16*1800/2000 -> 138.60 | I16: =2*G16*1956/2000 -> 150.61199999999999
B17: 定单双：4单1双 | E17: =6*5*4*3*5*5/(11*10*9*8*7) -> 0.16233766233766234 | F17: 1 | G17: =(1/E17)*F17 -> 6.16 | H17: =2*G17*1800/2000 -> 11.087999999999999 | I17: =2*G17*1956/2000 -> 12.048960000000001
B18: 定单双：3单2双 | E18: =6*5*4*5*4*10/(11*10*9*8*7) -> 0.4329004329004329 | F18: 1 | G18: =(1/E18)*F18 -> 2.31 | H18: =2*G18*1800/2000 -> 4.1580000000000004 | I18: =2*G18*1956/2000 -> 4.5183599999999995
B19: 定单双：2单3双 | E19: =6*5*5*4*3*10/(11*10*9*8*7) -> 0.32467532467532467 | F19: 1 | G19: =(1/E19)*F19 -> 3.08 | H19: =2*G19*1800/2000 -> 5.5439999999999996 | I19: =2*G19*1956/2000 -> 6.0244800000000005
B20: 定单双：1单4双 | E20: =6*5*4*3*2*5/(11*10*9*8*7) -> 0.064935064935064929 | F20: 1 | G20: =(1/E20)*F20 -> 15.400000000000002 | H20: =2*G20*1800/2000 -> 27.72 | I20: =2*G20*1956/2000 -> 30.122400000000006
B21: 定单双：0单5双 | E21: =5*4*3*2*1/(11*10*9*8*7) -> 0.0021645021645021645 | F21: 1 | G21: =(1/E21)*F21 -> 462 | H21: =2*G21*1800/2000 -> 831.60 | I21: =2*G21*1956/2000 -> 903.67200000000003
B22: 猜中位：3和9 | C22: 从3-9中选择1个号码进行购买，所选号码与5个开奖号码按照大小顺序排列后的第3个号码相同，即为中奖。 | D22: 如：选择8，开奖号码为11，04，09，05，08，按开奖号码的数字大小排列为04，05，08，09，11，中间数08，即为中奖。 | E22: =3360/(11*10*9*8*7) -> 0.060606060606060608 | F22: 1 | G22: =(1/E22)*F22 -> 16.50 | H22: =2*G22*1800/2000 -> 29.70 | I22: =2*G22*1956/2000 -> 32.274000000000001
B23: 猜中位：4和8 | E23: =7560/(11*10*9*8*7) -> 0.13636363636363635 | F23: 1 | G23: =(1/E23)*F23 -> 7.3333333333333339 | H23: =2*G23*1800/2000 -> 13.20 | I23: =2*G23*1956/2000 -> 14.344000000000001
B24: 猜中位：5和7 | E24: =10800/(11*10*9*8*7) -> 0.19480519480519481 | F24: 1 | G24: =(1/E24)*F24 -> 5.1333333333333329 | H24: =2*G24*1800/2000 -> 9.24 | I24: =2*G24*1956/2000 -> 10.040799999999999
B25: 猜中位：6 | E25: =12000/(11*10*9*8*7) -> 0.21645021645021645 | F25: 1 | G25: =(1/E25)*F25 -> 4.62 | H25: =2*G25*1800/2000 -> 8.3160000000000007 | I25: =2*G25*1956/2000 -> 9.036719999999999
A26: 任选 | B26: 任选一中一 | C26: 从01-11共11个号码中选择1个号码进行购买，只要当期顺序摇出的5个开奖号码中包含所选号码，即为中奖。 | D26: 如：选择05，开奖号码为08 04 11 05 03，即为中奖 | E26: =25200/55440 -> 0.45454545454545453 | F26: 1 | G26: =(1/E26)*F26 -> 2.2000000000000002 | H26: =2*G26*1800/2000 -> 3.9600000000000004 | I26: =2*G26*1956/2000 -> 4.3032000000000004
B27: 任选二中二 | C27: 从01-11共11个号码中选择2个号码进行购买，只要当期顺序摇出的5个开奖号码中包含所选号码，即为中奖。 | D27: 如：选择05 04，开奖号码为08 04 11 05 03，即为中奖。 | E27: =10080/55440 -> 0.18181818181818182 | F27: 1 | G27: =(1/E27)*F27 -> 5.50 | H27: =2*G27*1800/2000 -> 9.90 | I27: =2*G27*1956/2000 -> 10.757999999999999
B28: 任选三中三 | C28: 从01-11共11个号码中选择3个号码进行购买，只要当期顺序摇出的5个开奖号码中包含所选号码，即为中奖。 | D28: 如：选择05 04 11，开奖号码为08 04 11 05 03，即为中奖。 | E28: =3360/55440 -> 0.060606060606060608 | F28: 1 | G28: =(1/E28)*F28 -> 16.50 | H28: =2*G28*1800/2000 -> 29.70 | I28: =2*G28*1956/2000 -> 32.274000000000001
B29: 任选四中四 | C29: 从01-11共11个号码中选择4个号码进行购买，只要当期顺序摇出的5个开奖号码中包含所选号码，即为中奖。 | D29: 如：选择05 04 08 03，开奖号码为08 04 11 05 03，即为中奖。 | E29: =840/55440 -> 0.015151515151515152 | F29: 1 | G29: =(1/E29)*F29 -> 66 | H29: =2*G29*1800/2000 -> 118.80 | I29: =2*G29*1956/2000 -> 129.096
B30: 任选五中五 | C30: 从01-11共11个号码中选择5个号码进行购买，只要当期顺序摇出的5个开奖号码中包含所选号码，即为中奖。 | D30: 如：选择05 04 11 03 08，开奖号码为08 04 11 05 03，即为中奖。 | E30: =120/55440 -> 0.0021645021645021645 | F30: 1 | G30: =(1/E30)*F30 -> 462 | H30: =2*G30*1800/2000 -> 831.60 | I30: =2*G30*1956/2000 -> 903.67200000000003
B31: 任选六中五 | C31: 从01-11共11个号码中选择6个号码进行购买，只要当期顺序摇出的5个开奖号码中包含所选号码，即为中奖。 | D31: 如：选择05 10 04 11 03 08，开奖号码为08 04 11 05 03，即为中奖。 | E31: =720/55440 -> 0.012987012987012988 | F31: 1 | G31: =(1/E31)*F31 -> 77 | H31: =2*G31*1800/2000 -> 138.60 | I31: =2*G31*1956/2000 -> 150.61199999999999
B32: 任选七中五 | C32: 从01-11共11个号码中选择7个号码进行购买，只要当期顺序摇出的5个开奖号码中包含所选号码，即为中奖。 | D32: 如：选择05 04 10 11 03 08 09，开奖号码为08 04 11 05 03，即为中奖。 | E32: =2520/55440 -> 0.045454545454545456 | F32: 1 | G32: =(1/E32)*F32 -> 22 | H32: =2*G32*1800/2000 -> 39.60 | I32: =2*G32*1956/2000 -> 43.031999999999996
B33: 任选八中五 | C33: 从01-11共11个号码中选择8个号码进行购买，只要当期顺序摇出的5个开奖号码中包含所选号码，即为中奖。 | D33: 如：选择05 04 11 03 08 10 09 01，开奖号码为08 04 11 05 03，即为中奖。 | E33: =6720/55440 -> 0.12121212121212122 | F33: 1 | G33: =(1/E33)*F33 -> 8.25 | H33: =2*G33*1800/2000 -> 14.85 | I33: =2*G33*1956/2000 -> 16.137