A1: 玩法组 | B1: 玩法 | C1: 玩法说明 | D1: 中奖举例 | E1: 中奖概率 | F1: 投注注数 | G1: 理论赔率 | H1: 奖金组1800 | I1: 奖金组1956
A3: 从3颗骰子中骰出3个号码为开奖号码，数字为1到6号，数字可重复开出
A4: 二同号复选 | B4: 二同号复选 | C4: 从六组二同号(11, 22, 33, 44, 55, 66)中选择一组作为一注。若开奖号码中包含所选的二同号，即为中奖。 | D4: 投注方案：112；开奖号码为：112，211，121，不含豹子，即中奖。 | E4: =3*5/(6*6*6) -> 0.069444444444444448 | F4: 1 | G4: =(1/E4)*F4 -> 14.40 | H4: =2*G4*1800/2000 -> 25.919999999999995 | I4: =2*G4*1956/2000 -> 28.166399999999999
D5: 投注方案：112；开奖号码为：112，211，121，包含豹子，即中奖。 | E5: =(3*5+1)/(6*6*6) -> 0.07407407407407407 | F5: 1 | G5: =(1/E5)*F5 -> 13.50 | H5: =2*G5*1800/2000 -> 24.30 | I5: =2*G5*1956/2000 -> 26.405999999999999
A6: 三不同号 | B6: 标准选号 | C6: 从1-6中任意选择3个或3个以上号码。 | D6: 投注方案：2,5,6；开奖号码中出现：1个2、1个5、1个8 (顺序不限)，即中三不同号一等奖。 | E6: =6/(6^3) -> 0.027777777777777776 | F6: 1 | G6: =(1/E6)*F6 -> 36 | H6: =2*G6*1800/2000 -> 64.80 | I6: =2*G6*1956/2000 -> 70.415999999999997
B7: 手动输入 | C7: 从1-6中任意选择3个或3个以上号码。 | D7: 投注方案：2,5,6；开奖号码中出现：1个2、1个5、1个8 (顺序不限)，即中三不同号一等奖。 | E7: =6/(6^3) -> 0.027777777777777776 | F7: 1 | G7: =(1/E7)*F7 -> 36 | H7: =2*G7*1800/2000 -> 64.80 | I7: =2*G7*1956/2000 -> 70.415999999999997
B8: 胆拖选号 | C8: 从1-9中任意选择2个或2个以上的号码。 | D8: 投注方案胆码：2,5；另一组投注为拖码：8 ；开奖号码中出现：1个2、1个5 、1个8 (顺序不限)，即中奖。 | E8: =6/(6^3) -> 0.027777777777777776 | F8: 1 | G8: =(1/E8)*F8 -> 36 | H8: =2*G8*1800/2000 -> 64.80 | I8: =2*G8*1956/2000 -> 70.415999999999997
A9: 三同号 | B9: 三同号单选 | C9: 选择任意一组以上三位相同的号码。 | D9: 投注方案：222；开奖号码中出现：3个2 (顺序不限)，即中三同号一等奖。 | E9: =1/216 -> 0.0046296296296296294 | F9: 1 | G9: =(1/E9)*F9 -> 216 | H9: =2*G9*1800/2000 -> 388.80 | I9: =2*G9*1956/2000 -> 422.49599999999998
B10: 三同号通选 | C10: 对111,222,333,444,555,666进行投注。 | D10: 投注方案：通选；开奖号码中出现：3个2或3个其他数字，即中三同号一等奖。 | E10: =6/216 -> 0.027777777777777776 | F10: 1 | G10: =(1/E10)*F10 -> 36 | H10: =2*G10*1800/2000 -> 64.80 | I10: =2*G10*1956/2000 -> 70.415999999999997
A11: 和值 | B11: 和值：3和18 | C11: 从3-18中任意选择1个或1个以上号码。 | D11: 投注方案：和值4；开奖号码前三位：112,即中江苏快三和值一等奖。 | E11: =1/216 -> 0.0046296296296296294 | F11: 1 | G11: =(1/E11)*F11 -> 216 | H11: =2*G11*1800/2000 -> 388.80 | I11: =2*G11*1956/2000 -> 422.49599999999998
B12: 和值：4和17 | E12: =3/216 -> 0.013888888888888888 | F12: 1 | G12: =(1/E12)*F12 -> 72 | H12: =2*G12*1800/2000 -> 129.60 | I12: =2*G12*1956/2000 -> 140.83199999999999
B13: 和值：5和16 | E13: =6/216 -> 0.027777777777777776 | F13: 1 | G13: =(1/E13)*F13 -> 36 | H13: =2*G13*1800/2000 -> 64.80 | I13: =2*G13*1956/2000 -> 70.415999999999997
B14: 和值：6和15 | E14: =10/216 -> 0.046296296296296294 | F14: 1 | G14: =(1/E14)*F14 -> 21.60 | H14: =2*G14*1800/2000 -> 38.880000000000003 | I14: =2*G14*1956/2000 -> 42.249600000000008
B15: 和值：7和14 | E15: =15/216 -> 0.069444444444444448 | F15: 1 | G15: =(1/E15)*F15 -> 14.40 | H15: =2*G15*1800/2000 -> 25.919999999999995 | I15: =2*G15*1956/2000 -> 28.166399999999999
B16: 和值：8和13 | E16: =21/216 -> 0.097222222222222224 | F16: 1 | G16: =(1/E16)*F16 -> 10.285714285714285 | H16: =2*G16*1800/2000 -> 18.514285714285712 | I16: =2*G16*1956/2000 -> 20.118857142857141
B17: 和值：9和12 | E17: =25/216 -> 0.11574074074074074 | F17: 1 | G17: =(1/E17)*F17 -> 8.64 | H17: =2*G17*1800/2000 -> 15.552000000000001 | I17: =2*G17*1956/2000 -> 16.899840000000001
B18: 和值：10和11 | E18: =27/216 -> 0.125 | F18: 1 | G18: =(1/E18)*F18 -> 8 | H18: =2*G18*1800/2000 -> 14.40 | I18: =2*G18*1956/2000 -> 15.648
A19: 二不同号 | B19: 标准选号 | C19: 从1-6中任意选择2个或2个以上号码。 | D19: 投注方案：2,5；开奖号码中出现：1个2、1个5 (顺序不限)，即中二不同号一等奖。 | E19: =30/216 -> 0.1388888888888889 | F19: 1 | G19: =(1/E19)*F19 -> 7.1999999999999993 | H19: =2*G19*1800/2000 -> 12.959999999999997 | I19: =2*G19*1956/2000 -> 14.0832
B20: 手动输入 | C20: 手动输入号码，至少输入1-6中两个不同的数字组成一注号码。 | D20: 投注方案：25；开奖号码：2*5，即中二不同号一等奖。 | E20: =30/216 -> 0.1388888888888889 | F20: 1 | G20: =(1/E20)*F20 -> 7.1999999999999993 | H20: =2*G20*1800/2000 -> 12.959999999999997 | I20: =2*G20*1956/2000 -> 14.0832
B21: 胆拖选号 | C21: 从1-6中任意选择1个胆码以及1个以上的号码作为拖码。 | D21: 投注方案：2；开奖号码：2**，即中奖。 | E21: =(36-1)/216 -> 0.16203703703703703 | F21: 1 | G21: =(1/E21)*F21 -> 6.1714285714285717 | H21: =2*G21*1800/2000 -> 11.108571428571429 | I21: =2*G21*1956/2000 -> 12.071314285714287
A22: 二同号单选 | B22: 标准选号 | C22: 是指对三个号码中两个指定的相同号码和一个指定的不同号码进行投注。 | D22: 投注方案：112；开奖号码112，121，211，即中奖。 | E22: =3/216 -> 0.013888888888888888 | F22: 1 | G22: =(1/E22)*F22 -> 72 | H22: =2*G22*1800/2000 -> 129.60 | I22: =2*G22*1956/2000 -> 140.83199999999999
B23: 手动输入 | C23: 是指对三个号码中两个指定的相同号码和一个指定的不同号码进行投注。 | D23: 投注方案： 112；开奖号码112，121，211，即中奖。 | E23: =3/216 -> 0.013888888888888888 | F23: 1 | G23: =(1/E23)*F23 -> 72 | H23: =2*G23*1800/2000 -> 129.60 | I23: =2*G23*1956/2000 -> 140.83199999999999
A24: 三连号 | B24: 三连号单选 | C24: 对123,234,345,456其中一组号码进行投注。 | D24: 投注方案：123；开奖号码中出现：123,132,213,231,321,312中的任意一组数组即为中奖。 | E24: =6/216 -> 0.027777777777777776 | F24: 1 | G24: =(1/E24)*F24 -> 36 | H24: =2*G24*1800/2000 -> 64.80 | I24: =2*G24*1956/2000 -> 70.415999999999997
B25: 三连号通选 | C25: 对123,234,345,456进行投注。 | D25: 投注方案：通选；开奖号码中出现：123,234,345,456中的任意一组数组即为中奖。 | E25: =24/216 -> 0.1111111111111111 | F25: 1 | G25: =(1/E25)*F25 -> 9 | H25: =2*G25*1800/2000 -> 16.20 | I25: =2*G25*1956/2000 -> 17.603999999999999
A26: 半顺 | B26: 半顺单选 | C26: 半顺号指的是三位数字中，有两个号码呈现连号状态（顺序不限）（出现两个相同号即为对子，不算半顺）（出现三个号码呈现连号状态为顺子号，不算半顺号）。 | D26: 投注方案：半顺开奖号码：126，即中半顺。 | E26: =6/216 -> 0.027777777777777776 | F26: 1 | G26: =(1/E26)*F26 -> 36 | H26: =2*G26*1800/2000 -> 64.80 | I26: =2*G26*1956/2000 -> 70.415999999999997
B27: 半顺通选 | E27: =36/216 -> 0.16666666666666666 | F27: 1 | G27: =(1/E27)*F27 -> 6 | H27: =2*G27*1800/2000 -> 10.80 | I27: =2*G27*1956/2000 -> 11.736000000000001
A28: 杂六 | B28: 杂六单选 | C28: 杂六号指的是三位数字中，状态非豹子号、顺子号、对子号、半顺号，即为杂六。 | D28: 投注方案：杂六开奖号码：135，即中杂六。 | E28: =6/216 -> 0.027777777777777776 | F28: 1 | G28: =(1/E28)*F28 -> 36 | H28: =2*G28*1800/2000 -> 64.80 | I28: =2*G28*1956/2000 -> 70.415999999999997
B29: 杂六通选 | E29: =12/216 -> 0.055555555555555552 | F29: 1 | G29: =(1/E29)*F29 -> 18 | H29: =2*G29*1800/2000 -> 32.40 | I29: =2*G29*1956/2000 -> 35.207999999999998
A30: 大小单双 | B30: 大 | C30: 选择大或小进行投注，只要开奖的第一名车号的大小(注：3-10为小；11-18为大)，单双与所选项一致即中奖。 | D30: 投注方案：大；开奖号码中出现：1个2、1个5、1个8 (顺序不限)，2+5+6=13，即为中奖。 | E30: =1/2 -> 0.50 | F30: 1 | G30: =(1/E30)*F30 -> 2 | H30: =2*G30*1800/2000 -> 3.60 | I30: =2*G30*1956/2000 -> 3.9119999999999999
B31: 小 | E31: =1/2 -> 0.50 | F31: 1 | G31: =(1/E31)*F31 -> 2 | H31: =2*G31*1800/2000 -> 3.60 | I31: =2*G31*1956/2000 -> 3.9119999999999999
B32: 单 | E32: =1/2 -> 0.50 | F32: 1 | G32: =(1/E32)*F32 -> 2 | H32: =2*G32*1800/2000 -> 3.60 | I32: =2*G32*1956/2000 -> 3.9119999999999999
B33: 双 | E33: =1/2 -> 0.50 | F33: 1 | G33: =(1/E33)*F33 -> 2 | H33: =2*G33*1800/2000 -> 3.60 | I33: =2*G33*1956/2000 -> 3.9119999999999999
A34: 猜一个号 | B34: 猜一个号 | C34: 从1-6这六个号码中选择一个进行投注，若选择的号码出现在开奖号码中，即为中奖。 | D34: 投注方案：2；开奖号码中出现：1个2、1个5、1个8 (顺序不限)，即中猜一个号。 | E34: =91/216 -> 0.42129629629629628 | F34: 1 | G34: =(1/E34)*F34 -> 2.3736263736263736 | H34: =2*G34*1800/2000 -> 4.2725274725274724 | I34: =2*G34*1956/2000 -> 4.6428131868131866