A1: 玩法组 | B1: 玩法 | C1: 玩法说明 | D1: 中奖举例 | E1: 中奖概率 | F1: 投注注数 | G1: 理论赔率 | H1: 奖金组1800 | I1: 奖金组1956
A3: 选出20个号码为开奖号码，数字为1到80号，数字不可重复开出
A4: 趣味 | B4: 和值大小：小 | C4: 选择20个开奖号码总和值的大小属性：小于810为“小”，等于810为“和”，大于810为“大”。 | D4: 投注方案：和值大小“小”，开奖号码：01 02 03 04 05 06 07 08 09 10 11 12 13 14 15 16 17 18 19 20，中奖结果：和值大小“小”。 | E4: 0.49780000000000002 | F4: 1 | G4: =(1/E4)*F4 -> 2.0088388911209321 | H4: =2*G4*1800/2000 -> 3.6159100040176777 | I4: =2*G4*1956/2000 -> 3.9292888710325431
B5: 和值大小：和 | E5: 0.0044000000000000003 | F5: 1 | G5: =(1/E5)*F5 -> 227.27272727272725 | H5: =2*G5*1800/2000 -> 409.09090909090907 | I5: =2*G5*1956/2000 -> 444.5454545454545
B6: 和值大小：大 | E6: 0.49780000000000002 | F6: 1 | G6: =(1/E6)*F6 -> 2.0088388911209321 | H6: =2*G6*1800/2000 -> 3.6159100040176777 | I6: =2*G6*1956/2000 -> 3.9292888710325431
B7: 奇偶盘：奇 | C7: 选择20个开奖号码中包含奇偶号码个数多少的关系，任选一个奇偶盘属性，当开奖结果的20个号码的奇偶盘属性与所投注的结果一致，即为中奖。 | D7: 投注方案：奇偶盘“和”，开奖号码：01 02 03 04 05 06 07 08 09 10 11 12 13 14 15 16 17 18 19 20，中奖结果：奇偶盘“和”。 | E7: 0.39839999999999998 | F7: 1 | G7: =(1/E7)*F7 -> 2.5100401606425704 | H7: =2*G7*1800/2000 -> 4.5180722891566267 | I7: =2*G7*1956/2000 -> 4.9096385542168672
B8: 奇偶盘：和 | E8: 0.20319999999999999 | F8: 1 | G8: =(1/E8)*F8 -> 4.9212598425196852 | H8: =2*G8*1800/2000 -> 8.8582677165354333 | I8: =2*G8*1956/2000 -> 9.6259842519685037
B9: 奇偶盘：偶 | E9: 0.39839999999999998 | F9: 1 | G9: =(1/E9)*F9 -> 2.5100401606425704 | H9: =2*G9*1800/2000 -> 4.5180722891566267 | I9: =2*G9*1956/2000 -> 4.9096385542168672
B10: 上下盘：上 | C10: 选择2个开奖号码中包含上盘(01-40)与下盘(41-80)号码个数多少的关系，任选一个上下盘属性，当开奖结果的20个号码的上下盘属性与所投注的结果一致，即为中奖。 | D10: 投注方案：上下盘“上”开奖号码：01 02 03 04 05 06 07 08 09 10 11 12 13 14 15 16 17 18 19 20，中奖结果：上下盘“上”。 | E10: 0.39839999999999998 | F10: 1 | G10: =(1/E10)*F10 -> 2.5100401606425704 | H10: =2*G10*1800/2000 -> 4.5180722891566267 | I10: =2*G10*1956/2000 -> 4.9096385542168672
B11: 上下盘：和 | E11: 0.20319999999999999 | F11: 1 | G11: =(1/E11)*F11 -> 4.9212598425196852 | H11: =2*G11*1800/2000 -> 8.8582677165354333 | I11: =2*G11*1956/2000 -> 9.6259842519685037
B12: 上下盘：下 | E12: 0.39839999999999998 | F12: 1 | G12: =(1/E12)*F12 -> 2.5100401606425704 | H12: =2*G12*1800/2000 -> 4.5180722891566267 | I12: =2*G12*1956/2000 -> 4.9096385542168672
B13: 和值单双 | C13: 20个开奖号码的总和值为奇数中"单"，为偶数时中"双"。 | D13: 投注方案：和值单双“双”，开奖号码：01 02 03 04 05 06 07 08 09 10 11 12 13 14 15 16 17 18 19 20，中奖结果：和值大小单双“双”。 | E13: =1/2 -> 0.50 | F13: 1 | G13: =(1/E13)*F13 -> 2 | H13: =2*G13*1800/2000 -> 3.60 | I13: =2*G13*1956/2000 -> 3.9119999999999999
B14: 和值大小单双：小单 | C14: 选择20个开奖号码总和值的大小单双属性，任选一个和值大小单双属性，当开奖结果的20个号码的和值大小单双属性与所投注的结果一致，即为中奖。 | D14: 投注方案：和值大小单双“小双”，开奖号码：01 02 03 04 05 06 07 08 09 10 11 12 13 14 15 16 17 18 19 20，中奖结果：和值大小单双“小双”。 | E14: 0.25 | F14: 1 | G14: =(1/E14)*F14 -> 4 | H14: =2*G14*1800/2000 -> 7.20 | I14: =2*G14*1956/2000 -> 7.8239999999999998
B15: 和值大小单双：小双 | E15: 0.24779999999999999 | F15: 1 | G15: =(1/E15)*F15 -> 4.0355125100887816 | H15: =2*G15*1800/2000 -> 7.2639225181598066 | I15: =2*G15*1956/2000 -> 7.8934624697336568
B16: 和值大小单双：大单 | E16: 0.25 | F16: 1 | G16: =(1/E16)*F16 -> 4 | H16: =2*G16*1800/2000 -> 7.20 | I16: =2*G16*1956/2000 -> 7.8239999999999998
B17: 和值大小单双：大双 | E17: 0.24779999999999999 | F17: 1 | G17: =(1/E17)*F17 -> 4.0355125100887816 | H17: =2*G17*1800/2000 -> 7.2639225181598066 | I17: =2*G17*1956/2000 -> 7.8934624697336568
B18: 和值大小单双：和 | E18: 0.0044000000000000003 | F18: 1 | G18: =(1/E18)*F18 -> 227.27272727272725 | H18: =2*G18*1800/2000 -> 409.09090909090907 | I18: =2*G18*1956/2000 -> 444.5454545454545
A19: 任选型 | B19: 任选一 | C19: 从01-80中任选1个号码，当期开奖结果的20个号码中包含所选号码，即为中奖。 | D19: 投注方案：01，开奖号码：01 02 03 04 05 06 07 08 21 22 71 72 73 74 75 76 77 78 79 80，中奖结果：中1个号码。 | E19: =COMBIN(20,1)/COMBIN(80,1) -> 0.25 | F19: 1 | G19: =(1/E19)*F19 -> 4 | H19: =2*G19*1800/2000 -> 7.20 | I19: =2*G19*1956/2000 -> 7.8239999999999998
B20: 任选二 | C20: 从01-80中任选2个号码，当期开奖结果的20个号码中包含所选号码，即为中奖。 | D20: 投注方案：01 02，开奖号码：01 02 03 04 05 06 07 08 21 22 71 72 73 74 75 76 77 78 79 80，中奖结果：中2个号码。 | E20: =COMBIN(20,2)/COMBIN(80,2) -> 0.060126582278481014 | F20: 1 | G20: =(1/E20)*F20 -> 16.631578947368421 | H20: =2*G20*1800/2000 -> 29.936842105263157 | I20: =2*G20*1956/2000 -> 32.531368421052633
B21: 任选三中三 | C21: 从01-80中选择3个号码组成一注，当期开奖结果的20个号码中包含3个或2个所选号码，即可中奖。不兼中兼得。 | D21: 投注方案：01 02 03，开奖号码：01 02 03 04 05 06 07 08 21 22 71 72 73 74 75 76 77 78 79 80，中奖结果：中3个号码。 | E21: =COMBIN(20,3)/COMBIN(80,3) -> 0.013875365141187927 | F21: 1 | G21: =(1/E21)*F21 -> 72.070175438596493 | H21: =2*G21*1800/2000 -> 129.72631578947369 | I21: =2*G21*1956/2000 -> 140.96926315789474
B22: 任选三中二 | E22: =COMBIN(20,2)*COMBIN(60,1)/COMBIN(80,3) -> 0.13875365141187926 | F22: 1 | G22: =(1/E22)*F22 -> 7.2070175438596493 | H22: =2*G22*1800/2000 -> 12.972631578947368 | I22: =2*G22*1956/2000 -> 14.096926315789474
B23: 任选四中四 | C23: 从01-80中选择4个号码组成一注，当期开奖结果的20个号码中包含4个、3个或2个所选号码，即可中奖。不兼中兼得 | D23: 投注方案：01 02 03 04，开奖号码：01 02 03 04 05 06 07 08 21 22 71 72 73 74 75 76 77 78 79 80，中奖结果：中4个号码。 | E23: =COMBIN(20,4)/COMBIN(80,4) -> 0.0030633923038986331 | F23: 1 | G23: =(1/E23)*F23 -> 326.43550051599584 | H23: =2*G23*1800/2000 -> 587.58390092879256 | I23: =2*G23*1956/2000 -> 638.50783900928786
B24: 任选四中三 | E24: =COMBIN(20,3)*COMBIN(60,1)/COMBIN(80,4) -> 0.043247891349157172 | F24: 1 | G24: =(1/E24)*F24 -> 23.122514619883042 | H24: =2*G24*1800/2000 -> 41.620526315789476 | I24: =2*G24*1956/2000 -> 45.227638596491225
B25: 任选四中二 | E25: =COMBIN(20,2)*COMBIN(60,2)/COMBIN(80,4) -> 0.21263546580002277 | F25: 1 | G25: =(1/E25)*F25 -> 4.7028843294677367 | H25: =2*G25*1800/2000 -> 8.4651917930419263 | I25: =2*G25*1956/2000 -> 9.1988417484388929
B26: 任选五中五 | C26: 从01-80中选择5个号码组成一注，当期开奖结果的20个号码中包含5个、4个、或3个所选号码，或者出现0个所选号码，即可中奖。 | D26: 投注方案：01 02 03 04 05，开奖号码：01 02 03 04 05 06 07 08 21 22 71 72 73 74 75 76 77 78 79 80，中奖结果：中5个号码。 | E26: =COMBIN(20,5)/COMBIN(80,5) -> 0.00064492469555760691 | F26: 1 | G26: =(1/E26)*F26 -> 1550.5686274509806 | H26: =2*G26*1800/2000 -> 2791.0235294117647 | I26: =2*G26*1956/2000 -> 3032.9122352941181
B27: 任选五中四 | E27: =COMBIN(20,4)*COMBIN(60,1)/COMBIN(80,5) -> 0.01209233804170513 | F27: 1 | G27: =(1/E27)*F27 -> 82.696993464052284 | H27: =2*G27*1800/2000 -> 148.8545882352941 | I27: =2*G27*1956/2000 -> 161.75531921568626
B28: 任选五中三 | E28: =COMBIN(20,3)*COMBIN(60,2)/COMBIN(80,5) -> 0.08393505228948267 | F28: 1 | G28: =(1/E28)*F28 -> 11.913973634651601 | H28: =2*G28*1800/2000 -> 21.445152542372881 | I28: =2*G28*1956/2000 -> 23.303732429378531
B29: 任选六中六 | C29: 从01-80中任选6个号码，当期开奖结果的20个号码中包含所选号码，即为中奖。 | D29: 投注方案：01 02 03 04 05 06，开奖号码：01 02 03 04 05 06 07 08 21 22 71 72 73 74 75 76 77 78 79 80，中奖结果：中6个号码。 | E29: =COMBIN(20,6)/COMBIN(80,6) -> 0.00012898493911152139 | F29: 1 | G29: =(1/E29)*F29 -> 7752.8431372549021 | H29: =2*G29*1800/2000 -> 13955.117647058823 | I29: =2*G29*1956/2000 -> 15164.561176470588
B30: 任选六中五 | E30: =COMBIN(20,5)*COMBIN(60,1)/COMBIN(80,6) -> 0.0030956385386765131 | F30: 1 | G30: =(1/E30)*F30 -> 323.03513071895429 | H30: =2*G30*1800/2000 -> 581.46323529411768 | I30: =2*G30*1956/2000 -> 631.85671568627458
B31: 任选六中四 | E31: =COMBIN(20,4)*COMBIN(60,2)/COMBIN(80,6) -> 0.028537917778424106 | F31: 1 | G31: =(1/E31)*F31 -> 35.041098925445887 | H31: =2*G31*1800/2000 -> 63.073978065802599 | I31: =2*G31*1956/2000 -> 68.540389498172146
B32: 任选六中三 | E32: =COMBIN(20,3)*COMBIN(60,3)/COMBIN(80,6) -> 0.12981954754106653 | F32: 1 | G32: =(1/E32)*F32 -> 7.7030001948178448 | H32: =2*G32*1800/2000 -> 13.86540035067212 | I32: =2*G32*1956/2000 -> 15.067068381063704
B33: 任选七中七 | C33: 从01-80中选择7个号码组成一注，当期开奖结果的20个号码中包含7个、6个、5个、或4个所选号码，或者出现0个所选号码，即可中奖。 | D33: 投注方案：01 02 03 04 05 06 08，开奖号码：01 02 03 04 05 06 07 08 21 22 71 72 73 74 75 76 77 78 79 80，中奖结果：中7个号码。 | E33: =COMBIN(20,7)/COMBIN(80,7) -> 2.440255604812567E-05 | F33: 1 | G33: =(1/E33)*F33 -> 40979.313725490196 | H33: =2*G33*1800/2000 -> 73762.76470588235 | I33: =2*G33*1956/2000 -> 80155.537647058823
B34: 任选七中六 | E34: =COMBIN(20,6)*COMBIN(60,1)/COMBIN(80,7) -> 0.00073207668144377003 | F34: 1 | G34: =(1/E34)*F34 -> 1365.9771241830065 | H34: =2*G34*1800/2000 -> 2458.7588235294115 | I34: =2*G34*1956/2000 -> 2671.8512549019606
B35: 任选七中五 | E35: =COMBIN(20,5)*COMBIN(60,2)/COMBIN(80,7) -> 0.0086385048410364852 | F35: 1 | G35: =(1/E35)*F35 -> 115.76077323584803 | H35: =2*G35*1800/2000 -> 208.36939182452645 | I35: =2*G35*1956/2000 -> 226.42807244931873
B36: 任选七中四 | E36: =COMBIN(20,4)*COMBIN(60,3)/COMBIN(80,7) -> 0.052190966747928773 | F36: 1 | G36: =(1/E36)*F36 -> 19.160403845933462 | H36: =2*G36*1800/2000 -> 34.488726922680229 | I36: =2*G36*1956/2000 -> 37.477749922645856
B37: 任选七中零 | E37: =COMBIN(60,7)/COMBIN(80,7) -> 0.12157425195399875 | F37: 1 | G37: =(1/E37)*F37 -> 8.2254258934562881 | H37: =2*G37*1800/2000 -> 14.805766608221319 | I37: =2*G37*1956/2000 -> 16.088933047600499
A38: 五行 | B38: 金 | C38: 以开出的20个号码的总和分成5个区间，以金、木、水、火、土命名：金（210 - 695）、木（696 - 763）、水（764 - 855）、火（856 - 923）、土（924 - 1410）。 | D38: 假设：开奖号码为01、04、05、10、11、13、20、27、30、32、33、36、40、47、54、59、61、64、67、79，总和是693，则是金。下注"金"为赢，其余为输。 | E38: 0.10249999999999999 | F38: 1 | G38: =(1/E38)*F38 -> 9.7560975609756095 | H38: =2*G38*1800/2000 -> 17.560975609756095 | I38: =2*G38*1956/2000 -> 19.082926829268295
B39: 木 | E39: 0.20150000000000001 | F39: 1 | G39: =(1/E39)*F39 -> 4.9627791563275432 | H39: =2*G39*1800/2000 -> 8.9330024813895772 | I39: =2*G39*1956/2000 -> 9.7071960297766751
B40: 水 | E40: 0.38800000000000001 | F40: 1 | G40: =(1/E40)*F40 -> 2.5773195876288657 | H40: =2*G40*1800/2000 -> 4.6391752577319583 | I40: =2*G40*1956/2000 -> 5.0412371134020617
B41: 火 | E41: 0.20349999999999999 | F41: 1 | G41: =(1/E41)*F41 -> 4.9140049140049147 | H41: =2*G41*1800/2000 -> 8.8452088452088464 | I41: =2*G41*1956/2000 -> 9.6117936117936136
B42: 土 | E42: 0.1045 | F42: 1 | G42: =(1/E42)*F42 -> 9.5693779904306222 | H42: =2*G42*1800/2000 -> 17.224880382775122 | I42: =2*G42*1956/2000 -> 18.717703349282296