A1: 玩法组 | B1: 玩法 | C1: 玩法说明 | D1: 中奖举例 | E1: 中奖概率 | F1: 投注注数 | G1: 理论赔率 | H1: 奖金组1800 | I1: 奖金组1956
A3: 从10辆赛车中跑出1到10名位置，数字不可重复开出
A4: 猜冠军 | B4: 猜冠军复式 | C4: 从第一位中选择1个以上号码组成一注，所选号码与开奖号码的第一位相同，即为中奖。 | D4: 投注方案：1；开奖号码：12345678910，即为中奖。 | E4: =1/10 -> 0.10 | F4: 1 | G4: =(1/E4)*F4 -> 10 | H4: =2*G4*1800/2000 -> 18 | I4: =2*G4*1956/2000 -> 19.56
A5: 猜前二 | B5: 猜前二复式 | C5: 从第一位以及第二位中选择2个以上的号码组成一注，所选号码与开奖号码的第一位、第二位相同，即为中奖。 | D5: 投注方案：1,2；开奖号码：12345678910，即为中奖。 | E5: =1/90 -> 0.011111111111111112 | F5: 1 | G5: =(1/E5)*F5 -> 90 | H5: =2*G5*1800/2000 -> 162 | I5: =2*G5*1956/2000 -> 176.04
B6: 猜前二单式 | E6: =1/90 -> 0.011111111111111112 | F6: 1 | G6: =(1/E6)*F6 -> 90 | H6: =2*G6*1800/2000 -> 162 | I6: =2*G6*1956/2000 -> 176.04
A7: 猜前三 | B7: 猜前三复式 | C7: 从第一位至第三位中选择3个以上的号码组成一注，所选号码与开奖号码的第一位、第二位、第三位相同，即为中奖。 | D7: 投注方案：1,2,3；开奖号码：12345678910，即为中奖。 | E7: =1/720 -> 0.0013888888888888889 | F7: 1 | G7: =(1/E7)*F7 -> 720 | H7: =2*G7*1800/2000 -> 1296 | I7: =2*G7*1956/2000 -> 1408.32
B8: 猜前三单式 | E8: =1/720 -> 0.0013888888888888889 | F8: 1 | G8: =(1/E8)*F8 -> 720 | H8: =2*G8*1800/2000 -> 1296 | I8: =2*G8*1956/2000 -> 1408.32
A9: 猜前四 | B9: 猜前四复式 | C9: 从第1-4位中选择4个以上的号码组成1注、所选号码与开奖号码的前4位相同，即中奖。 | D9: 投注方案：05 08 09 10；开奖号码前4位：05 08 09 10 既中猜前四复式一等奖。 | E9: =1/5040 -> 0.00019841269841269841 | F9: 1 | G9: =(1/E9)*F9 -> 5040 | H9: =2*G9*1800/2000 -> 9072 | I9: =2*G9*1956/2000 -> 9858.24
B10: 猜前四单式 | E10: =1/5040 -> 0.00019841269841269841 | F10: 1 | G10: =(1/E10)*F10 -> 5040 | H10: =2*G10*1800/2000 -> 9072 | I10: =2*G10*1956/2000 -> 9858.24
A11: 猜前五 | B11: 猜前五复式 | C11: 从第1-5位中选择5个以上的号码组成1注、所选号码与开奖号码的前5位相同，即中奖。 | D11: 投注方案：05 08 09 07 01；开奖号码前5位：05 08 09 07 01,即中猜前五复式一等奖。 | E11: =1/30240 -> 3.3068783068783071E-05 | F11: 1 | G11: =(1/E11)*F11 -> 30239.999999999996 | H11: =2*G11*1800/2000 -> 54431.999999999993 | I11: =2*G11*1956/2000 -> 59149.439999999995
B12: 猜前五单式 | E12: =1/30240 -> 3.3068783068783071E-05 | F12: 1 | G12: =(1/E12)*F12 -> 30239.999999999996 | H12: =2*G12*1800/2000 -> 54431.999999999993 | I12: =2*G12*1956/2000 -> 59149.439999999995
A13: 猜前六 | B13: 猜前六复式 | C13: 从第1-6位中选择6个以上的号码组成1注、所选号码与开奖号码的前6位相同，即中奖。 | D13: 投注方案：05 08 09 07 01 03；开奖号码前6位：05 08 09 07 01 03,即中猜前六复式一等奖。 | E13: =1/151200 -> 6.613756613756614E-06 | F13: 1 | G13: =(1/E13)*F13 -> 151200 | H13: =2*G13*1800/2000 -> 272160 | I13: =2*G13*1956/2000 -> 295747.20
B14: 猜前六单式 | E14: =1/151200 -> 6.613756613756614E-06 | F14: 1 | G14: =(1/E14)*F14 -> 151200 | H14: =2*G14*1800/2000 -> 272160 | I14: =2*G14*1956/2000 -> 295747.20
A15: 定位胆 | B15: 位置1~位置10 | C15: 从位置1~位置10，十个任意位置上至少选择1个以上号码，所选号码与同位置上的开奖号码一致，即为中奖。 | D15: 投注方案：1；开奖号码第一位：1，即为中奖。 | E15: =1/10 -> 0.10 | F15: 1 | G15: =(1/E15)*F15 -> 10 | H15: =2*G15*1800/2000 -> 18 | I15: =2*G15*1956/2000 -> 19.56
A16: 和值 | B16: 二和值：3和19 | C16: 从3-19中任意选择1个以上号码，所选数值等于开奖号码前第1-2名数字相加之和，即为中奖。 | D16: 投注方案：和值3；開獎號碼前第1-2名、第5-6名、第9-10名：(1)開出02 01號碼，順序不限，即中獎；(2)開出01 03號碼，順序不限，即不中獎", | E16: =1/45 -> 0.022222222222222223 | F16: 1 | G16: =(1/E16)*F16 -> 45 | H16: =2*G16*1800/2000 -> 81 | I16: =2*G16*1956/2000 -> 88.02
B17: 二和值：4和18 | E17: =1/45 -> 0.022222222222222223 | F17: 1 | G17: =(1/E17)*F17 -> 45 | H17: =2*G17*1800/2000 -> 81 | I17: =2*G17*1956/2000 -> 88.02
B18: 二和值：5和17 | E18: =2/45 -> 0.044444444444444446 | F18: 1 | G18: =(1/E18)*F18 -> 22.50 | H18: =2*G18*1800/2000 -> 40.50 | I18: =2*G18*1956/2000 -> 44.01
B19: 二和值：6和16 | E19: =2/45 -> 0.044444444444444446 | F19: 1 | G19: =(1/E19)*F19 -> 22.50 | H19: =2*G19*1800/2000 -> 40.50 | I19: =2*G19*1956/2000 -> 44.01
B20: 二和值：7和15 | E20: =3/45 -> 0.066666666666666666 | F20: 1 | G20: =(1/E20)*F20 -> 15 | H20: =2*G20*1800/2000 -> 27 | I20: =2*G20*1956/2000 -> 29.34
B21: 二和值：8和14 | E21: =3/45 -> 0.066666666666666666 | F21: 1 | G21: =(1/E21)*F21 -> 15 | H21: =2*G21*1800/2000 -> 27 | I21: =2*G21*1956/2000 -> 29.34
B22: 二和值：9和13 | E22: =4/45 -> 0.088888888888888892 | F22: 1 | G22: =(1/E22)*F22 -> 11.25 | H22: =2*G22*1800/2000 -> 20.25 | I22: =2*G22*1956/2000 -> 22.005
B23: 二和值：10和12 | E23: =4/45 -> 0.088888888888888892 | F23: 1 | G23: =(1/E23)*F23 -> 11.25 | H23: =2*G23*1800/2000 -> 20.25 | I23: =2*G23*1956/2000 -> 22.005
B24: 二和值：11 | E24: =5/45 -> 0.1111111111111111 | F24: 1 | G24: =(1/E24)*F24 -> 9 | H24: =2*G24*1800/2000 -> 16.20 | I24: =2*G24*1956/2000 -> 17.603999999999999
B25: 三和值：6和27 | C25: 从6-27中任意选择1个以上号码，所选数值等于开奖号码第1-3 名数字相加之和，即为中奖。 | D25: 投注方案：和值6；開獎號碼前第1-3名、第8-10名：(1)開出02 01 03號碼，順序不限，即中獎；(2)開出01 04 03號碼，順序不限，即不中獎", | E25: =1/120 -> 0.0083333333333333332 | F25: 1 | G25: =(1/E25)*F25 -> 120 | H25: =2*G25*1800/2000 -> 216 | I25: =2*G25*1956/2000 -> 234.72
B26: 三和值：7和26 | E26: =1/120 -> 0.0083333333333333332 | F26: 1 | G26: =(1/E26)*F26 -> 120 | H26: =2*G26*1800/2000 -> 216 | I26: =2*G26*1956/2000 -> 234.72
B27: 三和值：8和25 | E27: =2/120 -> 0.016666666666666666 | F27: 1 | G27: =(1/E27)*F27 -> 60 | H27: =2*G27*1800/2000 -> 108 | I27: =2*G27*1956/2000 -> 117.36
B28: 三和值：9和24 | E28: =3/120 -> 0.025 | F28: 1 | G28: =(1/E28)*F28 -> 40 | H28: =2*G28*1800/2000 -> 72 | I28: =2*G28*1956/2000 -> 78.239999999999995
B29: 三和值：10和23 | E29: =4/120 -> 0.033333333333333333 | F29: 1 | G29: =(1/E29)*F29 -> 30 | H29: =2*G29*1800/2000 -> 54 | I29: =2*G29*1956/2000 -> 58.68
B30: 三和值：11和22 | E30: =5/120 -> 0.041666666666666664 | F30: 1 | G30: =(1/E30)*F30 -> 24 | H30: =2*G30*1800/2000 -> 43.20 | I30: =2*G30*1956/2000 -> 46.944000000000003
B31: 三和值：12和21 | E31: =7/120 -> 0.058333333333333334 | F31: 1 | G31: =(1/E31)*F31 -> 17.142857142857142 | H31: =2*G31*1800/2000 -> 30.857142857142854 | I31: =2*G31*1956/2000 -> 33.53142857142857
B32: 三和值：13和20 | E32: =8/120 -> 0.066666666666666666 | F32: 1 | G32: =(1/E32)*F32 -> 15 | H32: =2*G32*1800/2000 -> 27 | I32: =2*G32*1956/2000 -> 29.34
B33: 三和值：14和19 | E33: =9/120 -> 0.075 | F33: 1 | G33: =(1/E33)*F33 -> 13.333333333333334 | H33: =2*G33*1800/2000 -> 24 | I33: =2*G33*1956/2000 -> 26.08
B34: 三和值：15和18 | E34: =10/120 -> 0.083333333333333329 | F34: 1 | G34: =(1/E34)*F34 -> 12 | H34: =2*G34*1800/2000 -> 21.60 | I34: =2*G34*1956/2000 -> 23.472000000000001
B35: 三和值：16和17 | E35: =10/120 -> 0.083333333333333329 | F35: 1 | G35: =(1/E35)*F35 -> 12 | H35: =2*G35*1800/2000 -> 21.60 | I35: =2*G35*1956/2000 -> 23.472000000000001
B36: 和值大小单双：大 | C36: 对冠亚军和值的“大（12~19）、小（3~11）、单（03 05 07 09 11 13 15 17 19）、双（04 06 08 10 12 14 16 18）”形态进行购买，所选号码的形态与开奖号码的形态相同，即为中奖。 | D36: 投注方案：双；开奖号码冠亚军和值為双，即为中奖。 | E36: =40/90 -> 0.44444444444444442 | F36: 1 | G36: =(1/E36)*F36 -> 2.25 | H36: =2*G36*1800/2000 -> 4.05 | I36: =2*G36*1956/2000 -> 4.4009999999999998
B37: 和值大小单双：小 | E37: =50/90 -> 0.55555555555555558 | F37: 1 | G37: =(1/E37)*F37 -> 1.7999999999999998 | H37: =2*G37*1800/2000 -> 3.2399999999999993 | I37: =2*G37*1956/2000 -> 3.5207999999999999
B38: 和值大小单双：单 | E38: =50/90 -> 0.55555555555555558 | F38: 1 | G38: =(1/E38)*F38 -> 1.7999999999999998 | H38: =2*G38*1800/2000 -> 3.2399999999999993 | I38: =2*G38*1956/2000 -> 3.5207999999999999
B39: 和值大小单双：双 | E39: =40/90 -> 0.44444444444444442 | F39: 1 | G39: =(1/E39)*F39 -> 2.25 | H39: =2*G39*1800/2000 -> 4.05 | I39: =2*G39*1956/2000 -> 4.4009999999999998
A40: 大小单双 | B40: 大 | C40: 选择大或小进行投注，只要开奖的第一名车号的大小(注：1,2,3,4,5为小；6,7,8,9,10为大)，单双(注：1 ,3,5,7,9为单；2,4,6,8,10为双)与所选项一致即中奖。 | D40: 猜大小单双共分为：第1名大小单双，第2名大小单双，第3名大小单双。 | E40: =5/10 -> 0.50 | F40: 1 | G40: =(1/E40)*F40 -> 2 | H40: =2*G40*1800/2000 -> 3.60 | I40: =2*G40*1956/2000 -> 3.9119999999999999
B41: 小 | E41: =5/10 -> 0.50 | F41: 1 | G41: =(1/E41)*F41 -> 2 | H41: =2*G41*1800/2000 -> 3.60 | I41: =2*G41*1956/2000 -> 3.9119999999999999
B42: 单 | E42: =5/10 -> 0.50 | F42: 1 | G42: =(1/E42)*F42 -> 2 | H42: =2*G42*1800/2000 -> 3.60 | I42: =2*G42*1956/2000 -> 3.9119999999999999
B43: 双 | E43: =5/10 -> 0.50 | F43: 1 | G43: =(1/E43)*F43 -> 2 | H43: =2*G43*1800/2000 -> 3.60 | I43: =2*G43*1956/2000 -> 3.9119999999999999
A44: 龙虎 | B44: 冠军龙虎 | C44: 第一名车号大于第十名车号视为【龙】中奖，反之小于视为【虎】中奖，其余情形视为不中奖。 | D44: 投注方案：【龙】；开奖号码第一名和第十名：09 03，即中奖 | E44: =5/10 -> 0.50 | F44: 1 | G44: =(1/E44)*F44 -> 2 | H44: =2*G44*1800/2000 -> 3.60 | I44: =2*G44*1956/2000 -> 3.9119999999999999
B45: 亚军龙虎 | C45: 第二名车号大于第九名车号视为【龙】中奖，反之小于视为【虎】中奖，其余情形视为不中奖。 | D45: 投注方案：【龙】；开奖号码第二名和第九名：09 03，即中奖 | E45: =5/10 -> 0.50 | F45: 1 | G45: =(1/E45)*F45 -> 2 | H45: =2*G45*1800/2000 -> 3.60 | I45: =2*G45*1956/2000 -> 3.9119999999999999
B46: 季军龙虎 | C46: 第三名车号大于第八名车号视为【龙】中奖，反之小于视为【虎】中奖，其余情形视为不中奖。 | D46: 投注方案：【龙】；开奖号码第三名和第八名：09 03，即中奖 | E46: =5/10 -> 0.50 | F46: 1 | G46: =(1/E46)*F46 -> 2 | H46: =2*G46*1800/2000 -> 3.60 | I46: =2*G46*1956/2000 -> 3.9119999999999999
B47: 第四名龙虎 | C47: 第四名车号大于第七名车号视为【龙】中奖，反之小于视为【虎】中奖，其余情形视为不中奖。 | D47: 投注方案：【龙】；开奖号码第四名和第七名：09 03，即中奖 | E47: =5/10 -> 0.50 | F47: 1 | G47: =(1/E47)*F47 -> 2 | H47: =2*G47*1800/2000 -> 3.60 | I47: =2*G47*1956/2000 -> 3.9119999999999999
B48: 第五名龙虎 | C48: 第五名车号大于第六名车号视为【龙】中奖，反之小于视为【虎】中奖，其余情形视为不中奖。 | D48: 投注方案：【龙】；开奖号码第五名和第六名：09 03，即中奖 | E48: =5/10 -> 0.50 | F48: 1 | G48: =(1/E48)*F48 -> 2 | H48: =2*G48*1800/2000 -> 3.60 | I48: =2*G48*1956/2000 -> 3.9119999999999999
A49: 竞速 | C49: 从第一排号码，选择任意两个号码放进快vs慢两排组成一注，所选号码与开奖号码的顺序相同，位置不限，即中奖。 | D49: 投注方案：05vs08；开奖号码：...05...08...即中竞速一等奖。 | E49: =1/2 -> 0.50 | F49: 1 | G49: =(1/E49)*F49 -> 2 | H49: =2*G49*1800/2000 -> 3.60 | I49: =2*G49*1956/2000 -> 3.9119999999999999
A50: 组合 | B50: 冠亚组合 | C50: 所选2个数值为开奖号码的冠军及亚军(顺序不限)，即为中奖。 | D50: 如：选择01 02，开奖号码为01,02,*******、02,01,*******，即为中奖。 | E50: =1/45 -> 0.022222222222222223 | F50: 1 | G50: =(1/E50)*F50 -> 45 | H50: =2*G50*1800/2000 -> 81 | I50: =2*G50*1956/2000 -> 88.02