A1: 玩法组 | B1: 玩法 | C1: 玩法说明 | D1: 中奖举例 | E1: 中奖概率 | F1: 投注注数 | G1: 理论赔率 | H1: 奖金组1800 | I1: 奖金组1956
A3: 从5颗球中选出5个号码为开奖号码，数字为0到9号，数字可重复开出
A4: 五星直选 | B4: 直选（复式） | C4: 从万位、千位、百位、十位、个位中选择一个5位数号码组成一注，所选号码与开奖号码全部相同，且顺序一致，即为中奖。 | D4: 如：投注方案：23456；开奖号码：23456，即中五星直选。 | E4: =1/(10*10*10*10*10) -> 0.00001 | F4: 1 | G4: =ROUND((1/E4)*F4,3) -> 100000 | H4: =ROUND(2*G4*1800/2000,3) -> 180000 | I4: =ROUND(2*G4*1956/2000,3) -> 195600
B5: 直选（单式） | C5: 手动输入一个5位数号码组成一注，所选号码的万位、千位、百位、十位、个位与开奖号码相同，且顺序一致，即为中奖。 | D5: 如：投注方案：23456；开奖号码：23456，即中五星直选。 | E5: =1/(10*10*10*10*10) -> 0.00001 | F5: 1 | G5: =ROUND((1/E5)*F5,3) -> 100000 | H5: =ROUND(2*G5*1800/2000,3) -> 180000 | I5: =ROUND(2*G5*1956/2000,3) -> 195600
B6: 组合：一等奖 | C6: 从万位、千位、百位、十位、个位中至少各选一个号码组成1-5星的组合，共五注，所选号码的个位与开奖号码全部相同，则中1个5等奖；所选号码的个位、十位与开奖号码相同，则中1个5等奖以及1个4等奖，依此类推，最高可中5个奖。 | D6: 如：五星组合示例，如购买：4+5+6+7+8，该票共10元，由以下5注：45678(五星)、5678(四星)、678(三星)、78(二星) 、8(一星)构成。开奖号码：45678，即可中五星、四星、三星、二星、一星各1注。 | E6: =1/(10*10*10*10*10) -> 0.00001 | F6: 1 | G6: =ROUND((1/E6)*F6,3) -> 100000 | H6: =ROUND(2*G6*1800/2000,3) -> 180000 | I6: =ROUND(2*G6*1956/2000,3) -> 195600
B7: 组合：二等奖 | E7: =1/(10*10*10*10) -> 0.0001 | F7: 1 | G7: =ROUND((1/E7)*F7,3) -> 10000 | H7: =ROUND(2*G7*1800/2000,3) -> 18000 | I7: =ROUND(2*G7*1956/2000,3) -> 19560
B8: 组合：三等奖 | E8: =1/(10*10*10) -> 0.001 | F8: 1 | G8: =ROUND((1/E8)*F8,3) -> 1000 | H8: =ROUND(2*G8*1800/2000,3) -> 1800 | I8: =ROUND(2*G8*1956/2000,3) -> 1956
B9: 组合：四等奖 | E9: =1/(10*10) -> 0.01 | F9: 1 | G9: =ROUND((1/E9)*F9,3) -> 100 | H9: =ROUND(2*G9*1800/2000,3) -> 180 | I9: =ROUND(2*G9*1956/2000,3) -> 195.6
B10: 组合：五等奖 | E10: =1/(10) -> 0.1 | F10: 1 | G10: =ROUND((1/E10)*F10,3) -> 10 | H10: =ROUND(2*G10*1800/2000,3) -> 18 | I10: =ROUND(2*G10*1956/2000,3) -> 19.56
A11: 五星组选 | B11: 五星组选120 | C11: 从0-9中任意选择5个号码组成一注，所选号码与开奖号码的万位、千位、百位、十位、个位相同，顺序不限，即为中奖。 | D11: 如：投注方案：02568，开奖号码的5个数字必须包含02568（例如：08526），顺序不限，即可中五星组选120。 | E11: =120/10000 -> 0.012 | F11: 1 | G11: =ROUND((1/E11)*F11,3) -> 83.333 | H11: =ROUND(2*G11*1800/2000,3) -> 149.999 | I11: =ROUND(2*G11*1956/2000,3) -> 162.999
B12: 五星组选60 | C12: 选择1个二重号码和3个单号号码组成一注，所选的单号号码与开奖号码相同，且所选二重号码在开奖号码中出现了2次，即为中奖。 | D12: 如：投注方案：二重号：8；单号：025，开奖号码的5个数字必须包含单号025，以及对子号8（例如02858），顺序不限，即可中五星组选60。 | E12: =60/10000 -> 0.006 | F12: 1 | G12: =ROUND((1/E12)*F12,3) -> 166.667 | H12: =ROUND(2*G12*1800/2000,3) -> 300.001 | I12: =ROUND(2*G12*1956/2000,3) -> 326.001
B13: 五星组选30 | C13: 选择2个二重号和1个单号号码组成一注，所选的单号号码与开奖号码相同，且所选的2个二重号码分别在开奖号码中出现了2次，即为中奖。 | D13: 如：投注方案：二重号：2、8；单号：0，开奖号码的5个数字必须包含单号0，以及对子号2和8（例如28082），顺序不限，即可中五星组选30。 | E13: =30/10000 -> 0.003 | F13: 1 | G13: =ROUND((1/E13)*F13,3) -> 333.333 | H13: =ROUND(2*G13*1800/2000,3) -> 599.999 | I13: =ROUND(2*G13*1956/2000,3) -> 651.999
B14: 五星组选20 | C14: 选择1个三重号码和2个单号号码组成一注，所选的单号号码与开奖号码相同，且所选三重号码在开奖号码中出现了3次，即为中奖。 | D14: 如：投注方案：三重号：8；单号：0、2，开奖号码的5个数字必须包含单号0和2，以及三重号8（例如80828），顺序不限，即可中五星组选20。 | E14: =20/10000 -> 0.002 | F14: 1 | G14: =ROUND((1/E14)*F14,3) -> 500 | H14: =ROUND(2*G14*1800/2000,3) -> 900 | I14: =ROUND(2*G14*1956/2000,3) -> 978
B15: 五星组选10 | C15: 选择1个三重号码和1个二重号码，所选三重号码在开奖号码中出现3次，并且所选二重号码在开奖号码中出现了2次，即为中奖。 | D15: 如：投注方案：三重号：8；二重号：2，开奖号码的5个数字必须包含三重号8，以及对子号2（例如28828），顺序不限，即可中五星组选10。 | E15: =10/10000 -> 0.001 | F15: 1 | G15: =ROUND((1/E15)*F15,3) -> 1000 | H15: =ROUND(2*G15*1800/2000,3) -> 1800 | I15: =ROUND(2*G15*1956/2000,3) -> 1956
B16: 五星组选5 | C16: 选择1个四重号码和1个单号号码组成一注，所选的单号号码与开奖号码相同，且所选四重号码在开奖号码中出现了4次，即为中奖。 | D16: 如：投注方案：四重号：8；单号：2，开奖号码的5个数字必须包含四重号8，以及单号2（例如88828），顺序不限，即可中五星组选5。 | E16: =5/10000 -> 0.0005 | F16: 1 | G16: =ROUND((1/E16)*F16,3) -> 2000 | H16: =ROUND(2*G16*1800/2000,3) -> 3600 | I16: =ROUND(2*G16*1956/2000,3) -> 3912
A17: 四直选/任选 | B17: 直选（复式） | C17: 从千位、百位、十位、个位中选择一个4位数号码组成一注，所选号码与开奖号码相同，且顺序一致，即为中奖。 | D17: 如：投注方案：3456；开奖号码：*3456，即中四星直选。 | E17: =1/10000 -> 0.0001 | F17: 1 | G17: =ROUND((1/E17)*F17,3) -> 10000 | H17: =ROUND(2*G17*1800/2000,3) -> 18000 | I17: =ROUND(2*G17*1956/2000,3) -> 19560
B18: 直选（单式） | C18: 手动输入一个4位数号码组成一注，所选号码的千位、百位、十位、个位与开奖号码相同，且顺序一致，即为中奖。 | D18: 如：投注方案：3456；开奖号码：*3456，即中四星直选。 | E18: =1/10000 -> 0.0001 | F18: 1 | G18: =ROUND((1/E18)*F18,3) -> 10000 | H18: =ROUND(2*G18*1800/2000,3) -> 18000 | I18: =ROUND(2*G18*1956/2000,3) -> 19560
B19: 组合：一等奖 | C19: 从千位、百位、十位、个位中至少各选一个号码组成1-4星的组合，共四注，所选号码的个位与开奖号码相同，则中1个4等奖；所选号码的个位、十位与开奖号码相同，则中1个4等奖以及1个3等奖，依此类推，最高可中4个奖。 | D19: 如：四星组合示例，如购买：5+6+7+8，该票共8元，由以下4注：5678(四星)、678(三星)、78(二星)、8(一星)构成。开奖号码：*5678，即可中四星、三星、二星、一星各1注。 | E19: =1/10000 -> 0.0001 | F19: 1 | G19: =ROUND((1/E19)*F19,3) -> 10000 | H19: =ROUND(2*G19*1800/2000,3) -> 18000 | I19: =ROUND(2*G19*1956/2000,3) -> 19560
B20: 组合：二等奖 | E20: =1/1000 -> 0.001 | F20: 1 | G20: =ROUND((1/E20)*F20,3) -> 1000 | H20: =ROUND(2*G20*1800/2000,3) -> 1800 | I20: =ROUND(2*G20*1956/2000,3) -> 1956
B21: 组合：三等奖 | E21: =1/100 -> 0.01 | F21: 1 | G21: =ROUND((1/E21)*F21,3) -> 100 | H21: =ROUND(2*G21*1800/2000,3) -> 180 | I21: =ROUND(2*G21*1956/2000,3) -> 195.6
B22: 组合：四等奖 | E22: =1/10 -> 0.1 | F22: 1 | G22: =ROUND((1/E22)*F22,3) -> 10 | H22: =ROUND(2*G22*1800/2000,3) -> 18 | I22: =ROUND(2*G22*1956/2000,3) -> 19.56
A23: 四星组选 | B23: 四星组选24 | C23: 从0-9中任意选择4个号码组成一注，所选号码与开奖号码的千位、百位、十位、个位相同，且顺序不限，即为中奖。 | D23: 如：投注方案：0568，开奖号码的后4个数字必须包含0568（例如0856），顺序不限，即可中四星组选24。 | E23: =24/10000 -> 0.0024 | F23: 1 | G23: =ROUND((1/E23)*F23,3) -> 416.667 | H23: =ROUND(2*G23*1800/2000,3) -> 750.001 | I23: =ROUND(2*G23*1956/2000,3) -> 815.001
B24: 四星组选12 | C24: 从千位、百位、十位、个位中，选择1个二重号码和2个单号号码组成一注，所选单号号码与开奖号码相同，且所选二重号码在开奖号码中出现了2次，即为中奖。 | D24: 如：投注方案：二重号：8；单号：0、6，开奖号码的后4个数字必须包含单号0、6和对子号8（例如0868），顺序不限，即可中四星组选12。 | E24: =12/10000 -> 0.0012 | F24: 1 | G24: =ROUND((1/E24)*F24,3) -> 833.333 | H24: =ROUND(2*G24*1800/2000,3) -> 1499.999 | I24: =ROUND(2*G24*1956/2000,3) -> 1629.999
B25: 四星组选6 | C25: 从千位、百位、十位、个位中，选择2个二重号码组成一注，所选的2个二重号码在开奖号码中分别出现了2次，即为中奖。 | D25: 如：投注方案：二重号：2、8，开奖号码的后4个数字必须包含两个对子号2和8（例如2882），顺序不限，即可中四星组选6。 | E25: =6/10000 -> 0.0006 | F25: 1 | G25: =ROUND((1/E25)*F25,3) -> 1666.667 | H25: =ROUND(2*G25*1800/2000,3) -> 3000.001 | I25: =ROUND(2*G25*1956/2000,3) -> 3260.001
B26: 四星组选4 | C26: 从千位、百位、十位、个位中，选择1个三重号码和1个单号号码组成一注，所选单号号码与开奖号码相同，且所选三重号码在开奖号码中出现了3次，即为中奖。 | D26: 如：投注方案：三重号：8；单号：2，开奖号码的后4个数字必须包含三重号8，以及单号2（比如8828）顺序不限，即可中四星组选4。 | E26: =4/10000 -> 0.0004 | F26: 1 | G26: =ROUND((1/E26)*F26,3) -> 2500 | H26: =ROUND(2*G26*1800/2000,3) -> 4500 | I26: =ROUND(2*G26*1956/2000,3) -> 4890
A27: 三直选/任选 | B27: 直选复式 | C27: 从万位、千位、百位中选择一个3位数号码组成一注，所选号码与开奖号码前3位相同，且顺序一致，即为中奖。 | D27: 如：万位选择1，千位选择2，百位选择3，开奖号码为是123**，即为中奖。 | E27: =1/1000 -> 0.001 | F27: 1 | G27: =ROUND((1/E27)*F27,3) -> 1000 | H27: =ROUND(2*G27*1800/2000,3) -> 1800 | I27: =ROUND(2*G27*1956/2000,3) -> 1956
B28: 直选单式 | C28: 手动输入一个3位数号码组成一注，所选号码与开奖号码的万位、千位、百位相同，且顺序一致，即为中奖。 | D28: 如：手动输入123，开奖号码为是123**，即为中奖。 | E28: =1/1000 -> 0.001 | F28: 1 | G28: =ROUND((1/E28)*F28,3) -> 1000 | H28: =ROUND(2*G28*1800/2000,3) -> 1800 | I28: =ROUND(2*G28*1956/2000,3) -> 1956
B29: 直选和值：0和27 | C29: 所选数值等于开奖号码万位、千位、百位三个数字相加之和，即为中奖。 | D29: 如：选择6，开奖号码为123**、141**、114**、006**、060**等任意一个和值为6的结果，即为中奖。 | E29: =1/1000 -> 0.001 | F29: 1 | G29: =ROUND((1/E29)*F29,3) -> 1000 | H29: =ROUND(2*G29*1800/2000,3) -> 1800 | I29: =ROUND(2*G29*1956/2000,3) -> 1956
B30: 直选和值：1和26 | E30: =3/1000 -> 0.003 | F30: 3 | G30: =ROUND((1/E30)*F30,3) -> 1000 | H30: =ROUND(2*G30*1800/2000,3) -> 1800 | I30: =ROUND(2*G30*1956/2000,3) -> 1956
B31: 直选和值：2和25 | E31: =6/1000 -> 0.006 | F31: 6 | G31: =ROUND((1/E31)*F31,3) -> 1000 | H31: =ROUND(2*G31*1800/2000,3) -> 1800 | I31: =ROUND(2*G31*1956/2000,3) -> 1956
B32: 直选和值：3和24 | E32: =10/1000 -> 0.01 | F32: 10 | G32: =ROUND((1/E32)*F32,3) -> 1000 | H32: =ROUND(2*G32*1800/2000,3) -> 1800 | I32: =ROUND(2*G32*1956/2000,3) -> 1956
B33: 直选和值：4和23 | E33: =15/1000 -> 0.015 | F33: 15 | G33: =ROUND((1/E33)*F33,3) -> 1000 | H33: =ROUND(2*G33*1800/2000,3) -> 1800 | I33: =ROUND(2*G33*1956/2000,3) -> 1956
B34: 直选和值：5和22 | E34: =21/1000 -> 0.021 | F34: 21 | G34: =ROUND((1/E34)*F34,3) -> 1000 | H34: =ROUND(2*G34*1800/2000,3) -> 1800 | I34: =ROUND(2*G34*1956/2000,3) -> 1956
B35: 直选和值：6和21 | E35: =28/1000 -> 0.028 | F35: 28 | G35: =ROUND((1/E35)*F35,3) -> 1000 | H35: =ROUND(2*G35*1800/2000,3) -> 1800 | I35: =ROUND(2*G35*1956/2000,3) -> 1956
B36: 直选和值：7和20 | E36: =36/1000 -> 0.036 | F36: 36 | G36: =ROUND((1/E36)*F36,3) -> 1000 | H36: =ROUND(2*G36*1800/2000,3) -> 1800 | I36: =ROUND(2*G36*1956/2000,3) -> 1956
B37: 直选和值：8和19 | E37: =45/1000 -> 0.045 | F37: 45 | G37: =ROUND((1/E37)*F37,3) -> 1000 | H37: =ROUND(2*G37*1800/2000,3) -> 1800 | I37: =ROUND(2*G37*1956/2000,3) -> 1956
B38: 直选和值：9和18 | E38: =55/1000 -> 0.055 | F38: 55 | G38: =ROUND((1/E38)*F38,3) -> 1000 | H38: =ROUND(2*G38*1800/2000,3) -> 1800 | I38: =ROUND(2*G38*1956/2000,3) -> 1956
B39: 直选和值：10和17 | E39: =63/1000 -> 0.063 | F39: 63 | G39: =ROUND((1/E39)*F39,3) -> 1000 | H39: =ROUND(2*G39*1800/2000,3) -> 1800 | I39: =ROUND(2*G39*1956/2000,3) -> 1956
B40: 直选和值：11和16 | E40: =69/1000 -> 0.069 | F40: 69 | G40: =ROUND((1/E40)*F40,3) -> 1000 | H40: =ROUND(2*G40*1800/2000,3) -> 1800 | I40: =ROUND(2*G40*1956/2000,3) -> 1956
B41: 直选和值：12和15 | E41: =73/1000 -> 0.073 | F41: 73 | G41: =ROUND((1/E41)*F41,3) -> 1000 | H41: =ROUND(2*G41*1800/2000,3) -> 1800 | I41: =ROUND(2*G41*1956/2000,3) -> 1956
B42: 直选和值：13和14 | E42: =75/1000 -> 0.075 | F42: 75 | G42: =ROUND((1/E42)*F42,3) -> 1000 | H42: =ROUND(2*G42*1800/2000,3) -> 1800 | I42: =ROUND(2*G42*1956/2000,3) -> 1956
A43: 三组选 | B43: 组三 | C43: 从0-9中任意选择2个号码组成两注，所选号码与开奖号码的万位、千位、百位相同，且顺序不限，即为中奖。 | D43: 如：选择12（展开为122**，212**，221** 和112**、121**、211**），开奖号码为212** 或121**，即为中奖。 | E43: =6/1000 -> 0.006 | F43: 2 | G43: =ROUND((1/E43)*F43,3) -> 333.333 | H43: =ROUND(2*G43*1800/2000,3) -> 599.999 | I43: =ROUND(2*G43*1956/2000,3) -> 651.999
B44: 组六 | C44: 从0-9中任意选择3个号码组成一注，所选号码与开奖号码的万位、千位、百位相同，顺序不限，即为中奖。 | D44: 如：选择123（展开为123**，132**，231**，213**，312**，321**），开奖号码为321**，即为中奖。 | E44: =6/1000 -> 0.006 | F44: 1 | G44: =ROUND((1/E44)*F44,3) -> 166.667 | H44: =ROUND(2*G44*1800/2000,3) -> 300.001 | I44: =ROUND(2*G44*1956/2000,3) -> 326.001
B45: 组选和值：1和26（组三） | C45: 所选数值等于开奖号码万位、千位、百位三个数字相加之和，即为中奖。 | D45: 如：选择6，开奖号码为114**中组三奖，开奖号码为015**中组六奖。 | E45: =3/1000 -> 0.003 | F45: 1 | G45: =ROUND((1/E45)*F45,3) -> 333.333 | H45: =ROUND(2*G45*1800/2000,3) -> 599.999 | I45: =ROUND(2*G45*1956/2000,3) -> 651.999
B46: 组选和值：1和26（组六） | E46: 0 | F46: 0 | G46: 0 | H46: =ROUND(2*G46*1800/2000,3) -> 0 | I46: =ROUND(2*G46*1956/2000,3) -> 0
B47: 组选和值：2和25（组三） | E47: =6/1000 -> 0.006 | F47: 2 | G47: =ROUND((1/E47)*F47,3) -> 333.333 | H47: =ROUND(2*G47*1800/2000,3) -> 599.999 | I47: =ROUND(2*G47*1956/2000,3) -> 651.999
B48: 组选和值：2和25（组六） | E48: 0 | F48: 0 | G48: 0 | H48: =ROUND(2*G48*1800/2000,3) -> 0 | I48: =ROUND(2*G48*1956/2000,3) -> 0
B49: 组选和值：3和24（组三） | E49: =3/1000 -> 0.003 | F49: 1 | G49: =ROUND((1/E49)*F49,3) -> 333.333 | H49: =ROUND(2*G49*1800/2000,3) -> 599.999 | I49: =ROUND(2*G49*1956/2000,3) -> 651.999
B50: 组选和值：3和24（组六） | E50: =6/1000 -> 0.006 | F50: 1 | G50: =ROUND((1/E50)*F50,3) -> 166.667 | H50: =ROUND(2*G50*1800/2000,3) -> 300.001 | I50: =ROUND(2*G50*1956/2000,3) -> 326.001
B51: 组选和值：4和23（组三） | E51: =9/1000 -> 0.009 | F51: 3 | G51: =ROUND((1/E51)*F51,3) -> 333.333 | H51: =ROUND(2*G51*1800/2000,3) -> 599.999 | I51: =ROUND(2*G51*1956/2000,3) -> 651.999
B52: 组选和值：4和23（组六） | E52: =6/1000 -> 0.006 | F52: 1 | G52: =ROUND((1/E52)*F52,3) -> 166.667 | H52: =ROUND(2*G52*1800/2000,3) -> 300.001 | I52: =ROUND(2*G52*1956/2000,3) -> 326.001
B53: 组选和值：5和22（组三） | E53: =9/1000 -> 0.009 | F53: 3 | G53: =ROUND((1/E53)*F53,3) -> 333.333 | H53: =ROUND(2*G53*1800/2000,3) -> 599.999 | I53: =ROUND(2*G53*1956/2000,3) -> 651.999
B54: 组选和值：5和22（组六） | E54: =12/1000 -> 0.012 | F54: 2 | G54: =ROUND((1/E54)*F54,3) -> 166.667 | H54: =ROUND(2*G54*1800/2000,3) -> 300.001 | I54: =ROUND(2*G54*1956/2000,3) -> 326.001
B55: 组选和值：6和21（组三） | E55: =9/1000 -> 0.009 | F55: 3 | G55: =ROUND((1/E55)*F55,3) -> 333.333 | H55: =ROUND(2*G55*1800/2000,3) -> 599.999 | I55: =ROUND(2*G55*1956/2000,3) -> 651.999
B56: 组选和值：6和21（组六） | E56: =18/1000 -> 0.018 | F56: 3 | G56: =ROUND((1/E56)*F56,3) -> 166.667 | H56: =ROUND(2*G56*1800/2000,3) -> 300.001 | I56: =ROUND(2*G56*1956/2000,3) -> 326.001
B57: 组选和值：7和20（组三） | E57: =12/1000 -> 0.012 | F57: 4 | G57: =ROUND((1/E57)*F57,3) -> 333.333 | H57: =ROUND(2*G57*1800/2000,3) -> 599.999 | I57: =ROUND(2*G57*1956/2000,3) -> 651.999
B58: 组选和值：7和20（组六） | E58: =24/1000 -> 0.024 | F58: 4 | G58: =ROUND((1/E58)*F58,3) -> 166.667 | H58: =ROUND(2*G58*1800/2000,3) -> 300.001 | I58: =ROUND(2*G58*1956/2000,3) -> 326.001
B59: 组选和值：8和19（组三） | E59: =15/1000 -> 0.015 | F59: 5 | G59: =ROUND((1/E59)*F59,3) -> 333.333 | H59: =ROUND(2*G59*1800/2000,3) -> 599.999 | I59: =ROUND(2*G59*1956/2000,3) -> 651.999
B60: 组选和值：8和19（组六） | E60: =30/1000 -> 0.03 | F60: 5 | G60: =ROUND((1/E60)*F60,3) -> 166.667 | H60: =ROUND(2*G60*1800/2000,3) -> 300.001 | I60: =ROUND(2*G60*1956/2000,3) -> 326.001
B61: 组选和值：9和18（组三） | E61: =12/1000 -> 0.012 | F61: 4 | G61: =ROUND((1/E61)*F61,3) -> 333.333 | H61: =ROUND(2*G61*1800/2000,3) -> 599.999 | I61: =ROUND(2*G61*1956/2000,3) -> 651.999
B62: 组选和值：9和18（组六） | E62: =42/1000 -> 0.042 | F62: 7 | G62: =ROUND((1/E62)*F62,3) -> 166.667 | H62: =ROUND(2*G62*1800/2000,3) -> 300.001 | I62: =ROUND(2*G62*1956/2000,3) -> 326.001
B63: 组选和值：10和17（组三） | E63: =15/1000 -> 0.015 | F63: 5 | G63: =ROUND((1/E63)*F63,3) -> 333.333 | H63: =ROUND(2*G63*1800/2000,3) -> 599.999 | I63: =ROUND(2*G63*1956/2000,3) -> 651.999
B64: 组选和值：10和17（组六） | E64: =48/1000 -> 0.048 | F64: 8 | G64: =ROUND((1/E64)*F64,3) -> 166.667 | H64: =ROUND(2*G64*1800/2000,3) -> 300.001 | I64: =ROUND(2*G64*1956/2000,3) -> 326.001
B65: 组选和值：11和16（组三） | E65: =15/1000 -> 0.015 | F65: 5 | G65: =ROUND((1/E65)*F65,3) -> 333.333 | H65: =ROUND(2*G65*1800/2000,3) -> 599.999 | I65: =ROUND(2*G65*1956/2000,3) -> 651.999
B66: 组选和值：11和16（组六） | E66: =54/1000 -> 0.054 | F66: 9 | G66: =ROUND((1/E66)*F66,3) -> 166.667 | H66: =ROUND(2*G66*1800/2000,3) -> 300.001 | I66: =ROUND(2*G66*1956/2000,3) -> 326.001
B67: 组选和值：12和15（组三） | E67: =12/1000 -> 0.012 | F67: 4 | G67: =ROUND((1/E67)*F67,3) -> 333.333 | H67: =ROUND(2*G67*1800/2000,3) -> 599.999 | I67: =ROUND(2*G67*1956/2000,3) -> 651.999
B68: 组选和值：12和15（组六） | E68: =60/1000 -> 0.06 | F68: 10 | G68: =ROUND((1/E68)*F68,3) -> 166.667 | H68: =ROUND(2*G68*1800/2000,3) -> 300.001 | I68: =ROUND(2*G68*1956/2000,3) -> 326.001
B69: 组选和值：13和14（组三） | E69: =15/1000 -> 0.015 | F69: 5 | G69: =ROUND((1/E69)*F69,3) -> 333.333 | H69: =ROUND(2*G69*1800/2000,3) -> 599.999 | I69: =ROUND(2*G69*1956/2000,3) -> 651.999
B70: 组选和值：13和14（组六） | E70: =60/1000 -> 0.06 | F70: 10 | G70: =ROUND((1/E70)*F70,3) -> 166.667 | H70: =ROUND(2*G70*1800/2000,3) -> 300.001 | I70: =ROUND(2*G70*1956/2000,3) -> 326.001
B71: 混合组选：组三 | C71: 键盘手动输入购买号码，3个数字为一注，开奖号码的万位、千位、百位符合前三的组三或组六均为中奖。 | D71: 如：手动输入123、455，开奖号码为321**即中组六奖，开奖号码为545**即中组三奖。 | E71: =3/1000 -> 0.003 | F71: 1 | G71: =ROUND((1/E71)*F71,3) -> 333.333 | H71: =ROUND(2*G71*1800/2000,3) -> 599.999 | I71: =ROUND(2*G71*1956/2000,3) -> 651.999
B72: 混合组选：组六 | E72: =6/1000 -> 0.006 | F72: 1 | G72: =ROUND((1/E72)*F72,3) -> 166.667 | H72: =ROUND(2*G72*1800/2000,3) -> 300.001 | I72: =ROUND(2*G72*1956/2000,3) -> 326.001
A73: 二直选/任选 | B73: 直选复式 | C73: 从万位和千位上至少各选1个号码，所选号码与开奖号码的万位、千位相同，且顺序一致，即为中奖。 | D73: 如：万位选择3，千位选择4，开出34***即为中奖。 | E73: =1/100 -> 0.01 | F73: 1 | G73: =ROUND((1/E73)*F73,3) -> 100 | H73: =ROUND(2*G73*1800/2000,3) -> 180 | I73: =ROUND(2*G73*1956/2000,3) -> 195.6
B74: 直选单式 | C74: 手动输入一个2位数号码组成一注，所选号码与开奖号码的万位、千位相同，且顺序一致，即为中奖。 | D74: 如：手动输入12，开奖号码为是12***，即为中奖。 | E74: =1/100 -> 0.01 | F74: 1 | G74: =ROUND((1/E74)*F74,3) -> 100 | H74: =ROUND(2*G74*1800/2000,3) -> 180 | I74: =ROUND(2*G74*1956/2000,3) -> 195.6
B75: 直选和值：0和18 | C75: 所选数值等于开奖号码的万位、千位两个数字相加之和，即为中奖。 | D75: 如：和值8；开奖号码前二位08或者80（顺序不限，不含对子号），即为中奖。 | E75: =1/100 -> 0.01 | F75: 1 | G75: =ROUND((1/E75)*F75,3) -> 100 | H75: =ROUND(2*G75*1800/2000,3) -> 180 | I75: =ROUND(2*G75*1956/2000,3) -> 195.6
B76: 直选和值：1和17 | E76: =2/100 -> 0.02 | F76: 2 | G76: =ROUND((1/E76)*F76,3) -> 100 | H76: =ROUND(2*G76*1800/2000,3) -> 180 | I76: =ROUND(2*G76*1956/2000,3) -> 195.6
B77: 直选和值：2和16 | E77: =3/100 -> 0.03 | F77: 3 | G77: =ROUND((1/E77)*F77,3) -> 100 | H77: =ROUND(2*G77*1800/2000,3) -> 180 | I77: =ROUND(2*G77*1956/2000,3) -> 195.6
B78: 直选和值：3和15 | E78: =4/100 -> 0.04 | F78: 4 | G78: =ROUND((1/E78)*F78,3) -> 100 | H78: =ROUND(2*G78*1800/2000,3) -> 180 | I78: =ROUND(2*G78*1956/2000,3) -> 195.6
B79: 直选和值：4和14 | E79: =5/100 -> 0.05 | F79: 5 | G79: =ROUND((1/E79)*F79,3) -> 100 | H79: =ROUND(2*G79*1800/2000,3) -> 180 | I79: =ROUND(2*G79*1956/2000,3) -> 195.6
B80: 直选和值：5和13 | E80: =6/100 -> 0.06 | F80: 6 | G80: =ROUND((1/E80)*F80,3) -> 100 | H80: =ROUND(2*G80*1800/2000,3) -> 180 | I80: =ROUND(2*G80*1956/2000,3) -> 195.6
B81: 直选和值：6和12 | E81: =7/100 -> 0.07 | F81: 7 | G81: =ROUND((1/E81)*F81,3) -> 100 | H81: =ROUND(2*G81*1800/2000,3) -> 180 | I81: =ROUND(2*G81*1956/2000,3) -> 195.6
B82: 直选和值：7和11 | E82: =8/100 -> 0.08 | F82: 8 | G82: =ROUND((1/E82)*F82,3) -> 100 | H82: =ROUND(2*G82*1800/2000,3) -> 180 | I82: =ROUND(2*G82*1956/2000,3) -> 195.6
B83: 直选和值：8和10 | E83: =9/100 -> 0.09 | F83: 9 | G83: =ROUND((1/E83)*F83,3) -> 100 | H83: =ROUND(2*G83*1800/2000,3) -> 180 | I83: =ROUND(2*G83*1956/2000,3) -> 195.6
B84: 直选和值：9 | E84: =10/100 -> 0.1 | F84: 10 | G84: =ROUND((1/E84)*F84,3) -> 100 | H84: =ROUND(2*G84*1800/2000,3) -> 180 | I84: =ROUND(2*G84*1956/2000,3) -> 195.6
A85: 二星组选 | B85: 组选复式 | C85: 从0-9中选2个号码组成一注，所择号码与开奖号码的万位、千位相同，顺序不限，即为中奖。 | D85: 如：选择7、8，开奖号码78***或87***，即为中奖。 | E85: =2/100 -> 0.02 | F85: 1 | G85: =ROUND((1/E85)*F85,3) -> 50 | H85: =ROUND(2*G85*1800/2000,3) -> 90 | I85: =ROUND(2*G85*1956/2000,3) -> 97.8
B86: 组选单式 | C86: 手动输入购买号码，2个数字为一注，所选号码与开奖号码的万位、千位相同，顺序不限，即为中奖。 | D86: 如：手动输入12，开奖号码为是21***或12***，即为中奖。 | E86: =2/100 -> 0.02 | F86: 1 | G86: =ROUND((1/E86)*F86,3) -> 50 | H86: =ROUND(2*G86*1800/2000,3) -> 90 | I86: =ROUND(2*G86*1956/2000,3) -> 97.8
B87: 组选和值：1和17 | C87: 所选数值等于开奖号码的万位、千位两个数字相加之和（不含对子号）即为中奖。 | D87: 如：和值8；开奖号码前二位08或者80（顺序不限，不含对子号），即为中奖。 | E87: =2/100 -> 0.02 | F87: 1 | G87: =ROUND((1/E87)*F87,3) -> 50 | H87: =ROUND(2*G87*1800/2000,3) -> 90 | I87: =ROUND(2*G87*1956/2000,3) -> 97.8
B88: 组选和值：2和16 | E88: =2/100 -> 0.02 | F88: 1 | G88: =ROUND((1/E88)*F88,3) -> 50 | H88: =ROUND(2*G88*1800/2000,3) -> 90 | I88: =ROUND(2*G88*1956/2000,3) -> 97.8
B89: 组选和值：3和15 | E89: =4/100 -> 0.04 | F89: 2 | G89: =ROUND((1/E89)*F89,3) -> 50 | H89: =ROUND(2*G89*1800/2000,3) -> 90 | I89: =ROUND(2*G89*1956/2000,3) -> 97.8
B90: 组选和值：4和14 | E90: =4/100 -> 0.04 | F90: 2 | G90: =ROUND((1/E90)*F90,3) -> 50 | H90: =ROUND(2*G90*1800/2000,3) -> 90 | I90: =ROUND(2*G90*1956/2000,3) -> 97.8
B91: 组选和值：5和13 | E91: =6/100 -> 0.06 | F91: 3 | G91: =ROUND((1/E91)*F91,3) -> 50 | H91: =ROUND(2*G91*1800/2000,3) -> 90 | I91: =ROUND(2*G91*1956/2000,3) -> 97.8
B92: 组选和值：6和12 | E92: =6/100 -> 0.06 | F92: 3 | G92: =ROUND((1/E92)*F92,3) -> 50 | H92: =ROUND(2*G92*1800/2000,3) -> 90 | I92: =ROUND(2*G92*1956/2000,3) -> 97.8
B93: 组选和值：7和11 | E93: =8/100 -> 0.08 | F93: 4 | G93: =ROUND((1/E93)*F93,3) -> 50 | H93: =ROUND(2*G93*1800/2000,3) -> 90 | I93: =ROUND(2*G93*1956/2000,3) -> 97.8
B94: 组选和值：8和10 | E94: =8/100 -> 0.08 | F94: 4 | G94: =ROUND((1/E94)*F94,3) -> 50 | H94: =ROUND(2*G94*1800/2000,3) -> 90 | I94: =ROUND(2*G94*1956/2000,3) -> 97.8
B95: 组选和值：9 | E95: =10/100 -> 0.1 | F95: 5 | G95: =ROUND((1/E95)*F95,3) -> 50 | H95: =ROUND(2*G95*1800/2000,3) -> 90 | I95: =ROUND(2*G95*1956/2000,3) -> 97.8
A96: 定位胆 | B96: 万位 | C96: 从万位、千位、百位、十位、个位任意1个位置或多个位置上选择1个号码，所选号码与相同位置上的开奖号码一致，即为中奖。 | D96: 如：定万位为1，开奖号码为1****即为中奖。 | E96: =1/10 -> 0.1 | F96: 1 | G96: =ROUND((1/E96)*F96,3) -> 10 | H96: =ROUND(2*G96*1800/2000,3) -> 18 | I96: =ROUND(2*G96*1956/2000,3) -> 19.56
B97: 千位 | D97: 如：定千位为2，开奖号码为*2***即为中奖。 | E97: =1/10 -> 0.1 | F97: 1 | G97: =ROUND((1/E97)*F97,3) -> 10 | H97: =ROUND(2*G97*1800/2000,3) -> 18 | I97: =ROUND(2*G97*1956/2000,3) -> 19.56
B98: 百位 | D98: 如：定百位为3，开奖号码为**3**即为中奖。 | E98: =1/10 -> 0.1 | F98: 1 | G98: =ROUND((1/E98)*F98,3) -> 10 | H98: =ROUND(2*G98*1800/2000,3) -> 18 | I98: =ROUND(2*G98*1956/2000,3) -> 19.56
B99: 十位 | D99: 如：定十位为4，开奖号码为***4*即为中奖。 | E99: =1/10 -> 0.1 | F99: 1 | G99: =ROUND((1/E99)*F99,3) -> 10 | H99: =ROUND(2*G99*1800/2000,3) -> 18 | I99: =ROUND(2*G99*1956/2000,3) -> 19.56
B100: 个位 | D100: 如：定个位为5，开奖号码为****5即为中奖。 | E100: =1/10 -> 0.1 | F100: 1 | G100: =ROUND((1/E100)*F100,3) -> 10 | H100: =ROUND(2*G100*1800/2000,3) -> 18 | I100: =ROUND(2*G100*1956/2000,3) -> 19.56
A101: 不定胆 | B101: 三星一码不定位 | C101: 从0-9中任意选择1个号码组成一注，只要开奖号码的百位、十位、个位任意位置中同时包含所选的号码，即为中奖。开出多重号奖金无加倍。 | D101: 投注方案：1；开奖号码后三位：在任意位置上出现1，即中后三一码不定位。 | E101: =271/1000 -> 0.271 | F101: 1 | G101: =ROUND((1/E101)*F101,3) -> 3.69 | H101: =ROUND(2*G101*1800/2000,3) -> 6.642 | I101: =ROUND(2*G101*1956/2000,3) -> 7.218
B102: 三星二码不定位 | C102: 从0-9中任意选择2个号码组成一注，只要开奖号码的百位、十位、个位任意位置中同时包含所选的号码，即为中奖。开出多重号奖金无加倍。 | D102: 投注方案：1,2；开奖号码后三位：在任意位置上出现1和2，即中后三二码不定位。 | E102: =(60-6)/1000 -> 0.054 | F102: 1 | G102: =ROUND((1/E102)*F102,3) -> 18.519 | H102: =ROUND(2*G102*1800/2000,3) -> 33.334 | I102: =ROUND(2*G102*1956/2000,3) -> 36.223
B103: 四星一码不定胆 | C103: 从0-9中至少选择三个号码，每三个号码作为一注。若开奖号码的千位、百位、十位、个位中包含所选的一个号码（顺序不限），即为中奖。 | D103: 投注方案：1；开奖号码前四位：在任意位置上出现1，即中前四星一码不定位。 | E103: =(1000+900+810+729)/10000 -> 0.3439 | F103: 1 | G103: =ROUND((1/E103)*F103,3) -> 2.908 | H103: =ROUND(2*G103*1800/2000,3) -> 5.234 | I103: =ROUND(2*G103*1956/2000,3) -> 5.688
B104: 四星二码不定胆 | C104: 从0-9中至少选择三个号码，每三个号码作为一注。若开奖号码的千位、百位、十位、个位中包含所选的二个号码（顺序不限），即为中奖。 | D104: 投注方案：1,2；开奖号码前四位：在任意位置上出现1和2，即中前四星二码不定位。 | E104: =974/10000 -> 0.0974 | F104: 1 | G104: =ROUND((1/E104)*F104,3) -> 10.267 | H104: =ROUND(2*G104*1800/2000,3) -> 18.481 | I104: =ROUND(2*G104*1956/2000,3) -> 20.082
B105: 四星三码不定胆 | C105: 从0-9中至少选择三个号码，每三个号码作为一注。若开奖号码的千位、百位、十位、个位中包含所选的三个号码（顺序不限），即为中奖。 | D105: 投注方案：1,2,3；开奖号码：24371，在万位、千位、百位、十位的任意位置上出现1、2和3，即中四星三码不定位。 | E105: =204/10000 -> 0.0204 | F105: 1 | G105: =ROUND((1/E105)*F105,3) -> 49.02 | H105: =ROUND(2*G105*1800/2000,3) -> 88.236 | I105: =ROUND(2*G105*1956/2000,3) -> 95.883
B106: 五星一码不定胆 | C106: 从0-9中任意选择1个号码组成一注，只要开奖号码的万位、千位、百位、十位、个位任意位置中包含所选的号码，即为中奖。开出多重号奖金无加倍。 | D106: 投注方案：1；开奖号码：34137，在万位、千位、百位、十位、个位的任意位置上出现1，即中五星一码不定位。 | E106: =40951/100000 -> 0.40951 | F106: 1 | G106: =ROUND((1/E106)*F106,3) -> 2.442 | H106: =ROUND(2*G106*1800/2000,3) -> 4.396 | I106: =ROUND(2*G106*1956/2000,3) -> 4.777
B107: 五星二码不定胆 | C107: 从0-9中任意选择2个号码组成一注，只要开奖号码的万位、千位、百位、十位、个位任意位置中同时包含所选的号码，即为中奖。开出多重号奖金无加倍。 | D107: 投注方案：1,2；开奖号码：24371，在万位、千位、百位、十位、个位的任意位置上出现1和2，即中五星二码不定位。 | E107: =14670/100000 -> 0.1467 | F107: 1 | G107: =ROUND((1/E107)*F107,3) -> 6.817 | H107: =ROUND(2*G107*1800/2000,3) -> 12.271 | I107: =ROUND(2*G107*1956/2000,3) -> 13.334
B108: 五星三码不定胆 | C108: 从0-9中任意选择3个号码组成一注，只要开奖号码的万位、千位、百位、十位、个位任意位置中同时包含所选的号码，即为中奖。开出多重号奖金无加倍。 | D108: 投注方案：1,2,3；开奖号码：24371，在万位、千位、百位、十位、个位的任意位置上出现1、2和3，即中五星三码不定位。 | E108: =4350/100000 -> 0.0435 | F108: 1 | G108: =ROUND((1/E108)*F108,3) -> 22.989 | H108: =ROUND(2*G108*1800/2000,3) -> 41.38 | I108: =ROUND(2*G108*1956/2000,3) -> 44.966
A109: 大小单双 | B109: 五星总和大小单双 | C109: 对个位至万位的总和的"大(23以上，包括23)小(22以下，包括22)、单(奇数)双(偶数)"型态进行购买，所选号码的位型态与开奖号码的形态相同，即为中奖。 | D109: 投注方案：大，开奖号码67895(6+7+8+9+5=35)，即中比大小一等奖。投注方案：单，开奖号码12345(1+2+3+4+5=15)，即中比单双一等奖。 | E109: =1/2 -> 0.5 | F109: 1 | G109: =ROUND((1/E109)*F109,3) -> 2 | H109: =ROUND(2*G109*1800/2000,3) -> 3.6 | I109: =ROUND(2*G109*1956/2000,3) -> 3.912
B110: 五星总和大小单双：大单 | E110: =26508/100000 -> 0.26508 | F110: 1 | G110: =ROUND((1/E110)*F110,3) -> 3.772 | H110: =ROUND(2*G110*1800/2000,3) -> 6.79 | I110: =ROUND(2*G110*1956/2000,3) -> 7.378
B111: 五星总和大小单双：大双 | E111: =23492/100000 -> 0.23492 | F111: 1 | G111: =ROUND((1/E111)*F111,3) -> 4.257 | H111: =ROUND(2*G111*1800/2000,3) -> 7.663 | I111: =ROUND(2*G111*1956/2000,3) -> 8.327
B112: 五星总和大小单双：小单 | E112: =23492/100000 -> 0.23492 | F112: 1 | G112: =ROUND((1/E112)*F112,3) -> 4.257 | H112: =ROUND(2*G112*1800/2000,3) -> 7.663 | I112: =ROUND(2*G112*1956/2000,3) -> 8.327
B113: 五星总和大小单双：小双 | E113: =26508/100000 -> 0.26508 | F113: 1 | G113: =ROUND((1/E113)*F113,3) -> 3.772 | H113: =ROUND(2*G113*1800/2000,3) -> 6.79 | I113: =ROUND(2*G113*1956/2000,3) -> 7.378
B114: 三星总和大小单双 | C114: 对百位至万位的总和的"大(14以上，包括14)小(13以下，包括13)、单(奇数)双(偶数)"型态进行购买，所选号码的位型态与开奖号码的形态相同，即为中奖。 | D114: 投注方案：大，开奖号码67895(6+7+8=21)，即中比大小一等奖。投注方案：双，开奖号码12345(1+2+3=6)，即中比单双一等奖。 | E114: =1/2 -> 0.5 | F114: 1 | G114: =ROUND((1/E114)*F114,3) -> 2 | H114: =ROUND(2*G114*1800/2000,3) -> 3.6 | I114: =ROUND(2*G114*1956/2000,3) -> 3.912
B115: 三星总和大小单双：大单 | E115: =231/1000 -> 0.231 | F115: 1 | G115: =ROUND((1/E115)*F115,3) -> 4.329 | H115: =ROUND(2*G115*1800/2000,3) -> 7.792 | I115: =ROUND(2*G115*1956/2000,3) -> 8.468
B116: 三星总和大小单双：大双 | E116: =269/1000 -> 0.269 | F116: 1 | G116: =ROUND((1/E116)*F116,3) -> 3.717 | H116: =ROUND(2*G116*1800/2000,3) -> 6.691 | I116: =ROUND(2*G116*1956/2000,3) -> 7.27
B117: 三星总和大小单双：小单 | E117: =269/1000 -> 0.269 | F117: 1 | G117: =ROUND((1/E117)*F117,3) -> 3.717 | H117: =ROUND(2*G117*1800/2000,3) -> 6.691 | I117: =ROUND(2*G117*1956/2000,3) -> 7.27
B118: 三星总和大小单双：小双 | E118: =231/1000 -> 0.231 | F118: 1 | G118: =ROUND((1/E118)*F118,3) -> 4.329 | H118: =ROUND(2*G118*1800/2000,3) -> 7.792 | I118: =ROUND(2*G118*1956/2000,3) -> 8.468
B119: 三星大小单双 | C119: 从万位、千位和百位的“大（56789）小（01234）、单（13579）双（02468）”中各选1个形态组成一注，所选号码的位置、形态与开奖号码的位置、形态相同，即为中奖。 | D119: 投注方案：小双小；开奖号码万位上为：（01234)中的一个、千位：（02468）中的一个、百位：（01234）中的一个，即中前三大小单双一等奖。 | E119: =1/8 -> 0.125 | F119: 1 | G119: =ROUND((1/E119)*F119,3) -> 8 | H119: =ROUND(2*G119*1800/2000,3) -> 14.4 | I119: =ROUND(2*G119*1956/2000,3) -> 15.648
B120: 二星大小单双 | C120: 对万位和千位的“大（56789）小（01234）、单（13579）双（02468）”形态进行购买，所选号码的位置、形态与开奖号码的位置、形态相同，即为中奖。 | D120: 如：万位选择大，千位选择单，开出63***即为中奖。 | E120: =1/4 -> 0.25 | F120: 1 | G120: =ROUND((1/E120)*F120,3) -> 4 | H120: =ROUND(2*G120*1800/2000,3) -> 7.2 | I120: =ROUND(2*G120*1956/2000,3) -> 7.824
B121: 五星大小个数：全大 | C121: 对5个号码中大号与小号的个数进行选择，所选号码与开奖号码的大小个数相同，即为中奖。 | D121: 投注方案：全大，开奖号码67895，即中五星大小个数一等奖。投注方案：4大1小，开奖号码79385，即中五星大小个数二等奖。 | E121: =1/32 -> 0.03125 | F121: 1 | G121: =ROUND((1/E121)*F121,3) -> 32 | H121: =ROUND(2*G121*1800/2000,3) -> 57.6 | I121: =ROUND(2*G121*1956/2000,3) -> 62.592
B122: 五星大小个数：4大1小 | E122: =5/32 -> 0.15625 | F122: 1 | G122: =ROUND((1/E122)*F122,3) -> 6.4 | H122: =ROUND(2*G122*1800/2000,3) -> 11.52 | I122: =ROUND(2*G122*1956/2000,3) -> 12.518
B123: 五星大小个数：3大2小 | E123: =10/32 -> 0.3125 | F123: 1 | G123: =ROUND((1/E123)*F123,3) -> 3.2 | H123: =ROUND(2*G123*1800/2000,3) -> 5.76 | I123: =ROUND(2*G123*1956/2000,3) -> 6.259
B124: 五星大小个数：2大3小 | E124: =10/32 -> 0.3125 | F124: 1 | G124: =ROUND((1/E124)*F124,3) -> 3.2 | H124: =ROUND(2*G124*1800/2000,3) -> 5.76 | I124: =ROUND(2*G124*1956/2000,3) -> 6.259
B125: 五星大小个数：1大4小 | E125: =5/32 -> 0.15625 | F125: 1 | G125: =ROUND((1/E125)*F125,3) -> 6.4 | H125: =ROUND(2*G125*1800/2000,3) -> 11.52 | I125: =ROUND(2*G125*1956/2000,3) -> 12.518
B126: 五星大小个数：全小 | E126: =1/32 -> 0.03125 | F126: 1 | G126: =ROUND((1/E126)*F126,3) -> 32 | H126: =ROUND(2*G126*1800/2000,3) -> 57.6 | I126: =ROUND(2*G126*1956/2000,3) -> 62.592
B127: 四星大小个数：全大 | C127: 对千、百、十、个4个号码中大号与小号的个数进行选择，所选号码与开奖号码的大小个数相同，即为中奖。 | D127: 投注方案：全大，开奖号码67895，即中四星大小个数一等奖。投注方案：3大1小，开奖号码79385，即中四星大小个数二等奖。 | E127: =1/16 -> 0.0625 | F127: 1 | G127: =ROUND((1/E127)*F127,3) -> 16 | H127: =ROUND(2*G127*1800/2000,3) -> 28.8 | I127: =ROUND(2*G127*1956/2000,3) -> 31.296
B128: 四星大小个数：3大1小 | E128: =4/16 -> 0.25 | F128: 1 | G128: =ROUND((1/E128)*F128,3) -> 4 | H128: =ROUND(2*G128*1800/2000,3) -> 7.2 | I128: =ROUND(2*G128*1956/2000,3) -> 7.824
B129: 四星大小个数：2大2小 | E129: =6/16 -> 0.375 | F129: 1 | G129: =ROUND((1/E129)*F129,3) -> 2.667 | H129: =ROUND(2*G129*1800/2000,3) -> 4.801 | I129: =ROUND(2*G129*1956/2000,3) -> 5.217
B130: 四星大小个数：1大3小 | E130: =4/16 -> 0.25 | F130: 1 | G130: =ROUND((1/E130)*F130,3) -> 4 | H130: =ROUND(2*G130*1800/2000,3) -> 7.2 | I130: =ROUND(2*G130*1956/2000,3) -> 7.824
B131: 四星大小个数：全小 | E131: =1/16 -> 0.0625 | F131: 1 | G131: =ROUND((1/E131)*F131,3) -> 16 | H131: =ROUND(2*G131*1800/2000,3) -> 28.8 | I131: =ROUND(2*G131*1956/2000,3) -> 31.296
B132: 三星大小个数：全大 | C132: 对千、百、十3个号码中大号与小号的个数进行选择，所选号码与开奖号码的大小个数相同，即为中奖。 | D132: 投注方案：全大，开奖号码67895，即中三星大小个数一等奖。投注方案：2大1小，开奖号码79385，即中三星大小个数二等奖。 | E132: =1/8 -> 0.125 | F132: 1 | G132: =ROUND((1/E132)*F132,3) -> 8 | H132: =ROUND(2*G132*1800/2000,3) -> 14.4 | I132: =ROUND(2*G132*1956/2000,3) -> 15.648
B133: 三星大小个数：2大1小 | E133: =3/8 -> 0.375 | F133: 1 | G133: =ROUND((1/E133)*F133,3) -> 2.667 | H133: =ROUND(2*G133*1800/2000,3) -> 4.801 | I133: =ROUND(2*G133*1956/2000,3) -> 5.217
B134: 三星大小个数：1大2小 | E134: =3/8 -> 0.375 | F134: 1 | G134: =ROUND((1/E134)*F134,3) -> 2.667 | H134: =ROUND(2*G134*1800/2000,3) -> 4.801 | I134: =ROUND(2*G134*1956/2000,3) -> 5.217
B135: 三星大小个数：全小 | E135: =1/8 -> 0.125 | F135: 1 | G135: =ROUND((1/E135)*F135,3) -> 8 | H135: =ROUND(2*G135*1800/2000,3) -> 14.4 | I135: =ROUND(2*G135*1956/2000,3) -> 15.648
B136: 五星单双个数：全单 | C136: 对5个号码中单号与双号的个数进行选择，所选号码与开奖号码的大小个数相同，即为中奖。 | D136: 投注方案：全大，开奖号码37195，即中五星大小个数一等奖。投注方案：4大1小，开奖号码79385，即中五星大小个数二等奖。 | E136: =1/32 -> 0.03125 | F136: 1 | G136: =ROUND((1/E136)*F136,3) -> 32 | H136: =ROUND(2*G136*1800/2000,3) -> 57.6 | I136: =ROUND(2*G136*1956/2000,3) -> 62.592
B137: 五星单双个数：4单1双 | E137: =5/32 -> 0.15625 | F137: 1 | G137: =ROUND((1/E137)*F137,3) -> 6.4 | H137: =ROUND(2*G137*1800/2000,3) -> 11.52 | I137: =ROUND(2*G137*1956/2000,3) -> 12.518
B138: 五星单双个数：3单2双 | E138: =10/32 -> 0.3125 | F138: 1 | G138: =ROUND((1/E138)*F138,3) -> 3.2 | H138: =ROUND(2*G138*1800/2000,3) -> 5.76 | I138: =ROUND(2*G138*1956/2000,3) -> 6.259
B139: 五星单双个数：2单3双 | E139: =10/32 -> 0.3125 | F139: 1 | G139: =ROUND((1/E139)*F139,3) -> 3.2 | H139: =ROUND(2*G139*1800/2000,3) -> 5.76 | I139: =ROUND(2*G139*1956/2000,3) -> 6.259
B140: 五星单双个数：1单4双 | E140: =5/32 -> 0.15625 | F140: 1 | G140: =ROUND((1/E140)*F140,3) -> 6.4 | H140: =ROUND(2*G140*1800/2000,3) -> 11.52 | I140: =ROUND(2*G140*1956/2000,3) -> 12.518
B141: 五星单双个数：全双 | E141: =1/32 -> 0.03125 | F141: 1 | G141: =ROUND((1/E141)*F141,3) -> 32 | H141: =ROUND(2*G141*1800/2000,3) -> 57.6 | I141: =ROUND(2*G141*1956/2000,3) -> 62.592
B142: 四星单双个数：全单 | C142: 对千、百、十、个4个号码中单号与双号的个数进行选择，所选号码与开奖号码的大小个数相同，即为中奖。 | D142: 投注方案：全大，开奖号码67195，即中四星大小个数一等奖。投注方案：3大1小，开奖号码79385，即中四星大小个数二等奖。 | E142: =1/16 -> 0.0625 | F142: 1 | G142: =ROUND((1/E142)*F142,3) -> 16 | H142: =ROUND(2*G142*1800/2000,3) -> 28.8 | I142: =ROUND(2*G142*1956/2000,3) -> 31.296
B143: 四星单双个数：3单1双 | E143: =4/16 -> 0.25 | F143: 1 | G143: =ROUND((1/E143)*F143,3) -> 4 | H143: =ROUND(2*G143*1800/2000,3) -> 7.2 | I143: =ROUND(2*G143*1956/2000,3) -> 7.824
B144: 四星单双个数：2单2双 | E144: =6/16 -> 0.375 | F144: 1 | G144: =ROUND((1/E144)*F144,3) -> 2.667 | H144: =ROUND(2*G144*1800/2000,3) -> 4.801 | I144: =ROUND(2*G144*1956/2000,3) -> 5.217
B145: 四星单双个数：1单3双 | E145: =4/16 -> 0.25 | F145: 1 | G145: =ROUND((1/E145)*F145,3) -> 4 | H145: =ROUND(2*G145*1800/2000,3) -> 7.2 | I145: =ROUND(2*G145*1956/2000,3) -> 7.824
B146: 四星单双个数：全双 | E146: =1/16 -> 0.0625 | F146: 1 | G146: =ROUND((1/E146)*F146,3) -> 16 | H146: =ROUND(2*G146*1800/2000,3) -> 28.8 | I146: =ROUND(2*G146*1956/2000,3) -> 31.296
B147: 三星单双个数：全单 | C147: 对千、百、十3个号码中单号与双号的个数进行选择，所选号码与开奖号码的大小个数相同，即为中奖。 | D147: 投注方案：全大，开奖号码67595，即中三星大小个数一等奖。投注方案：2大1小，开奖号码79485，即中三星大小个数二等奖。 | E147: =1/8 -> 0.125 | F147: 1 | G147: =ROUND((1/E147)*F147,3) -> 8 | H147: =ROUND(2*G147*1800/2000,3) -> 14.4 | I147: =ROUND(2*G147*1956/2000,3) -> 15.648
B148: 三星单双个数：2单1双 | E148: =3/8 -> 0.375 | F148: 1 | G148: =ROUND((1/E148)*F148,3) -> 2.667 | H148: =ROUND(2*G148*1800/2000,3) -> 4.801 | I148: =ROUND(2*G148*1956/2000,3) -> 5.217
B149: 三星单双个数：1单2双 | E149: =3/8 -> 0.375 | F149: 1 | G149: =ROUND((1/E149)*F149,3) -> 2.667 | H149: =ROUND(2*G149*1800/2000,3) -> 4.801 | I149: =ROUND(2*G149*1956/2000,3) -> 5.217
B150: 三星单双个数：全双 | E150: =1/8 -> 0.125 | F150: 1 | G150: =ROUND((1/E150)*F150,3) -> 8 | H150: =ROUND(2*G150*1800/2000,3) -> 14.4 | I150: =ROUND(2*G150*1956/2000,3) -> 15.648
A151: 牛牛 | B151: 无牛 | C151: 牛牛～牛9为开奖号码中任意三个数相加个位数为0，另外两个数字相加的个位数为牛的所选号码，即为中奖。 | D151: 牛1～牛9：开奖号码中任意三位数相加个位数可以为0，另外两个数字相加的个位数为所选号码，即为中奖；无牛：开奖号码中任意三位数相加个位数都不是0，即为中奖；牛牛：开奖号码中任意三位数相加个位数可以为0，另外两个数字相加的个位数为0，即为中奖。牛大：选号：大，开奖：04689牛大：牛7＝(0+4+6)、(8+9)，牛6～牛牛为大；牛小：选号：小，开奖：04685牛小：牛3＝(0+4+6)、(8+5)，牛1～牛5为小；牛单：选号：单，开奖04685单号：牛3＝(0+4+6)、(8+5)，牛1/3/5/7/9；牛双：选号：双，开奖04684双号：牛2＝(0+4+6)、(8+4)，牛2/4/6/8/0牛质：牛1、牛2、牛3、牛5、牛7牛合：牛4、牛6、牛8、牛9、牛牛 | E151: =35649/100000 -> 0.35649 | F151: 1 | G151: =ROUND((1/E151)*F151,3) -> 2.805 | H151: =ROUND(2*G151*1800/2000,3) -> 5.049 | I151: =ROUND(2*G151*1956/2000,3) -> 5.487
B152: 牛1 | E152: =6375/100000 -> 0.06375 | F152: 1 | G152: =ROUND((1/E152)*F152,3) -> 15.686 | H152: =ROUND(2*G152*1800/2000,3) -> 28.235 | I152: =ROUND(2*G152*1956/2000,3) -> 30.682
B153: 牛2 | E153: =6505/100000 -> 0.06505 | F153: 1 | G153: =ROUND((1/E153)*F153,3) -> 15.373 | H153: =ROUND(2*G153*1800/2000,3) -> 27.671 | I153: =ROUND(2*G153*1956/2000,3) -> 30.07
B154: 牛3 | E154: =6375/100000 -> 0.06375 | F154: 1 | G154: =ROUND((1/E154)*F154,3) -> 15.686 | H154: =ROUND(2*G154*1800/2000,3) -> 28.235 | I154: =ROUND(2*G154*1956/2000,3) -> 30.682
B155: 牛4 | E155: =6505/100000 -> 0.06505 | F155: 1 | G155: =ROUND((1/E155)*F155,3) -> 15.373 | H155: =ROUND(2*G155*1800/2000,3) -> 27.671 | I155: =ROUND(2*G155*1956/2000,3) -> 30.07
B156: 牛5 | E156: =6375/100000 -> 0.06375 | F156: 1 | G156: =ROUND((1/E156)*F156,3) -> 15.686 | H156: =ROUND(2*G156*1800/2000,3) -> 28.235 | I156: =ROUND(2*G156*1956/2000,3) -> 30.682
B157: 牛6 | E157: =6505/100000 -> 0.06505 | F157: 1 | G157: =ROUND((1/E157)*F157,3) -> 15.373 | H157: =ROUND(2*G157*1800/2000,3) -> 27.671 | I157: =ROUND(2*G157*1956/2000,3) -> 30.07
B158: 牛7 | E158: =6375/100000 -> 0.06375 | F158: 1 | G158: =ROUND((1/E158)*F158,3) -> 15.686 | H158: =ROUND(2*G158*1800/2000,3) -> 28.235 | I158: =ROUND(2*G158*1956/2000,3) -> 30.682
B159: 牛8 | E159: =6505/100000 -> 0.06505 | F159: 1 | G159: =ROUND((1/E159)*F159,3) -> 15.373 | H159: =ROUND(2*G159*1800/2000,3) -> 27.671 | I159: =ROUND(2*G159*1956/2000,3) -> 30.07
B160: 牛9 | E160: =6375/100000 -> 0.06375 | F160: 1 | G160: =ROUND((1/E160)*F160,3) -> 15.686 | H160: =ROUND(2*G160*1800/2000,3) -> 28.235 | I160: =ROUND(2*G160*1956/2000,3) -> 30.682
B161: 牛牛 | E161: =6456/100000 -> 0.06456 | F161: 1 | G161: =ROUND((1/E161)*F161,3) -> 15.489 | H161: =ROUND(2*G161*1800/2000,3) -> 27.88 | I161: =ROUND(2*G161*1956/2000,3) -> 30.296
B162: 牛大 | E162: =E157+E158+E159+E160+E161 -> 0.32216 | F162: 1 | G162: =ROUND((1/E162)*F162,3) -> 3.104 | H162: =ROUND(2*G162*1800/2000,3) -> 5.587 | I162: =ROUND(2*G162*1956/2000,3) -> 6.071
B163: 牛小 | E163: =E152+E153+E154+E155+E156 -> 0.32135 | F163: 1 | G163: =ROUND((1/E163)*F163,3) -> 3.112 | H163: =ROUND(2*G163*1800/2000,3) -> 5.602 | I163: =ROUND(2*G163*1956/2000,3) -> 6.087
B164: 牛单 | E164: =E152+E154+E156+E158+E160 -> 0.31875 | F164: 1 | G164: =ROUND((1/E164)*F164,3) -> 3.137 | H164: =ROUND(2*G164*1800/2000,3) -> 5.647 | I164: =ROUND(2*G164*1956/2000,3) -> 6.136
B165: 牛双 | E165: =E153+E155+E157+E159+E161 -> 0.32476 | F165: 1 | G165: =ROUND((1/E165)*F165,3) -> 3.079 | H165: =ROUND(2*G165*1800/2000,3) -> 5.542 | I165: =ROUND(2*G165*1956/2000,3) -> 6.023
B166: 牛质 | E166: =E152+E153+E154+E156+E158 -> 0.32005 | F166: 1 | G166: =ROUND((1/E166)*F166,3) -> 3.125 | H166: =ROUND(2*G166*1800/2000,3) -> 5.625 | I166: =ROUND(2*G166*1956/2000,3) -> 6.113
B167: 牛合 | E167: =E155+E157+E159+E160+E161 -> 0.32346 | F167: 1 | G167: =ROUND((1/E167)*F167,3) -> 3.092 | H167: =ROUND(2*G167*1800/2000,3) -> 5.566 | I167: =ROUND(2*G167*1956/2000,3) -> 6.048
A168: 梭哈 | B168: 五条 | C168: 以下玩法皆不限顺序。1、五条：开出五个号码中五个相同，如：00000、99999 2、炸弹：开出五个号码中四个相同，如：10000、22221 3、葫芦：开出五个号码中三个相同(三条)及两个号码相同(一对)，如：11222、33444 4、顺子：开出五个号码从小到大排列为01234、12345、23456、34567、45678、56789、06789、01789、 01289、01239 5.5、三条：开出五个号码中三个相同(三条)及两个号码不相同，如：12333、66678 6、两对：开出五个号码中有两组相同，如：00112 、36677 7、单对：开出五个号码中只有一组相同，如：00123、13556 8、散号：开出五个号码没有任何相同或相关联（不含顺子），如：12356、 01345、34678、12579。 | D168: 投注方案：炸弹开奖号码：00001，即中牛牛梭哈 | E168: =10/100000 -> 0.0001 | F168: 1 | G168: =ROUND((1/E168)*F168,3) -> 10000 | H168: =ROUND(2*G168*1800/2000,3) -> 18000 | I168: =ROUND(2*G168*1956/2000,3) -> 19560
B169: 炸弹 | E169: =450/100000 -> 0.0045 | F169: 1 | G169: =ROUND((1/E169)*F169,3) -> 222.222 | H169: =ROUND(2*G169*1800/2000,3) -> 400 | I169: =ROUND(2*G169*1956/2000,3) -> 434.666
B170: 葫芦 | E170: =900/100000 -> 0.009 | F170: 1 | G170: =ROUND((1/E170)*F170,3) -> 111.111 | H170: =ROUND(2*G170*1800/2000,3) -> 200 | I170: =ROUND(2*G170*1956/2000,3) -> 217.333
B171: 顺子 | E171: =1200/100000 -> 0.012 | F171: 1 | G171: =ROUND((1/E171)*F171,3) -> 83.333 | H171: =ROUND(2*G171*1800/2000,3) -> 149.999 | I171: =ROUND(2*G171*1956/2000,3) -> 162.999
B172: 三条 | E172: =7200/100000 -> 0.072 | F172: 1 | G172: =ROUND((1/E172)*F172,3) -> 13.889 | H172: =ROUND(2*G172*1800/2000,3) -> 25 | I172: =ROUND(2*G172*1956/2000,3) -> 27.167
B173: 两对 | E173: =10800/100000 -> 0.108 | F173: 1 | G173: =ROUND((1/E173)*F173,3) -> 9.259 | H173: =ROUND(2*G173*1800/2000,3) -> 16.666 | I173: =ROUND(2*G173*1956/2000,3) -> 18.111
B174: 单对 | E174: =50400/100000 -> 0.504 | F174: 1 | G174: =ROUND((1/E174)*F174,3) -> 1.984 | H174: =ROUND(2*G174*1800/2000,3) -> 3.571 | I174: =ROUND(2*G174*1956/2000,3) -> 3.881
B175: 散号 | E175: =29040/100000 -> 0.2904 | F175: 1 | G175: =ROUND((1/E175)*F175,3) -> 3.444 | H175: =ROUND(2*G175*1800/2000,3) -> 6.199 | I175: =ROUND(2*G175*1956/2000,3) -> 6.736
A176: 趣味 | B176: 一帆风顺 | C176: 从0-9中任意选择1个号码组成一注，只要开奖号码的万位,千位,百位,十位,个位中包含所选号码, 即为中奖。 | D176: 如：投注方案：8，至少出现1个8，即中一帆风顺。 | E176: =40951/100000 -> 0.40951 | F176: 1 | G176: =ROUND((1/E176)*F176,3) -> 2.442 | H176: =ROUND(2*G176*1800/2000,3) -> 4.396 | I176: =ROUND(2*G176*1956/2000,3) -> 4.777
B177: 好事成双 | C177: 从0-9中任意选择1个号码组成一注，只要所选号码在开奖号码的万位,千位,百位,十位,个位中出现2次相同，即为中奖。 | D177: 如：投注方案：8；至少出现2个8，即中好事成双。 | E177: =8146/100000 -> 0.08146 | F177: 1 | G177: =ROUND((1/E177)*F177,3) -> 12.276 | H177: =ROUND(2*G177*1800/2000,3) -> 22.097 | I177: =ROUND(2*G177*1956/2000,3) -> 24.012
B178: 三星报喜 | C178: 从0-9中任意选择1个号码组成一注，只要所选号码在开奖号码的万位,千位,百位,十位,个位中出现3次,即为中奖。 | D178: 如：投注方案：8：开奖号码，三重号，即中三星报喜。 | E178: =856/100000 -> 0.00856 | F178: 1 | G178: =ROUND((1/E178)*F178,3) -> 116.822 | H178: =ROUND(2*G178*1800/2000,3) -> 210.28 | I178: =ROUND(2*G178*1956/2000,3) -> 228.504
B179: 四季发财 | C179: 从从0-9中任意选择1个号码组成一注，只要所选号码在开奖号码的万位,千位,百位,十位,个位中出现4次,即为中奖。 | D179: 如：投注方案：8；至少出现4个8，即为四季发财。 | E179: =46/100000 -> 0.00046 | F179: 1 | G179: =ROUND((1/E179)*F179,3) -> 2173.913 | H179: =ROUND(2*G179*1800/2000,3) -> 3913.043 | I179: =ROUND(2*G179*1956/2000,3) -> 4252.174
A180: 直选跨度 | B180: 二星跨度：0 | C180: 所选数值等于开奖号码的前两位最大与最小数字相减之差，即为中奖。 | D180: 投注跨度号码2，开奖1.3.x.x.x(不限顺序)，『3-1＝2』即为中奖。 | E180: =10/100 -> 0.1 | F180: 10 | G180: =ROUND((1/E180)*F180,3) -> 100 | H180: =ROUND(2*G180*1800/2000,3) -> 180 | I180: =ROUND(2*G180*1956/2000,3) -> 195.6
B181: 二星跨度：1 | E181: =18/100 -> 0.18 | F181: 18 | G181: =ROUND((1/E181)*F181,3) -> 100 | H181: =ROUND(2*G181*1800/2000,3) -> 180 | I181: =ROUND(2*G181*1956/2000,3) -> 195.6
B182: 二星跨度：2 | E182: =16/100 -> 0.16 | F182: 16 | G182: =ROUND((1/E182)*F182,3) -> 100 | H182: =ROUND(2*G182*1800/2000,3) -> 180 | I182: =ROUND(2*G182*1956/2000,3) -> 195.6
B183: 二星跨度：3 | E183: =14/100 -> 0.14 | F183: 14 | G183: =ROUND((1/E183)*F183,3) -> 100 | H183: =ROUND(2*G183*1800/2000,3) -> 180 | I183: =ROUND(2*G183*1956/2000,3) -> 195.6
B184: 二星跨度：4 | E184: =12/100 -> 0.12 | F184: 12 | G184: =ROUND((1/E184)*F184,3) -> 100 | H184: =ROUND(2*G184*1800/2000,3) -> 180 | I184: =ROUND(2*G184*1956/2000,3) -> 195.6
B185: 二星跨度：5 | E185: =10/100 -> 0.1 | F185: 10 | G185: =ROUND((1/E185)*F185,3) -> 100 | H185: =ROUND(2*G185*1800/2000,3) -> 180 | I185: =ROUND(2*G185*1956/2000,3) -> 195.6
B186: 二星跨度：6 | E186: =8/100 -> 0.08 | F186: 8 | G186: =ROUND((1/E186)*F186,3) -> 100 | H186: =ROUND(2*G186*1800/2000,3) -> 180 | I186: =ROUND(2*G186*1956/2000,3) -> 195.6
B187: 二星跨度：7 | E187: =6/100 -> 0.06 | F187: 6 | G187: =ROUND((1/E187)*F187,3) -> 100 | H187: =ROUND(2*G187*1800/2000,3) -> 180 | I187: =ROUND(2*G187*1956/2000,3) -> 195.6
B188: 二星跨度：8 | E188: =4/100 -> 0.04 | F188: 4 | G188: =ROUND((1/E188)*F188,3) -> 100 | H188: =ROUND(2*G188*1800/2000,3) -> 180 | I188: =ROUND(2*G188*1956/2000,3) -> 195.6
B189: 二星跨度：9 | E189: =2/100 -> 0.02 | F189: 2 | G189: =ROUND((1/E189)*F189,3) -> 100 | H189: =ROUND(2*G189*1800/2000,3) -> 180 | I189: =ROUND(2*G189*1956/2000,3) -> 195.6
B190: 三星跨度：0 | C190: 所选数值等于开奖号码的三星最大与最小数字相减之差，即为中奖。 | D190: 投注跨度号码2，开奖1.2.3.xx(不限顺序)，『3-1=2』即为中奖。 | E190: =10/1000 -> 0.01 | F190: 10 | G190: =ROUND((1/E190)*F190,3) -> 1000 | H190: =ROUND(2*G190*1800/2000,3) -> 1800 | I190: =ROUND(2*G190*1956/2000,3) -> 1956
B191: 三星跨度：1和9 | E191: =54/1000 -> 0.054 | F191: 54 | G191: =ROUND((1/E191)*F191,3) -> 1000 | H191: =ROUND(2*G191*1800/2000,3) -> 1800 | I191: =ROUND(2*G191*1956/2000,3) -> 1956
B192: 三星跨度：2和8 | E192: =96/1000 -> 0.096 | F192: 96 | G192: =ROUND((1/E192)*F192,3) -> 1000 | H192: =ROUND(2*G192*1800/2000,3) -> 1800 | I192: =ROUND(2*G192*1956/2000,3) -> 1956
B193: 三星跨度：3和7 | E193: =126/1000 -> 0.126 | F193: 126 | G193: =ROUND((1/E193)*F193,3) -> 1000 | H193: =ROUND(2*G193*1800/2000,3) -> 1800 | I193: =ROUND(2*G193*1956/2000,3) -> 1956
B194: 三星跨度：4和6 | E194: =144/1000 -> 0.144 | F194: 144 | G194: =ROUND((1/E194)*F194,3) -> 1000 | H194: =ROUND(2*G194*1800/2000,3) -> 1800 | I194: =ROUND(2*G194*1956/2000,3) -> 1956
B195: 三星跨度：5 | E195: =150/1000 -> 0.15 | F195: 150 | G195: =ROUND((1/E195)*F195,3) -> 1000 | H195: =ROUND(2*G195*1800/2000,3) -> 1800 | I195: =ROUND(2*G195*1956/2000,3) -> 1956
A196: 组选包胆 | B196: 二星包胆 | C196: 从0-9中任意选择1个包胆号码，开奖号码的万位、千位中任意1位包含所选的包胆号码相同（不含对子号），即为中奖。 | D196: 投注方案：包胆号码8；开奖号码前二位：出现1个8（不包括2个8），即中前二组选。 | E196: =18/100 -> 0.18 | F196: 9 | G196: =ROUND((1/E196)*F196,3) -> 50 | H196: =ROUND(2*G196*1800/2000,3) -> 90 | I196: =ROUND(2*G196*1956/2000,3) -> 97.8
B197: 三星包胆：组三 | C197: 从0～9中任意选择1个包胆号码，开奖号码的前三位中任意1位与所选包胆号码相同(不含豹子)，即为中奖。 | D197: 投注包胆号码3：开奖号码前三位：(1)出现3xx或者33x，即中前三组三，(2)出现3xy即中前三组六。 | E197: =54/1000 -> 0.054 | F197: 18 | G197: =ROUND((1/E197)*F197,3) -> 333.333 | H197: =ROUND(2*G197*1800/2000,3) -> 599.999 | I197: =ROUND(2*G197*1956/2000,3) -> 651.999
B198: 三星包胆：组六 | E198: =216/1000 -> 0.216 | F198: 36 | G198: =ROUND((1/E198)*F198,3) -> 166.667 | H198: =ROUND(2*G198*1800/2000,3) -> 300.001 | I198: =ROUND(2*G198*1956/2000,3) -> 326.001
A199: 和值尾数 | B199: 三星和值尾数 | C199: 从0～9中任意选择1个和值尾数号码，开奖号码的前三位和值尾数与投注号码相同，即为中奖。 | D199: 投注和值尾数8，开奖9.3.6.xx，『9+3+6=18』和值尾数为8，即为中奖。 | E199: =100/1000 -> 0.1 | F199: 1 | G199: =ROUND((1/E199)*F199,3) -> 10 | H199: =ROUND(2*G199*1800/2000,3) -> 18 | I199: =ROUND(2*G199*1956/2000,3) -> 19.56
A200: 龙虎斗 | B200: 龙虎：龙/虎 | C200: 从龙虎中任意选择1个龙、虎，开奖号码的万位比个位号码大，中龙，反之中虎，相等中和，中和则返回本金。 | E200: =50/100 -> 0.5 | F200: 1 | G200: =ROUND((1/E200)*F200,3) -> 2 | H200: =ROUND(2*G200*1800/2000,3) -> 3.6 | I200: =ROUND(2*G200*1956/2000,3) -> 3.912
B201: 龙虎斗：龙/虎 | C201: 从龙虎中任意选择1个龙、虎、和，开奖号码的万位比个位号码大，中龙，反之中虎，相等中和。 | D201: 投注『青龙』，开奖号码的万位比个位号码大，即为中奖，反之则为不中奖。 | E201: =45/100 -> 0.45 | F201: 1 | G201: =ROUND((1/E201)*F201,3) -> 2.222 | H201: =ROUND(2*G201*1800/2000,3) -> 4 | I201: =ROUND(2*G201*1956/2000,3) -> 4.346
B202: 龙虎斗：和 | E202: =10/100 -> 0.1 | F202: 1 | G202: =ROUND((1/E202)*F202,3) -> 10 | H202: =ROUND(2*G202*1800/2000,3) -> 18 | I202: =ROUND(2*G202*1956/2000,3) -> 19.56
B203: 玄麟斗：玄/麟 | C203: 从玄麟中任意选择1个玄、麟、和，开奖号码的千位比十位号码大，中玄武，反之中麒麟，相等中和。 | D203: 投注『玄武』，开奖号码的千位比十位号码大，即为中奖，反之则为不中奖。 | E203: =45/100 -> 0.45 | F203: 1 | G203: =ROUND((1/E203)*F203,3) -> 2.222 | H203: =ROUND(2*G203*1800/2000,3) -> 4 | I203: =ROUND(2*G203*1956/2000,3) -> 4.346
B204: 玄麟斗：和 | E204: =10/100 -> 0.1 | F204: 1 | G204: =ROUND((1/E204)*F204,3) -> 10 | H204: =ROUND(2*G204*1800/2000,3) -> 18 | I204: =ROUND(2*G204*1956/2000,3) -> 19.56
A205: 全五中一 | B205: 组选120 | C205: 开奖号码为不重复的五个单号，开奖号码里包含所选号码即为中奖。 | D205: 投注号码9，开奖号码：xyzn9，9xyzn，即为中奖。 | E205: =9*8*7*6*5/100000 -> 0.1512 | F205: 1 | G205: =ROUND((1/E205)*F205,3) -> 6.614 | H205: =ROUND(2*G205*1800/2000,3) -> 11.905 | I205: =ROUND(2*G205*1956/2000,3) -> 12.937
B206: 组选60 | C206: 开奖号码为二重号加三个单号，顺序不限，开奖号码里包含所选号码即为中奖。 | D206: 投注号码9，开奖号码：99xyz，xyz99，即为中奖。 | E206: =20160/100000 -> 0.2016 | F206: 1 | G206: =ROUND((1/E206)*F206,3) -> 4.96 | H206: =ROUND(2*G206*1800/2000,3) -> 8.928 | I206: =ROUND(2*G206*1956/2000,3) -> 9.702
B207: 组选30 | C207: 开奖号码为二重号加二重号加单号，顺序不限，开奖号码里包含所选号码即为中奖。 | D207: 投注号码9，开奖号码：xxyy9，9xxyy，即为中奖。 | E207: =3240/100000 -> 0.0324 | F207: 1 | G207: =ROUND((1/E207)*F207,3) -> 30.864 | H207: =ROUND(2*G207*1800/2000,3) -> 55.555 | I207: =ROUND(2*G207*1956/2000,3) -> 60.37
B208: 组选20 | C208: 开奖号码为三重号加二个单号，顺序不限，开奖号码里包含所选号码即为中奖。 | D208: 投注号码9，开奖号码：999xy，yx999，9xyyy，即为中奖。 | E208: =2160/100000 -> 0.0216 | F208: 1 | G208: =ROUND((1/E208)*F208,3) -> 46.296 | H208: =ROUND(2*G208*1800/2000,3) -> 83.333 | I208: =ROUND(2*G208*1956/2000,3) -> 90.555
B209: 组选10 | C209: 开奖号码为三重号加二重号，顺序不限，开奖号码里包含所选号码即为中奖。 | D209: 投注号码9，开奖号码：999xx，99xxx，即为中奖。 | E209: =180/100000 -> 0.0018 | F209: 1 | G209: =ROUND((1/E209)*F209,3) -> 555.556 | H209: =ROUND(2*G209*1800/2000,3) -> 1000.001 | I209: =ROUND(2*G209*1956/2000,3) -> 1086.668
B210: 组选5 | C210: 开奖号码为四重号加单号，顺序不限，开奖号码里包含所选号码即为中奖。 | D210: 投注号码9，开奖号嘛：9999x，9xxxx，即为中奖。 | E210: =90/100000 -> 0.0009 | F210: 1 | G210: =ROUND((1/E210)*F210,3) -> 1111.111 | H210: =ROUND(2*G210*1800/2000,3) -> 2000 | I210: =ROUND(2*G210*1956/2000,3) -> 2173.333
B211: 组选1 | C211: 开奖号码为五重号，开奖号码里包含所选号码即为中奖。 | D211: 投注号码9，开奖号码：99999，即为中奖。 | E211: =1/100000 -> 0.00001 | F211: 1 | G211: =ROUND((1/E211)*F211,3) -> 100000 | H211: =ROUND(2*G211*1800/2000,3) -> 180000 | I211: =ROUND(2*G211*1956/2000,3) -> 195600
A212: 百家乐 | B212: 庄闲 | C212: 从庄闲中任意选择1个庄、闲，开奖号码万位+千位之和比十位+个位之和大，中庄，反之中闲，如果开出和则不会退还庄闲下注金额。 | D212: 投注『闲』，开奖号码为32698『3+2=5』vs『9+8=7』闲赢。 | E212: =45/100 -> 0.45 | F212: 1 | G212: =ROUND((1/E212)*F212,3) -> 2.222 | H212: =ROUND(2*G212*1800/2000,3) -> 4 | I212: =ROUND(2*G212*1956/2000,3) -> 4.346
B213: 和 | C213: 从平中任意选择1个和，开奖号码万位+千位之和＝十位+个位至和，中和。 | D213: 投注『和』，开奖号码为32614『3+2=5』vs『1+4=5』和赢。 | E213: =10/100 -> 0.1 | F213: 1 | G213: =ROUND((1/E213)*F213,3) -> 10 | H213: =ROUND(2*G213*1800/2000,3) -> 18 | I213: =ROUND(2*G213*1956/2000,3) -> 19.56
B214: 对子 | C214: 从对子中任意选择1个庄或闲，开奖号码『庄』万位=千位相同，中庄对子，『闲』十位=个位相同，中闲对子。 | D214: 投注『庄』，开奖号码为33614，庄对子赢。 | E214: =10/100 -> 0.1 | F214: 1 | G214: =ROUND((1/E214)*F214,3) -> 10 | H214: =ROUND(2*G214*1800/2000,3) -> 18 | I214: =ROUND(2*G214*1956/2000,3) -> 19.56
B215: 豹子 | C215: 从豹子中任意选择1个庄或闲，开奖号码『庄』万位=千位=百位相同，中庄豹子，『闲』百位=十位=个位相同，中闲豹子。 | D215: 投注『庄』，开奖号码为33314，庄豹子赢。 | E215: =1/100 -> 0.01 | F215: 1 | G215: =ROUND((1/E215)*F215,3) -> 100 | H215: =ROUND(2*G215*1800/2000,3) -> 180 | I215: =ROUND(2*G215*1956/2000,3) -> 195.6
B216: 天王 | C216: 从天王中任意选择1个庄或闲，开奖号码『庄』万位+千位的餘數=8点或者9点，中庄天王，『闲』十位+个位的餘數=8点或者9点，中闲天王。 | D216: 投注『庄』，开奖号码为35314，3+5=中庄天王。 | E216: =20/100 -> 0.2 | F216: 1 | G216: =ROUND((1/E216)*F216,3) -> 5 | H216: =ROUND(2*G216*1800/2000,3) -> 9 | I216: =ROUND(2*G216*1956/2000,3) -> 9.78
B217: S6 | C217: 万位+千位的餘數=6，十位+个位的餘數<6，即为中奖。 | D217: 投注『S6』，开奖号码为33912，S6赢。 | E217: =6000/100000 -> 0.06 | F217: 1 | G217: =ROUND((1/E217)*F217,3) -> 16.667 | H217: =ROUND(2*G217*1800/2000,3) -> 30.001 | I217: =ROUND(2*G217*1956/2000,3) -> 32.601
A218: 特殊 | B218: 豹子 | C218: 所选的号码特殊属性和开奖号码前3位的属性一致，即为中奖1、豹子号指的是三位数字全部相同2、顺子号指的是三位数字呈现连号状态（09也属于连号）（顺序不限）3、对子号指的是三位数字中有任两码为相同号（出现三个相同号为豹子号，不算对子号）4、半顺号指的是三位数字中，有两个号码呈现连号状态（09也属于连号）（顺序不限）（出现两个相同号即为对子，不算半顺）（出现三个号码呈现连号状态为顺子号，不算半顺号）5、杂六号指的是三位数字中，状态非豹子号、顺子号、对子号、半顺号，即为杂六。 | D218: 投注方案：豹子开奖号码：000xx，即中豹子投注方案：顺子开奖号码：901xx，即中顺子投注方案：对子开奖号码：001xx，即中对子投注方案：半顺开奖号码：904xx，即中半顺投注方案：杂六开奖号码：158xx，即中杂六。 | E218: =1000/100000 -> 0.01 | F218: 1 | G218: =ROUND((1/E218)*F218,3) -> 100 | H218: =ROUND(2*G218*1800/2000,3) -> 180 | I218: =ROUND(2*G218*1956/2000,3) -> 195.6
B219: 顺子 | E219: =6000/100000 -> 0.06 | F219: 1 | G219: =ROUND((1/E219)*F219,3) -> 16.667 | H219: =ROUND(2*G219*1800/2000,3) -> 30.001 | I219: =ROUND(2*G219*1956/2000,3) -> 32.601
B220: 对子 | E220: =27000/100000 -> 0.27 | F220: 1 | G220: =ROUND((1/E220)*F220,3) -> 3.704 | H220: =ROUND(2*G220*1800/2000,3) -> 6.667 | I220: =ROUND(2*G220*1956/2000,3) -> 7.245
B221: 半顺 | E221: =36000/100000 -> 0.36 | F221: 1 | G221: =ROUND((1/E221)*F221,3) -> 2.778 | H221: =ROUND(2*G221*1800/2000,3) -> 5 | I221: =ROUND(2*G221*1956/2000,3) -> 5.434
B222: 杂六 | E222: =30000/100000 -> 0.3 | F222: 1 | G222: =ROUND((1/E222)*F222,3) -> 3.333 | H222: =ROUND(2*G222*1800/2000,3) -> 5.999 | I222: =ROUND(2*G222*1956/2000,3) -> 6.519
A223: 射龙门 | B223: 射中龙门 | C223: 分别为投注前三码【万千百】、中三码【千百十】、后三码【百十个】位置里的号码，比较三码内中位号码与前位、后位号码关系为范围内、范围外或任一号相等。 | D223: 中位球号介于前位、后位的球门范围内。举例：投注前三码射中龙门 共1注。开奖结果前三码为：123** 中位号码2介于1到3范围内，视为中奖。 | E223: =240/1000 -> 0.24 | F223: 1 | G223: =ROUND((1/E223)*F223,3) -> 4.167 | H223: =ROUND(2*G223*1800/2000,3) -> 7.501 | I223: =ROUND(2*G223*1956/2000,3) -> 8.151
B224: 撞柱 | D224: 撞柱：中位球号与前位、后位的球门任一号相同。举例：投注中三码撞柱 共1注。开奖结果中三码为：*233* 中位号码3与后位号码3相同，视为中奖。 | E224: =190/1000 -> 0.19 | F224: 1 | G224: =ROUND((1/E224)*F224,3) -> 5.263 | H224: =ROUND(2*G224*1800/2000,3) -> 9.473 | I224: =ROUND(2*G224*1956/2000,3) -> 10.294
B225: 不中 | D225: 不中：中位球号介于前位、后位的球门范围外。举例：投注后三码不中 共1注。开奖结果后三码为：**151 中位号码5介于1之外，视为中奖。 | E225: =570/1000 -> 0.57 | F225: 1 | G225: =ROUND((1/E225)*F225,3) -> 1.754 | H225: =ROUND(2*G225*1800/2000,3) -> 3.157 | I225: =ROUND(2*G225*1956/2000,3) -> 3.431